	Title	Location	Company	Salary	Synopsis
0	Data Scientist	Carrollton, TX 75006	Crescent Bank	Estimated $81.9K - $104K a year	Knowledge of data mining tools such as SQL, SAS, R and Python.Experience with statistical models and analytical work will also lead to success as well as…
1	Healthcare Data Scientist	Irving, TX 75062 (Las Colinas Urban Center area)	Vizient, Inc.	$99,300 - $147,700 a year	Conduct exploratory data analysis from complex, disparate data sources to recognize patterns, and identify member performance improvement opportunities.
2	Data Science Associate	Arlington, TX 76019 (Central area)+7 locations	Fisher Investments	Estimated $58.7K - $74.3K a year	Be a part of our data modernization efforts through the implementation of new data architecture, cloud, and machine learning technology.
3	Data Scientist	Dallas, TX	The Burchell Group Inc.	$110,000 - $155,000 a year	Experience querying data using SQL.The data scientist role is within the risk management department and provides analytics with the goal of reducing losses in…
4	Data Scientist - Remote	Remote in Dallas, TX	Infinity Consulting Solutions	$120,000 - $150,000 a year	Solid data manipulation skills with structured and non-structured data.Strong problem-solving skills and the ability to structure business problems into data…
5	Senior Data Analyst	Remote in Texas	Hire With Jarvis	$120,000 - $170,000 a year	Expertise in SQL and data visualization.Experience working with relational data models and statistical principles.This is a fully remote permanent position.
6	Senior Data Scientist - NLP	Remote in Dallas, TX 75226	CyberCoders	$130,000 - $160,000 a year	As our Senior Data Scientist, you'll be using Machine Learning and Natural Language Processing to analyze speech and text data from customer and client…
7	Remote Machine Learning Engineer	Remote in Dallas, TX 75226	CyberCoders	$170,000 - $200,000 a year	Experience with data pipelines, real-time systems, and high-performance computing.Design, prototype, and implement machine learning algorithms and software…
8	Junior Data Scientist	Southlake, TX 76092	Conestoga Energy Partners LLC	Estimated $64.9K - $82.1K a year	The Junior Data Scientist will assist in the continued growth in the business of trading and logistics of renewable fuels and carbon offsets.
9	Data Scientist II	Remote in Dallas, TX 75201	Federal Reserve Bank of Dallas	Estimated $89K - $113K a year	Hands on SQL experience obtaining data from data sources.Develop and maintain infrastructure systems that connect internal data sets; create new data…
10	Data Scientist	Irving, TX	Data Xpander	Estimated $86.7K - $110K a year	They need to have statistical, mathematical, predictive modelling as well as business strategy skills to build the algorithms necessary to ask the right…
11	Data Scientist (100% Remote)	Remote in Dallas, TX 75219	Frontdoor	Estimated $125K - $158K a year	Solid foundation in data structures and algorithms.Process massive amounts of structured and unstructured data.Run A/B test experiments and analyze results.
12	Data Scientist	Remote in Dallas, TX	Circle	Estimated $118K - $149K a year	Identify data, metrics and analyses needs for business partners; Initiate, develop and maintain data pipelines and data models that powers dashboards and data…
13	Data Scientist	Dallas, TX 75261	Certegy Payment Solutions, LLC	Estimated $101K - $127K a year	Experience querying data using SQL.The data scientist role is within the risk management department and provides analytics with the goal of reducing losses in…
14	Senior Data Scientist at Rent-to-Own Startup	Remote in Watauga, TX 76148+2 locations	Recruiting From Scratch	$120,000 - $190,000 a year	You have 3+ years of experience working in data science.Day to day, you will perform a mix of exploratory data analysis, statistical modeling, software…
15	Principal Data Scientist	Lewisville, TX 75067	Full Cycle Services	$120,000 - $130,000 a year	Experience preparing, preprocessing, and analyzing data such as macroeconomics and other external data to monitor consumer financial health as well as monitor…
16	Data Scientist - Remote	Remote in Dallas, TX 75254	Infinity Consulting Solutions, Inc.	$120,000 - $150,000 a year	Solid data manipulation skills with structured and non-structured data.Strong problem-solving skills and the ability to structure business problems into data…
17	Data Scientist	Dallas, TX	Cyber Infotech	Estimated $91.3K - $116K a year	Identify patterns & trends in data, and provides insights to enhance business decision making.Build, implement and maintain predictive models through their…
18	Principal Financial Data Scientist	Dallas, TX	Kaizen Analytix	$90 - $105 an hour	Hands on data extraction and data wrangling from internal and external systems using SAS, SQL, Python, R, etc.Familiarity with CECL Loss Forecasting Model.
19	Senior Data Scientist - Sam's Technology	Dallas, TX (Downtown area)	Walmart Global Tech	From $100,000 a year	Build complex data sets from multiple data sources, both internally and externally.As a Data Scientist, you are responsible for building large data sets from…
20	Data Scientist	Remote in Irving, TX 75039	Peoplevisor LLC	Estimated $115K - $146K a year	Develop custom data models and algorithms to apply to data sets.Assess the effectiveness and accuracy of new data sources and data gathering techniques.
21	Data Scientist	Dallas, TX 75201	AArete	Estimated $95K - $120K a year	Develop custom data models and algorithms to apply to data sets.Experience performing data quality assurance and manipulation and.
22	Senior Data Scientist	Remote in Dallas, TX	Bankers Healthcare Group	Estimated $125K - $158K a year	Modeling experience with FCRA-regulated data (e.g. credit bureau attributes) is a plus.Strong communication skills: written, verbal, presentation, and…
23	Information Security Data Scientist (Remote)	Remote in Dallas, TX	Lucid Technologies Inc	Estimated $116K - $147K a year	Sound understanding of business intelligence best practices, relational data structures, data modeling, data mart and reporting techniques.
24	Sr. Data Scientist	Irving, TX 75063 (Freeport/Hackberry area)	Cortex Management, LLC	Estimated $112K - $142K a year	Participate and lead data studies with external parties such as Transunion, Experian, Equifax and other data sources to improve the efficiency of the algorithms…
25	Senior Data Scientist	Dallas, TX	FLYR Labs	Estimated $116K - $147K a year	3+ years of professional experience as a data scientist building models with direct commercial applicability.Our hyper-accurate contextual forecasts enable the…
26	Data Scientist	Dallas, TX 75225 (North Dallas area)	Welltower	Estimated $97.3K - $123K a year	Experience with data mining and data visualization tools, such as Alteryx, Tableau etc.Knowledge of data and analytics landscape.
27	Data Scientist, Staff / Manager	Remote in Dallas, TX	LTK USA	Estimated $134K - $170K a year	Serve as organization mentor and 'go-to' thought leader for data scientists, analysts, developers, and others interested in the field.
28	Senior Data Scientist	Remote in Dallas, TX	Juul Labs	Estimated $132K - $168K a year	Proficiency in advanced SQL, data modeling and ETL.Must have a strong ability to translate business problems into data driven solutions.
29	Data Scientist	Dallas, TX 75206 (M Streets area)	Hearst Media Services	Estimated $105K - $133K a year	You will join a team of data specialists but will “slice and dice” data using your own methods, creating new visions for the future.
30	Senior Data Scientist || Onsite role in Dallas,TX	Dallas, TX 75342 (Downtown area)	Xiartech inc	$60 - $70 an hour	Continue to develop our data science capabilities through technical research, collaboration with subject matter experts (both internal and external) and new…
31	Senior Data Scientist	Remote in Dallas, TX 75201	AArete	Estimated $122K - $155K a year	Develop custom data models and algorithms to apply to data sets.Experience with Healthcare data analytics is necessary.
32	Lead Data Scientist/Sr. Manager, Tableau	Dallas, TX 75201 (Downtown area)	Salesforce	$142,400 a year	The Di team is made up of data scientists, engineers, and analysts who are dedicated to driving product and distribution strategy with data-driven insights.
33	Senior Data Analyst	Remote in Dallas, TX 75201	High Level	Estimated $78.5K - $99.3K a year	Acquire data from primary data sources including Stripe,Chartmogul, Pendo and the HighLevel app, and maintain databases/data systems.
34	Senior Data Scientist/Machine Learning Engineer	Dallas, TX 75201 (Downtown area)	Salesforce	$82,400 a year	Build tools to monitor data pipeline performance, data quality and models in production.Experience working as part of a data team working with mature data…
35	Director, Quantitative Analytics and Data Science	Remote in Arlington, TX	Gartner	Estimated $123K - $155K a year	As a senior quantitative expert, this individual will lead quantitative research workstreams, drive the creation of strong evidence-based insights, and champion…
36	Data Scientist - REMOTE Role in Texas	Remote in Dallas, TX 75201	RxLive	Estimated $120K - $153K a year	Develop custom data models and algorithms to apply to data sets.Assess the effectiveness and accuracy of new data sources and data gathering techniques.
37	Director, Data Science	Dallas, TX 75202 (Downtown area)	Bain & Company	Estimated $143K - $181K a year	3+ years of experience managing data scientists.Translate business objectives into data and analytics solutions and, translate results into business insights…
38	Director of Data Science	Dallas, TX 75254 (Far North area)	VIZIO, Inc.	$225,000 a year	Proficient with modern big data technologies and CI/CD frameworks.Track record of delivering data-driven products, insights, and influencing product and…
39	Senior Data Scientist	Dallas, TX	Tricolor Auto Group	Estimated $88.2K - $112K a year	Experience in practical data processing working with large scale datasets and Big Data environment, data mining, text mining and information retrieval tasks.
40	Sr. Data Scientist	Addison, TX 75001	National Life Group	Estimated $112K - $142K a year	Strong knowledge of data architecture, data modeling and data integration best practices.In partnership with data analysts, data engineers, data architect and…
41	Senior Data Scientist	Dallas, TX	Qcentrio	Estimated $141K - $178K a year	Desire to expand knowledge in Big Data and the overall data ecosystem.Ability to handle and summarize large data sets using SQL or Hive-SQL or Spark.
42	Associate Data & Machine Learning Engineer	Dallas, TX	Amazon Web Services, Inc.	$82,600 a year	Hands on experience working on large-scale data science/data analytics projects.Hands on experience with building data or machine learning pipeline.
43	Data Science Manager	Dallas, TX 75202 (Downtown area)+1 location	Bain & Company	Estimated $121K - $153K a year	Train relevant AAG team members to support big data/data science initiatives.Develop, prototype, test, and deploy machine learning solutions on wide ranging…
44	Data Plane Engineer	Remote in Watauga, TX 76148+3 locations	Recruiting From Scratch	$140,000 - $200,000 a year	Troubleshooting and optimizing data path.Architect the next generation 5G base station on a chip’s data path.Strong programming experience in c/c++.
45	Developer/Data Engineer/Data Scientist, Fundamental Equities	Dallas, TX	Millennium Management LLC	None	Minimum of 1+ years of data engineering or quantitative experience required, preferably working with data at a bank or investment firm.
46	Senior Data Scientist (Remote)	Remote in Dallas, TX 75218	New Relic	Estimated $121K - $153K a year	Work with Statistical computer languages Python, SQL, and libraries (NumPy, Pandas) to manipulate data and draw insights from large data sets.
47	Head of Machine Learning - Document Analysis and NLP	Remote in Watauga, TX 76148+20 locations	Recruiting From Scratch	$140,000 - $200,000 a year	Given you are constructing the foundation on which our client's global data infrastructure will be built, you need to pay close attention to detail and maintain…
48	Senior Data Scientist - Marketing Analytics	Hybrid remote in Irving, TX 75038	Cottonwood Financial	$135,000 a year	Understanding of credit bureau data and credit performance.Work closely with the Marketing team to manage media channels by monitoring trends, extracting and…
49	GCP Sr. Big Data Engineer	Irving, TX	Kairos Technologies	$65 - $75 an hour	Experience in data visualization tools like Kibana, Grafana, Tableau and associated architectures.The architect will design and implement enterprise…
50	Predictive Modeling Analyst	Remote in Dallas, TX	LTK USA	Estimated $75.3K - $95.3K a year	Make use of data to create visualizations to explain results in a clear and concise manner.The PMA will gather information from multiple teams, including other…
51	Data Science Manager	Dallas, TX 75201	Spectral MD Inc	Estimated $114K - $145K a year	Lead a team of 3-5 data scientists and data engineers.Work with statisticians to perform data analysis and write data analysis reports.
52	Senior Data Analyst	Dallas, TX 75201 (Uptown area)	HollyFrontier Corporation	Estimated $78.7K - $99.7K a year	Works with data owners to gather and process data from multiple systems, and ensure the data is of sufficient quality.
53	Machine Learning Engineer	Irving, TX	TRUST TECHNOLOGIES LLC	$91,130 - $118,874 a year	Design and implement conversational AI ML models, chat bots and Natural Language Processing (NLP).Experience in Python and Data Analytics.
54	DevOps Engineer - Machine Learning	Dallas, TX	Logic20/20 Inc.	Estimated $116K - $147K a year	As a DevOps Engineer on this project, you’ll build infrastructure to support wildfire mitigation as well as increase customer safety.
55	Machine Learning	Irving, TX 75038	INFRAPOD TECHNOLOGIES	Estimated $87.2K - $110K a year	Machine Learning makes use of data for deriving decisions, and when data is stored in the cloud, it is easier to refer the information for precise purposes.
56	Senior Manager of Data Science - Sam's Technology	Dallas, TX (Downtown area)	Walmart Global Tech	From $140,000 a year	Lead data scientist and ML engineers to build innovative solutions from complex data sets using multiple data sources, both internally and externally.
57	Sr Data Analyst	Hybrid remote in Dallas, TX+1 location	West Monroe	Estimated $92.3K - $117K a year	Acquire data from people data sources (ADP, Workday, Greenhouse, Culture Amp, etc) and maintain databases/data systems and audit data for accuracy.
58	Training and Placement in Java, Data Science, Data Engineeri...	Dallas, TX	TechIntelli Solutions, Inc.	$50,000 - $90,000 a year	Big data Developer and all technology's related to IT.These training programs will last approximately 4 to 5 weeks.Job Types: Full-time, Contract.
59	Lead Data Scientist	Dallas, TX 75202 (Downtown area)	Integrity Marketing Group	None	Interpret data, extract trends and created recommended action plans from data and statistical analysis.Expert level skills around data visualization setup and…
60	Senior Data Analyst	Dallas, TX 75247 (Northwest Dallas area)	A-max Insurance Services Inc	Estimated $75.4K - $95.4K a year	Build a strong relationship with data and product engineering to understand data availability, accuracy, and consistency; comfortable providing specifications…
61	Sr. Systems and Data Analyst	Dallas, TX	Atmos Energy	Estimated $74K - $93.6K a year	Pull, prepare, model, report, and analyze internal and external data to drive actionable insights for analysis, enhancements to processes, metrics, and business…
62	Senior Machine Learning Operations (MLOps)	Remote in Dallas, TX	Talkdesk	Estimated $143K - $181K a year	Experience with data lake platforms such as Databricks or Snowflake.MLOps experience in a high data volume environment, 5+ years, enterprise-level company…
63	Staff Data Analyst	Dallas, TX 75201	Freedom Financial Network	Estimated $81.4K - $103K a year	You have a strong understanding on how data should be captured within products and services and are able to collaborate & guide the business and data…
64	Data Scientist Machine Learning Engineer	Dallas, TX	Plasma Computing Group	Estimated $109K - $138K a year	Design, develop, train and verify machine learning models to solve complex real-world problems.Deliver high quality software design, documentation and…
65	Report Developer - HYBRID	Dallas, TX 75251 (North Dallas area)	US Anesthesia Partners, Inc.	Estimated $94.5K - $120K a year	3+ years of experience as a data scientist with healthcare background.The Report Developer will work with USAP stakeholders, performing data analysis, data…
66	NLP Engineer at Speech to Text Start Up	Remote in Watauga, TX 76148+6 locations	Recruiting From Scratch	Estimated $123K - $155K a year	Their AI-powered collaborative note-taking app works across Zoom, Google Meet, and Microsoft Teams to help teams record, transcribe, search and share meeting…
67	Statistical Analyst (REMOTE)	Remote in Dallas, TX 75240	Data Axle	Estimated $81.5K - $103K a year	Data Axle is a leading provider of data and data-driven marketing solutions.Broad knowledge of various statistical and data mining methodologies.
68	Senior Marketing Data Analyst	Remote in Arlington, TX+1 location	Circle	Estimated $87.6K - $111K a year	Identifying trends in the data to inform ongoing strategy.Collecting and analyzing data from multiple sources to arrive at critical information for the…
69	Data Engineer	Dallas, TX 75240 (Far North area)	Matador Resources	Estimated $95.4K - $121K a year	Working with end users, design user interfaces to present data in an accurate and actionable format.As part of the Information Technology Team, the Data…
70	Machine Learning Engineer	Irving, TX 75039	Kinetix Trading Solutions Inc	Estimated $92.8K - $118K a year	× Perform Data cleansing / transformation, feature engineering, apply statistical analysis, data visualization, data mining.
71	AI Developer	Southlake, TX 76092	Avodah	Estimated $103K - $130K a year	Design data acquisition and data labeling systems.Establish evaluation metrics, analyze performance, brainstorm, brainstorm future steps, perform exploratory…
72	Analyst I, Statistical (226 Days) REVISED	Dallas, TX	Dallas Independent School District	$76,031 a year	Provide data support for the schools and central staff from the data platforms.Knowledge and/or experience with statistics and data reporting.
73	Artificial Intelligence	Irving, TX 75038	INFRAPOD TECHNOLOGIES	Estimated $85.3K - $108K a year	Using Artificial Intelligence in big data steam can reach out to the potential customer by empowering the Tool with Machine Learning.
74	Sr Data Scientist	Irving, TX	Gartner	Estimated $115K - $146K a year	Experience managing or mentoring junior data scientists preferred.Familiar with the foundational approaches to the major data science disciplines, such as data…
75	Senior Data Analyst - Data Platform	Dallas, TX	FLYR Labs	Estimated $103K - $130K a year	Experience with data warehouses and data visualization platforms.Work closely with data warehouse architects and data engineers to design and implement the…
76	Research Analyst, (Data science)	Dallas, TX	CEDENT	Estimated $76.5K - $96.9K a year	Experience using other programming and data manipulation languages preferred (SQL, Hive, Pig, Python, C/C++, Java); Microsoft Excel / Access etc.
77	Azure Data Architect	Dallas, TX	Catapult Systems	Estimated $125K - $158K a year	Deep understanding of using data and analytics services to solve enterprise data challenges and extensive architecture and design experience with complex…
78	Senior Financial Analyst, Technology and Data Science	Dallas, TX 75201 (Downtown area)	S&P Global	$90,000 - $120,000 a year	The Role: Senior Financial Analyst, Technology and Data Science.The Impact: This role will be a key member of the finance team supporting the S&P Global Market…
79	Principal - Data Engineering	Dallas, TX	Credera Experienced Hiring Job Board	Estimated $139K - $175K a year	Minimum 10 years of hands on development experience with data engineering technologies and background in data architecture, data science, or data management.
80	Analytics and Insights - Data Science Lead	Hybrid remote in Dallas, TX 75251	Rightpoint	Estimated $115K - $146K a year	(previous experience working with clients’ customer data-sets, and within the data-lake environments is highly preferrable).Monthly WFH/cell phone stipend.
81	Director of Marketing - AI, Data Science Services and Soluti...	Remote in Dallas, TX+1 location	Xen.ai	Estimated $122K - $155K a year	Xen.AI is looking for Director of Marketing - AI, Machine Learning and Data Science Services and solutions.This can be a full time or part-time role.
82	Machine Learning Engineer	Irving, TX 75063 (Freeport/Hackberry area)	Spireon	Estimated $106K - $134K a year	Collect data and analyze real world data.Research and develop statistical learning models for data analysis.As a Machine Learning Engineer, you will implement…
83	Sr. Data Analyst - Credit	Dallas, TX 75201	Freedom Financial Network	Estimated $89K - $113K a year	5+ years of experience in data science, quantitative business analysis, and/or statistical analysis; or relevant Master’s Degree / MBA with 2+ years of…
84	NLP Engineer	Dallas, TX	Uniphore	Estimated $95.1K - $120K a year	Study and transform data science prototypes.Understanding of NLP techniques for text representation, semantic extraction techniques, data structures and…
85	Principal Statistical Programmer	Fort Worth, TX	Galderma	Estimated $124K - $157K a year	Create derived data set specifications for all assigned studies and integrated summaries.Develop and review programming plans and specifications at project and…
86	Data Operations Manager: OmniSales (SQL Database/ Machine Le...	Remote in Dallas, TX	Humanity	Estimated $94.3K - $119K a year	Uses logic to analyze data and capability to draw conclusions and convey or provide advice or consultation to business leaders.This is not an admin role.
87	Senior Data Scientist(Lidar)	Dallas, TX	Tiger Analytics	Estimated $97.5K - $123K a year	Familiar with cloud services data analytics platforms and machine learning solutions, e.g., Azure DataBricks.You will develop efficient and accurate analytical…
88	Senior Analyst Statistical Operations (US Remote CST or EST)	Remote in Dallas, TX	Humanity	Estimated $81.3K - $103K a year	Take lead role in recommending and implementing new and improved ways to effectively process data and execute methodologies within Statistical Operations.
89	Architect - Data Engineering	Dallas, TX+2 locations	Credera Experienced Hiring Job Board	Estimated $130K - $165K a year	You have a deep understanding of data governance and data privacy best practices.Our data capabilities help our clients gain competitive advantage by…
90	Statistical Analyst I	Irving, TX 75038 (Cottonwood area)	Medpace, Inc.	Estimated $53K - $67K a year	Knowledge of databases and data management process; and.Communicate the project requirements for cleanup and data capture to ensure the key study variables are…
91	Staff Software Engineer, Machine Learning, Global Engineerin...	Dallas, TX 75202 (Downtown area)	Bain & Company	Estimated $131K - $166K a year	Enable machine learning experimentation for data scientists with data and tools.Enable data and technology for data exploration, wrangling and machine learning…
92	Principal ML & NLP Engineer	Remote in Watauga, TX 76148+2 locations	Recruiting From Scratch	$140,000 - $200,000 a year	Given you are constructing the foundation on which our global data infrastructure will be built, you need to pay close attention to detail and maintain a…
93	Senior Artificial Intelligence Developer	Carrollton, TX 75006	ONX	Estimated $115K - $145K a year	O Predictive failure analysis using time-series data, starting with various motor and compressor devices.The Senior Artificial Intelligence Developer will work…
94	Applied Scientist II	Dallas, TX 75248 (Far North area)	UiPath	Estimated $95.4K - $121K a year	Study and extract relevant information from large amounts data to help in automating the workflows and optimizing key processes.
95	Statistical Ops Analyst (US Remote)	Remote in Dallas, TX	Humanity	Estimated $75.4K - $95.4K a year	Experience handling, manipulating and analyzing data.Take lead role in recommending and implementing new and improved ways to effectively process data and…
96	Senior Data Analyst, Insurance	Remote in Dallas, TX	Bestow	Estimated $86.5K - $110K a year	Write SQL queries that clean, join, and extract data from our data warehouse.Contribute to the maintenance of overall data architecture to ensure data parity…
97	Sr. Staff Analyst (Enterprise)	Dallas, TX 75201	Freedom Financial Network	Estimated $92.4K - $117K a year	Leverage a variety of datasets including internal CRM data, credit data, as well as other 3rd party complimentary data in order to derive unique insights and…
98	Principal - Data Science	Dallas, TX	Credera Experienced Hiring Job Board	Estimated $168K - $213K a year	Our data capabilities help our clients gain competitive advantage by transforming raw data into insights that enable actionable decision making.
99	Senior Machine Learning Architect	Dallas, TX+1 location	Credera Experienced Hiring Job Board	Estimated $174K - $221K a year	Our data capabilities help our clients gain competitive advantage by transforming raw data into insights that enable actionable decision making.
100	Senior Director, Machine Learning Software Engineering	Irving, TX	Gartner	Estimated $158K - $200K a year	Sets the direction for a scientific, data driven approach for decision making in application development.Manages a team of ML engineers and data engineers and…
