	Title	Location	Company	Salary	Synopsis
101	Data Scientist - Entry to Expert Level Virtual Hiring Event	United States	National Security Agency (NSA)	$74,682 - $176,300 a year	Passing this examination is a requirement in order to be considered for selection into a data scientist position.
102	Senior Data Scientist - International	United States	Indeed	$123,000 - $179,000 a year	Passion to answer Product/Engineering questions with data.Can train and deploy deep learning models for natural language data.
103	Director, Data Science- SMB Labs	Remote in United States	Indeed	$214,000 - $310,000 a year	In this role, you will lead teams of machine learning engineers, scientists, and statisticians who exhibit high energy, deep technical skills, and a drive to…
104	Senior Consultant - AI/ML Engineer	United States	Harnham	$140,000 - $150,000 a year	You will also play a leadership role in modestly sized data teams.You will be responsible for delivering on client data science projects from end-to-end.
105	Senior Data Scientist	United States	Good Parents Inc.	From $110,000 a year	REST APIs, data pipelines and annotation tools.Experience or familiarity with data exploration, analysis and visualization tools.
106	Senior Healthcare Data Analyst	United States	New Directions Behavioral Health	None	Experience with enterprise data warehouse and commercial/Medicare/Medicaid claims data.Strong analytic and data management skills.
107	Director, Statistical Programming	Remote in United States	Everest Clinical Research	Estimated $136K - $172K a year	In-depth knowledge of industry standards on how clinical trial data are structured, stored, analyzed, and presented.Manage sponsors and vendor relationship.
108	Sr. Specialist, Quantitative Analytics & Data Science (IT Pr...	Arlington, TX	Gartner	Estimated $82.1K - $104K a year	Oversee and manage critical data assets (e.g., prepare and update data for benchmarks) and enable reuse across the organization, e.g., making data available…
109	Director of Sales & Business Development - AI, Data Science	Remote in Dallas, TX	Xen.ai	None	Xen.AI is looking for Director of Sales & Business Development - AI & Machine Learning solutions, who can bring in AI, Machine Learning, Deep Learning and Data…
110	Sr Principal, Quantitative Analytics and Data Science (HR)	Remote in Arlington, TX	Gartner	Estimated $109K - $138K a year	7+ years of experience in analyzing quantitative and qualitative data to identify relevant findings.Analyze large data sets using advanced statistical…
111	Cloud Data Architect	Remote in United States	Oportun Inc	None	Strong expertise and experience managing complex data platforms through automation.Excellent communication skills to collaborate with the data engineering,…
112	Senior Statistical Programmer	United States	AL2S3 LTD	Up to $150,000 a year	You will be working with some of the most advanced analytics.
113	Principal Statistical Programmer	Remote in United States	Everest Clinical Research	Estimated $121K - $154K a year	Create SDTM mapping specifications and ADaM data specifications.Perform hands on primary statistical programming and validation programming on assigned…
114	Senior Product Decision Scientist - Remote!	Remote in Dallas, TX	Calendly	Estimated $107K - $135K a year	Experience working with large scale data in mixed method research.Ensure data and insights are timely, trustworthy, and actionable to drive decisions across…
115	Principal Statistical Programmer	United States	AL2S3 LTD	$150,000 - $170,000 a year	They are proud of their culture of engagement and accountability that rewards employees for innovative thinking and achievement of key objectives.
116	Senior Statistical Programmer - Clinical Trials / Strong Ad-...	Remote in United States	Cytel - USA	Estimated $62.1K - $78.7K a year	Performing data manipulation, analysis and reporting of clinical trial data, both safety and efficacy (ISS/ISE), utilizing SAS programming.
117	Senior Data Engineer	Remote in United States	SAIC	$125,001 - $150,000 a year	The data engineer also implements data tests for quality and also focuses on improving inefficient tooling and adopting new transformative technologies while…
118	Statistical Programmer II	United States	Parexel - USA	Estimated $80.6K - $102K a year	The Statistical Programmer II provides technical expertise for the conduct of clinical trials, and works with.Regulations such as 21 CFR Part 11.
119	Communications Manager	Dallas, TX 75206 (Upper Greenville area)	Hazen and Sawyer	Estimated $62.7K - $79.3K a year	Working with graphic designers to visualize information, including data, processes, and physical structures.If you’re skilled at using words and images to make…
120	Director, Payments Fraud Risk Management	Remote in Dallas, TX	Circle	None	Specific experience in strategic analytics, or data science preferred.Communicate risks with the ability to analyze and articulate complex data results.
121	Senior DevOps Engineer	Remote in Watauga, TX 76148+3 locations	Recruiting From Scratch	$150,000 - $220,000 a year	This allows data scientists to focus on solving business problems instead of scalability and performance of their codes.Experience in AWS is highly preferred.
122	Senior Software Engineer	Remote in Watauga, TX 76148+16 locations	Recruiting From Scratch	$150,000 - $200,000 a year	Collaborate with different players internally: product managers, designers, data scientists and other software engineers.
123	Entry-Level Structural Engineering Associate - Dallas, TX	Irving, TX	Wiss, Janney, Elstner Associates, Inc. (WJE)	Estimated $53.5K - $67.7K a year	Ability to record data clearly and write passages for reports, letters, etc.Analyze field data and perform research and review of modern and historic…
124	Lead Solution Engineer	Irving, TX 75063 (Cottonwood area)+1 location	Salesforce	$114,000 a year	Experience with databases and data analysis tools.Experience with enterprise ETL or data preparation tools is a strong plus.
125	Database Specialist	Dallas, TX 75219 (Oak Lawn area)	American Heart Association	Estimated $55.9K - $70.7K a year	Trains and oversees temporary staff hired for data clean up, data entry and/or assisting with data reporting processes.Currently funded for 6 months.
126	Clinical Safety Physician	Fort Worth, TX	Galderma	None	Guide and support the safety scientists in charge of case processing, without direct reporting line.Lead on-going safety data review during clinical trials…
127	Maintenance Operator - Dallas/Fort Worth	Dallas-Fort Worth, TX	Farmshelf	Estimated $34.8K - $44K a year	Understanding field operations data via FarmCloud (our webapp).Together, our team of engineers, designers, fabricators, technicians and plant scientists take…
128	Senior Cryptographic Engineer (Cryptography Startup)	Remote in Irving, TX 75038+3 locations	Recruiting From Scratch	$140,000 - $190,000 a year	We are interested in candidates at all levels from a fresh PhD graduate to experienced researchers / scientists / engineers.
129	Data Analytics/Data Warehouse Engineer	Dallas, TX	ABeam Consulting	Estimated $120K - $152K a year	Actively represent best practices for data architecture and business and collaborate with the data architect to design data analytics and business warehouse…
130	NGS Research Associate	Texas	MedGenome	From $40 an hour	Collaborate with bioinformatics scientists to assist in data interpretation for single cell and TCR projects and generate presentations and reports for…
131	Senior Consultant	Dallas, TX	Headstorm (Dallas/Addison)	Estimated $104K - $131K a year	Invested in a major trucking client who had issues securing data internally and across logistics parties.The rapid pace of projects and exposure to complex…
132	Product Consultant - Telecommunications Practice	Dallas, TX 75202 (Downtown area)	Bain & Company	Estimated $40.4K - $51.2K a year	LumiSM leverages an incredible inventory of customer and competitive datasets (billions of data rows) that are hosted on a single, unified platform to…
133	Project Coordinator	Dallas, TX 75220 (Northwest Dallas area)	Ensolum, LLC	Estimated $33K - $41.8K a year	Gather, tabulate and analyze various types of data.The Project Coordinator will report directly to an Ensolum Principal and will work closely with Project…
134	Junior Machine Learning Engineer	United States	Enhance IT	From $32 an hour	Experience with command-line scripting, data structures and algorithms and ability to work in a Linux environment, processing large amounts of data in a cloud…
135	Senior Supply Chain Data Analyst	United States	Logistics Plus Inc	$25 - $29 an hour	The Central Planning and Analytics (CPA) team provides analytical and project management.Services for DSPA Global and Regional Planning teams.
136	Senior Genomic Medicine Scientist - AI/Machine Learning	United States	Parexel - USA	Estimated $108K - $136K a year	Collaborate with computational scientists, pathologists and experimental scientists to design optimal experiments for model training and evaluation.
137	Senior Credit Risk Data Scientist/Machine Learning Engineer...	United States	Strategic Financial Solutions	None	Identify the data sources, manage quality of the data utilized in models.Maintain model data documentation, reproducibility, and reports.
