	Title	Location	Company	Salary	Synopsis
102	Machine Learning Engineer (Austin or US Remote)	Remote in Austin, TX	Katana Graph	Estimated $117K - $149K a year	Our technology excels in Intrusion Detection, Cybersecurity, AML, Fraud Detection, Root Cause Analysis, Supply Chain, Graph Neural Networks and Graph Analytics…
103	Senior Data Analyst	Austin, TX 78702 (Rosewood area)	Sysco Labs	Estimated $87.4K - $111K a year	Understand data infrastructure and coordinate with Data Engineering to deliver data models and structures to meet business demands.
104	DevOps Engineer - Machine Learning	Austin, TX	Logic20/20 Inc.	Estimated $116K - $147K a year	As a DevOps Engineer on this project, you’ll build infrastructure to support wildfire mitigation as well as increase customer safety.
105	DPS - FIN - CAPPS Financial Senior Data Analyst - 0256	Austin, TX 78752 (Highland area)	TEXAS DEPARTMENT OF PUBLIC SAFETY	$6,500 - $8,000 a month	Accounting Knowledge - Analyzing facts, data, and narrative reports.In order to complete the supplemental questions please go to CAPPS Recruit to register or…
106	Machine Learning Technical Marketing Director	Austin, TX	Infineon Technologies	None	You will work alongside top-notch marketing and engineering teams, dedicated to delivering significant advantages in performance, power, security, and…
107	Quantitative Researcher	Austin, TX 78746	Bridgefront Capital	Estimated $76.2K - $96.4K a year	Excellent quantitative analysis skills and experience working with large data sets.Work collaboratively with portfolio managers, other quantitative researchers…
108	Applied Machine Learning Scientist (Austin)	Austin, TX	Lightmatter	Estimated $126K - $160K a year	Ability to manipulate and analyze complex, high-volume, high-dimensional data from different sources.Research and build novel machine learning (ML) models that…
109	Senior ML Engineer	Austin, TX	EasyPost	Estimated $124K - $157K a year	O Large-scale training using data structures and algorithms.O Leads efforts within the organization to drive the design, development, optimization, and product…
110	Staff Machine Learning Engineer	Remote in Austin, TX	Bill.com	Estimated $139K - $176K a year	Participate in feature engineering and defining data requirements for different models.Design efficient data model(s) for knowledge graphs and their relevant…
111	Sr. Data Analyst - Credit	Austin, TX 78702 (Rosewood area)	Freedom Financial Network	Estimated $92K - $117K a year	5+ years of experience in data science, quantitative business analysis, and/or statistical analysis; or relevant Master’s Degree / MBA with 2+ years of…
112	Data Scientist	Austin, TX	EasyPost	Estimated $92.4K - $117K a year	O Help build internal tools that help the business team make data-driven decisions and/or automate manual processes.O Minimum of 3 years experience.
113	NLP Engineer at Speech to Text Start Up	Remote in Austin, TX 73301	Recruiting From Scratch	Estimated $124K - $157K a year	Their AI-powered collaborative note-taking app works across Zoom, Google Meet, and Microsoft Teams to help teams record, transcribe, search and share meeting…
114	Senior Marketing Data Analyst	Remote in Austin, TX	Circle	Estimated $88.3K - $112K a year	Identifying trends in the data to inform ongoing strategy.Collecting and analyzing data from multiple sources to arrive at critical information for the…
115	Senior RoR/React Engineer (Data & AI)	Remote in Austin, TX	Roostify	Estimated $116K - $147K a year	Knowledge of data architectures and technologies such as data warehouses such as Snowflake or Redshift and tag managers such as Segment.
116	Senior Machine Learning Engineer, ML Infrastructure	Austin, TX+1 location	Argo AI	Estimated $125K - $158K a year	Train and deploy unsupervised learning models to generate insights from Argo's data.Build visualizations using jupyter and web frameworks to provide insights…
117	AI Solutions Engineer	Austin, TX	Mythic-AI	Estimated $97.4K - $123K a year	Mythic is seeking engineers to develop and deploy vision-based products based on Mythic's innovative deep learning accelerator platform.
118	SAP Master Data Governance (MDG) Lead	Austin, TX 73301 (St Edwards area)	IBM	$105,000 - $208,000 a year	Strong understanding or hands-on experience with data quality, data profiling and metadata management.Hands-on experience leading data definitions development,…
119	Senior Data Analyst, Product Analytics	Hybrid remote in Austin, TX	YETI	Estimated $90.6K - $115K a year	The Senior Data Analyst, Product Analytics is responsible for developing hypotheses and drawing insights through the analysis of customer data (e.g., purchase…
120	Senior Machine Learning Engineer, Perception	Austin, TX 78701 (Downtown area)	Einride	Estimated $122K - $155K a year	Collaborate with data collection teams to identify and label sensor data to help optimize ML models.As a Senior Machine Learning Engineer, Perception, you will…
121	Senior Data Scientist - 100% Remote	Remote in Austin, TX 73301	Varis	Estimated $110K - $140K a year	Establish scalable and automated processes for large scale data analyses, model development, validation and implementation.Advanced SQL and Excel skills.
122	Machine Learning Engineer, Applied AI	Austin, TX	Virta Health	Estimated $117K - $148K a year	You are strong with SQL and able to extract data from data warehouses like Redshift or Bigquery.Our data includes high dimensional time series data, meal…
123	Statistician III	Austin, TX 78728	Health & Human Services Comm	$3,763 - $4,956 a month	Experience in data analysis and reporting.Plans, develops, and presents statistical data and reports.Explores emerging methods and technologies for data…
124	Senior Technical Recruiter, Machine Learning	Remote in Austin, TX	Upstart Network, Inc.	Estimated $119K - $151K a year	Active and data-driven approach to problem solving; you enjoy influencing through data and making sense of the trends and using the insights to better your…
125	Senior/Lead/Principal Data Engineer	Austin, TX	Salesforce	$98,900 a year	Drive data access methods & architect data services to improve the overall efficiency of data availability & accessibility for analytics.
126	Senior Machine Learning Engineer	Remote in Austin, TX	BetterUp	Estimated $125K - $159K a year	You're a data wrangler: processing, cleansing, enriching, augmenting, and verifying the integrity of data used for analysis.
127	Senior Product Manager - Data Insights - Remote	Remote in Austin, TX	Skilljar	Estimated $135K - $171K a year	2+ years of data background and hands-on experience in one or more of data science, AI/ML & analytics.Develop and lead a data insight vision, strategy, and…
128	Senior Data Analyst	Austin, TX	Braze	Estimated $98.4K - $125K a year	Analyze billions mobile and digital messaging data points.Experience with data visualization tools (Looker, Tableau, MicroStrategy, DataBricks).
129	Senior Data Analyst	Hybrid remote in Austin, TX	OJO Labs	Estimated $97.4K - $123K a year	Level up and sharpen your technical skills and understanding of SQL, data structures, data warehouses and business intelligence platforms to become an end to…
130	Account Manager - E-Commerce Machine Learning	Austin, TX 78702 (Rosewood area)	Granify	None	You’ll be assigned a portfolio of our enterprise retail clients and be responsible for building and maintaining strong, trusting, long-lasting relationships…
131	Data Operations Manager: OmniSales (SQL Database/ Machine Le...	Remote in Austin, TX	Humanity	Estimated $93K - $118K a year	Uses logic to analyze data and capability to draw conclusions and convey or provide advice or consultation to business leaders.This is not an admin role.
132	Statistical Ops Analyst (US Remote)	Remote in Austin, TX+1 location	Humanity	Estimated $76.6K - $97K a year	Experience handling, manipulating and analyzing data.Take lead role in recommending and implementing new and improved ways to effectively process data and…
133	Machine Learning Performance Engineer - Sr. Engineer / Staff...	Austin, TX 78759 (Arboretum area)+1 location	225 Qualcomm Technologies, Inc.	Estimated $119K - $150K a year	Develops and maintains databases for technology data mining and analysis.Analyzes equipment to establish operation data, conducts experimental tests, and…
134	Senior Machine Learning Engineer - NLP (Remote)	Remote in Austin, TX	BenchSci	Estimated $124K - $157K a year	Collaborate with data and core infrastructure engineers to solve the complex problems of extracting insights from biomedical text data.
135	Staff ML Engineer - Remote	Remote in Austin, TX	Clari	Estimated $128K - $162K a year	A passion for answering questions by analyzing data.You’ll build a state-of-the-art machine learning (ML) platform and data pipeline feeding time series data…
136	Senior Python Developer, Machine Learning	Remote in Austin, TX	Babylon	Estimated $137K - $173K a year	Develop new features leveraging our core AI components (causal and data-driven models) in collaboration with our Applied Science team.
137	Machine Learning Performance And Test Engineer	Austin, TX 78759 (Arboretum area)	225 Qualcomm Technologies, Inc.	Estimated $88.7K - $112K a year	You will develop software to aid in power/performance data analysis and visualization.You will develop software to aid in power/performance data analysis and…
138	Lead Applied AI Research Engineer - US Remote	Remote in Austin, TX+1 location	Babylon	Estimated $94K - $119K a year	You will provide engineering and systems focussed guidance to the wider Applied Science team, which includes scientists and engineers across AI and data science…
139	Principal NLP Engineer	Austin, TX 78746	LitLingo	Estimated $160K - $202K a year	LitLingo deploys AI and Natural Language Understanding (NLU) on top of business-specific communications to help companies make the most of their internal data.
140	Director of Sales & Business Development - AI, Data Science	Remote in Austin, TX	Xen.ai	None	Xen.AI is looking for Director of Sales & Business Development - AI & Machine Learning solutions, who can bring in AI, Machine Learning, Deep Learning and Data…
141	Manager, Marketing Analytics - Industry, Marketing Decision...	Austin, TX	Salesforce	$104,000 - $117,000 a year	We are looking for a storyteller who can build a compelling and clear presentation grounded in data.Very strong SQL skills are a core requirement for this role…
142	Data Engineer	Remote in Austin, TX	Fractal.ai	Estimated $123K - $156K a year	Good understanding of the latest data science and data engineering methods to implement enterprise-level services.
143	Principal Machine Learning Engineer	Austin, TX	Talroo	Estimated $164K - $208K a year	Two (2) years of data science, machine learning, or data engineering work experience.Big Data processing – Apache Spark is the key to our data pipelines that…
144	Senior Product Decision Scientist - Remote!	Remote in Austin, TX	Calendly	Estimated $110K - $139K a year	Experience working with large scale data in mixed method research.Ensure data and insights are timely, trustworthy, and actionable to drive decisions across…
145	Lead Machine Learning Engineer	Remote in Austin, TX 73301	S&P Global	$83,200 - $190,100 a year	The candidate will develop solutions to process alternative data from structured and unstructured sources, generate meaningful data classifications and text…
146	AI Engineer	Austin, TX 78746	Aspyr	None	Reporting to the Technical Director, the AI Engineer is responsible for developing and iterating on AI systems that bring our games to life.
147	AI Engineer	Austin, TX 78746	Aspyr Media, Inc.	None	Reporting to the Technical Director, the AI Engineer is responsible for developing and iterating on AI systems that bring our games to life.
148	Principal Machine Learning Engineer	Austin, TX 78735 (West Oak Hill area)	NXP Semiconductors	Estimated $127K - $161K a year	Work closely with your fellow Data Science CoE data scientists and embedded business data scientists to translate prototypes into production systems.
149	Senior AI Engineer	Austin, TX 78759 (Arboretum area)	ZeniMax Media Inc.	None	Position based in Austin, TX.Collaborate with producers, designers, and artists on individual AI archetypes from conception to completion.
150	Senior Software Engineer, Machine Learning Infrastructure (R...	Remote in Austin, TX	Mythic-AI	Estimated $126K - $160K a year	Our product spans the full stack of software and hardware and includes product engineering, deep learning codesign tools, compiler, simulators and emulators,…
151	Principal Statistical Programmer - Remote	Remote in Austin, TX	Precision Medicine Group	Estimated $117K - $148K a year	You are a strong SAS programmer, experienced in supporting the analysis of clinical trial data.Any data provided as a part of this application will be stored…
152	Senior Software Engineer - Machine Learning	Austin, TX 78735 (West Oak Hill area)	NXP Semiconductors	Estimated $113K - $143K a year	As a Senior Software Engineer you will develop and deploy Machine Learning software in the target software ecosystems, for the relevant NXP Edge Processing…
153	Senior AI Engineer	Austin, TX	Arkane Studios	None	Position based in Austin, TX.Collaborate with producers, designers, and artists on individual AI archetypes from conception to completion.
154	Senior Machine Learning Architect & Algorithm Developer	Austin, TX 78735 (West Oak Hill area)	NXP Semiconductors	Estimated $146K - $186K a year	Be an integral member of a small, highly-experienced team in R&D that is responsible for the architecture of new, differentiating, digital IP acceleration…
155	Sr Site Reliability Engineer (AI/ML) - remote	Remote in Austin, TX	Babylon	Estimated $129K - $164K a year	Collaborate with software developers, infrastructure engineers, and data scientists to help implement robust and scalable software products.
156	Ml/Ai Logic Design Engineer	Austin, TX 78759 (Arboretum area)	225 Qualcomm Technologies, Inc.	Estimated $108K - $137K a year	Deductive and inductive problem solving is required; multiple approaches may be taken/necessary to solve the problem; often information is missing or incomplete…
157	Mid-Level Product Designer- AI (Remote- US Based)	Remote in Austin, TX 73301	New Relic	None	Experience working in SaaS or enterprise software, specially in the display and management of high volumes of data.Experience with Figma and Design Systems.
158	Customer Engineer (ML/AI/Kubernetes)	Remote in Austin, TX	Pachyderm	Estimated $123K - $156K a year	Pachyderm helps customers get their ML and AI projects to market faster, lower data processing and storage costs, and supports strict data governance…
159	Data Scientist - Entry to Expert Level Virtual Hiring Event	United States	National Security Agency (NSA)	$74,682 - $176,300 a year	Passing this examination is a requirement in order to be considered for selection into a data scientist position.
160	Cloud Data Architect	Remote in United States	Oportun Inc	None	Strong expertise and experience managing complex data platforms through automation.Excellent communication skills to collaborate with the data engineering,…
161	Senior Statistical Programmer	Remote in United States	Everest Clinical Research	Estimated $99.5K - $126K a year	Archive clinical trial data (study data tabulation models and analysis data models) and programming information in accordance with corporate archival SOPs and…
162	Director, Statistical Programming	United States	Parexel - USA	Estimated $89.4K - $113K a year	As a Director, you will be responsible to lead, manage and support the departmental or functional team and processes to ensure that Parexel delivers quality…
163	Principal Stat Programmer	United States	Syneos Health - USA	Estimated $112K - $141K a year	Uses SAS, or other software, to develop custom programming code to generate summary tables, data listings, graphs and derived datasets as specified in the…
164	Senior Statistical Programmer/Principal Statistical Programm...	Remote in United States	Syneos Health - USA	Estimated $144K - $182K a year	 Uses SAS or other software to develop custom programming code to generate summary tables, data.As a Lead Statistical Programmer for projects of any…
165	Principal Statistical Programmer	United States	Parexel - USA	Estimated $119K - $151K a year	Input into and negotiate statistical programming timelines.Ensure that timelines are adhered to coordinate and lead a statistical programming team to…
166	Senior Statistical Programmer - Oncology	United States	Cytel, Inc (USA)	Estimated $110K - $140K a year	Strong SAS data manipulation, analysis and reporting skills- with strong output programming experience.You will report to the Associate Director, Statistical…
167	Senior Statistical Programmer	United States	AL2S3 LTD	Up to $150,000 a year	You will be working with some of the most advanced analytics.
168	Principal Statistical Programmer	United States	AL2S3 LTD	$150,000 - $170,000 a year	They are proud of their culture of engagement and accountability that rewards employees for innovative thinking and achievement of key objectives.
169	Principal Statistician	Remote in United States	Worldwide Clinical Trials - USA	Estimated $124K - $157K a year	The Worldwide Biostatistics team is an experienced and diverse group of Statisticians/Biostatisticians who collaborate together as one team, both via regularly…
170	Software Engineer Lead, Autonomy Machine Learning Infrastruc...	Austin, TX	Argo AI	Estimated $110K - $140K a year	Build visualizations to provide insights from data and models.Work with research scientists across the company and learn about every step in autonomous vehicle…
171	Team Lead, Engineering & Data Science	Hybrid remote in Austin, TX 78702	ASTRALABS	Estimated $104K - $131K a year	Technical expertise in data models, database design/development, data mining, data parsing, and segmentation techniques.
172	Director, Data Science- SMB Labs	Remote in United States	Indeed	$214,000 - $310,000 a year	In this role, you will lead teams of machine learning engineers, scientists, and statisticians who exhibit high energy, deep technical skills, and a drive to…
173	Principle Statistical Programmer (Perm/Contractor) - Remote,...	Remote in United States	Cytel - USA	Estimated $116K - $146K a year	Performing data manipulation, analysis and reporting of clinical trial data, both safety and efficacy (ISS/ISE), utilizing SAS programming.
174	Senior Machine Learning Engineer - Work From Home	Remote in Austin, TX	Plum Lending	Estimated $116K - $147K a year	We are looking for a data-driven problem solver who can automatically discover and extract information from multiple data sources and who enjoys working with…
175	Statistical Programmer II / Senior Statistical Programmer	United States	Syneos Health - USA	Estimated $103K - $131K a year	Uses SAS or other software to develop custom programming code to generate summary tables, data listings, graphs and derived datasets as specified in the…
176	Senior Statistical Programmer - Clinical Trials / Strong Ad-...	Remote in United States	Cytel - USA	Estimated $62.1K - $78.7K a year	Performing data manipulation, analysis and reporting of clinical trial data, both safety and efficacy (ISS/ISE), utilizing SAS programming.
177	Junior Machine Learning Engineer	United States	Enhance IT	From $32 an hour	Experience with command-line scripting, data structures and algorithms and ability to work in a Linux environment, processing large amounts of data in a cloud…
178	Director, Statistical Programming	Remote in United States	Everest Clinical Research	Estimated $136K - $172K a year	In-depth knowledge of industry standards on how clinical trial data are structured, stored, analyzed, and presented.Manage sponsors and vendor relationship.
179	Software Engineer Lead, Autonomy Machine Learning Infrastruc...	Austin, TX	Argo AI	Estimated $110K - $140K a year	Who we are: Argo AI is a global self-driving products and services company on a mission to make the world's streets and roadways safe, accessible, and useful…
180	AI Engineer	Austin, TX 78746	Aspyr Media, Inc.	None	Aspyr Media, Inc. is an independent, full-service developer and publisher for the industry's leading games. Over the last 25 years, Aspyr has helped nearly…
181	Senior Machine Learning Engineer - Work From Home	Remote in Austin, TX	Plum Lending	Estimated $116K - $147K a year	Senior Machine Learning Engineer JOB SUMMARY We are looking for a data-driven problem solver who can automatically discover and extract information from…
182	Lead Applied AI Research Engineer - US Remote	Remote in Austin, TX+1 location	Babylon	Estimated $94K - $119K a year	In any healthcare system, analyses are performed and decisions are made that affect people's lives; from predicting risk and understanding symptoms to…
183	Manager, Marketing Analytics - Industry, Marketing Decision...	Austin, TX	Salesforce	$104,000 - $117,000 a year	To get the best candidate experience, please consider applying for a maximum of 3 roles within 12 months to ensure you are not duplicating efforts. Job…
184	Senior AI Engineer	Austin, TX 78759 (Arboretum area)	ZeniMax Media Inc.	None	Overview: Arkane Studios is looking for a Senior AI Engineer to join our team in developing AAA games for PC and next-generation console systems. Our ideal…
185	AI Engineer	Austin, TX 78746	Aspyr	None	Aspyr Media, Inc. is an independent, full-service developer and publisher for the industry's leading games. Over the last 25 years, Aspyr has helped nearly…
186	Team Lead, Engineering & Data Science	Hybrid remote in Austin, TX 78702	ASTRALABS	Estimated $104K - $131K a year	Do you get excited when thinking about software development, database design, data management? Are you an emerging team leader and developer looking to grow…
187	Senior AI Engineer	Austin, TX	Arkane Studios	None	Overview Arkane Studios is looking for a Senior AI Engineer to join our team in developing AAA games for PC and next-generation console systems. Our ideal…
188	Ml/Ai Logic Design Engineer	Austin, TX 78759 (Arboretum area)	225 Qualcomm Technologies, Inc.	Estimated $108K - $137K a year	Company: Qualcomm Technologies, Inc. Job Area: Engineering Group, Engineering Group > DSP Architecture and Design General Summary: Oversees architecture,…
189	Mid-Level Product Designer- AI (Remote- US Based)	Remote in Austin, TX 73301	New Relic	None	Your Opportunity We are looking for a Product Designer to join our Experience Design team at New Relic! You will help ensure our users get the most out of…
190	Sr Site Reliability Engineer (AI/ML) - remote	Remote in Austin, TX	Babylon	Estimated $129K - $164K a year	We believe it is possible to put an accessible and affordable health service in the hands of every person on earth. The Self Care tribe focuses on building…
191	Customer Engineer (ML/AI/Kubernetes)	Remote in Austin, TX	Pachyderm	Estimated $123K - $156K a year	About Pachyderm: Pachyderm is the leader in data versioning and pipelines for MLOps. We're building the data foundation that allows data science teams to…
192	Data Scientist - Entry to Expert Level Virtual Hiring Event	United States	National Security Agency (NSA)	$74,682 - $176,300 a year	Responsibilities NSA Overview: The professionals at the National Security Agency (NSA) have one common goal: to protect our nation. The mission requires a…
193	Director, Statistical Programming	United States	Parexel - USA	Estimated $89.4K - $113K a year	Job Description Parexel is looking for a Director of Statistical Programming to join their FSO team! As a Director, you will be responsible to lead, manage…
194	Senior or Principal Statistical Programmer 1	United States	Cytel - USA	Estimated $132K - $168K a year	Strong proficiency in SAS applied to clinical trial and project data.5 or more years of statistical programming working with clinical trial data in the…
195	Senior Consultant - AI/ML Engineer	United States	Harnham	$140,000 - $150,000 a year	You will also play a leadership role in modestly sized data teams.You will be responsible for delivering on client data science projects from end-to-end.
196	Senior Credit Risk Data Scientist/Machine Learning Engineer...	United States	Strategic Financial Solutions	None	Identify the data sources, manage quality of the data utilized in models.Maintain model data documentation, reproducibility, and reports.
197	Senior Statistician	United States	AL2S3 LTD	Estimated $105K - $133K a year	Molly Williams is looking for a Senior Statistician with an in-depth passion for delivering high quality work to join a globally recognised, mid-sized CRO…
198	Senior Healthcare Data Analyst	United States	New Directions Behavioral Health	None	Experience with enterprise data warehouse and commercial/Medicare/Medicaid claims data.Strong analytic and data management skills.
199	Senior Genomic Medicine Scientist - AI/Machine Learning	United States	Parexel - USA	Estimated $108K - $136K a year	Collaborate with computational scientists, pathologists and experimental scientists to design optimal experiments for model training and evaluation.
200	Statistical Programmer II	United States	Parexel - USA	Estimated $80.6K - $102K a year	The Statistical Programmer II provides technical expertise for the conduct of clinical trials, and works with.Regulations such as 21 CFR Part 11.
201	Principal Statistical Programmer	United States	Cytel - USA	Estimated $137K - $173K a year	Provide review and/or author data transfer specifications for external vendor data.We are looking for a highly experienced data analyst who will lead all…
202	Director, Statistical Programming	Remote in United States	Everest Clinical Research	Estimated $136K - $172K a year	Everest Clinical Research (“Everest”) is a full-service contract research organization (CRO) providing a broad range of expertise-based clinical research…
