	Title	Location	Company	Salary	Synopsis
203	Principal Statistical Programmer	United States	AL2S3 LTD	$150,000 - $170,000 a year	George Higginson is exclusively working with an award winning, globally recognised partner who are looking for a Principal Statistical Programmer to join…
204	Senior Statistical Programmer/Principal Statistical Programm...	Remote in United States	Syneos Health - USA	Estimated $144K - $182K a year	Description JOB SUMMARY This position functions as a member of the Biostatistics and Statistical Programming project team serving as a Lead Statistical…
205	Senior Statistical Programmer	United States	Cytel - USA	Estimated $101K - $128K a year	Cytel provides unrivaled biostatistics and operations research knowledge to our customers in the life sciences industries in the form of both software and…
206	Data Scientist I - 637	Remote in Austin, TX	O'Neil Global Advisors, Inc.	Estimated $83K - $105K a year	Advanced skill with data science topics such as machine learning, data mining, statistics, and classification.Teach and mentor junior team members.
207	Staff Data Scientist - AI Ethics & ESG	Remote in Austin, TX+3 locations	Indeed	$183,000 - $266,000 a year	Partner closely with data scientists, product scientists, software engineers, product teams, security, privacy, legal, and other stakeholders to define and…
208	NLP Data Scientist (Remote)	Remote in Austin, TX 73301	Celsius	$110,000 - $175,000 a year	As a senior member of the data science team, play a key role in the team while mentoring junior data scientists.Experience in SQL is required.
209	Data Scientist II	Remote in Austin, TX	Braze	Estimated $96.7K - $122K a year	Explore and analyze the billions of daily data points that Braze's customers generate in search of predictive, valuable, actionable signals.
210	Data Scientist	Austin, TX+2 locations	sharethrough	Estimated $104K - $132K a year	Present findings to data scientists and product managers to influence product roadmaps.Work with our data engineering team to make the data needed for your…
211	Data Scientist	Remote in Austin, TX	CBI Remote	Estimated $125K - $159K a year	Exposure to big data technologies.Experience working with data warehouses Eg: Redshift and other similar database systems.
212	Senior Data Analyst, Remote US	Remote in Austin, TX	Aledade	Estimated $106K - $134K a year	You are experienced in advanced data management and data manipulation skills, including a strong foundation in SQL programming.401(k) with up to 4% match.
213	Sr Data Scientist with State OR Federal Exp. - Local	Austin, TX	Dutech System	$70 - $80 an hour	Data governance; data modeling techniques: 10 years (Preferred).Knowledge of local, state, and federal laws and regulations relevant to data science and data…
214	Data Scientist	Austin, TX	ANALYTOS	Estimated $97.7K - $124K a year	Designs and drives the creation of new standards and best practices in the use of statistical data modeling, big data and optimization tools.
215	Principal Data Scientist - 100% Remote	Remote in Austin, TX 73301	Varis	Estimated $126K - $160K a year	Establish scalable and automated processes for large scale data analyses, model development, validation and implementation.Advanced SQL and Excel skills.
216	Sr. Data Scientist (Austin or US Remote)	Remote in Austin, TX	Katana Graph	Estimated $138K - $175K a year	Experience with big data or machine learning algorithms.Give guidance to customers about best practices from data ingestion to deployment and maintenance.
217	Senior Data Scientist, Customer Success	Remote in Austin, TX	Twilio	None	Comfortable diving into large, complex datasets and data systems.Design, build and maintain data models that the customer success team can use to build…
218	Data Scientist, Customer Care	Austin, TX	SunPower	None	10 years industry data scientist experience.8 or more years of industry data scientist experience or equivalent combination of education and experience.
219	Senior Data Scientist, Central Analytics	Remote in Austin, TX	Chartboost	Estimated $130K - $165K a year	You will collaborate with data engineers, data scientists, product managers, and operations analysts to develop and drive the data analysis strategy for…
220	Sr. Data Scientist	Remote in Austin, TX	Studio X	Estimated $114K - $145K a year	Capable of end to end data science prototype implementation including data analysis, holdout testing and performance framework implementation.
221	Senior Data Scientist	Austin, TX	EasyPost	Estimated $114K - $145K a year	O Help build internal tools that help the business team make data-driven decisions and/or automate manual processes.O Flexible work schedule and paid time off.
222	Data Science Leader	Remote in Austin, TX	Anaconda	Estimated $134K - $170K a year	Lead a team of data scientists and business analysts that you partner with to achieve these outcomes.Experience in open source and data science advocacy.
223	Senior Data Scientist, Credit	Remote in Austin, TX 73301	Caribou	$125,000 - $145,000 a year	Experience working consumer data (especially consumer finance), including data from credit bureaus.Demonstrated ability to explain and visualize complex data…
224	Data Scientist	Austin, TX 78759 (North Shoal Creek area)+2 locations	Signature Science, LLC	Estimated $93.4K - $118K a year	Performs data analytics, specifically data clean-up, data processing, machine learning modeling, statistical analysis, multivariate data analysis, and/or data…
225	Data Science Engineer	Hybrid remote in Austin, TX 78701	Valkyrie Intelligence	$85,000 - $125,000 a year	As a Data Science Engineer, you will be helping to design scalable architecture for cloud-based applications and partnering with data engineers and data…
226	Senior/Lead Data Scientist	Austin, TX	Salesforce	$82,400 a year	Each team is made up of data scientists, engineers, growth analysts, and information management experts who are dedicated to driving product strategy with data…
227	Data Scientist-W2 Contract	Austin, TX	SMIT Solutions	Estimated $96.6K - $122K a year	Knowledge of local, state, and federal laws and regulations relevant to data science and data governance; data modeling techniques and algorithms; statistics…
228	Machine Learning Algorithm Developer	Austin, TX 78712 (University of Texas area)	University of Texas at Austin	$92,000 - $140,000 a year	Travel in support of data collection and system evaluation testing.Conduct data analysis across a range of acoustic systems, identifying anomalies and…
229	NLP Research Scientist	Remote in Austin, TX	Invitae	Estimated $123K - $155K a year	Formulate healthcare data structuring challenges into ML/NLP solvable problems.Innovate and ideate novel ML/NLP-driven solutions for structuring healthcare…
230	Principal Data Scientist	Austin, TX	High5	Estimated $137K - $173K a year	5+ years of experience in statistical modelling, data mining and insights generation.Explore data to gain insights on consumer purchasing, flight and renewal…
231	Lead Data Scientist, Presales	Austin, TX	Moveworks	Estimated $128K - $162K a year	Focus on improving data quality and anomaly detection to increase trust in data.Collaborate with Product Data Science team with product data analysis & data…
232	Lead Data Scientist, Presales	Austin, TX	Moveworks.ai	Estimated $118K - $150K a year	Focus on improving data quality and anomaly detection to increase trust in data.Collaborate with Product Data Science team with product data analysis & data…
233	Director, Data Science	Austin, TX	Bain & Company	Estimated $137K - $173K a year	3+ years of experience managing data scientists.Translate business objectives into data and analytics solutions and, translate results into business insights…
234	Research Scientist / Statistician [Global Health & Higher Ed...	Austin, TX	Far Harbor, LLC	$88,000 - $118,000 a year	We seek an experienced applied research scientist or statistician with excellent communication skills to contribute on multidisciplinary teams and consult with…
235	Sr. Machine Learning Scientist (Fishbowl)	Remote in Austin, TX+2 locations	Glassdoor	Estimated $143K - $182K a year	Proficiency with SQL for data analysis.Perform data analysis, cleaning, sampling, and feature engineering.Deploy and maintain models in production.
236	Senior/Principal Data Scientist	Austin, TX 78701 (Downtown area)+1 location	Atlassian	Estimated $88.2K - $112K a year	Work closely with Data Engineering team on measurement and data instrumentation maturity and scale capabilities and complexity along with the business.
237	Senior Data Scientist (Remote-US based)	Remote in Austin, TX+1 location	Plum Lending	Estimated $121K - $153K a year	Experience with data visualization and strong design sensibilities.Leverage external data sources to support customer acquisition and retention effort.
238	Senior Data Scientist (Product)	Remote in Austin, TX+1 location	BetterUp	Estimated $120K - $151K a year	You're a data wrangler: processing, cleansing, enriching, augmenting, and verifying the integrity of data used for analysis.
239	Senior GNSS Data Analyst and Research Associate R14977	Austin, TX 78758 (North Burnet area)	Applied Research Laboratories	$90,000 - $130,000 a year	Five years experience in data analysis specific to GNSS observation and navigation data.Three years relevant professional work experience in data analysis,…
240	Head of Data Science and Analytics	Remote in Austin, TX	Robin Healthcare	Estimated $122K - $154K a year	Manage data as a product.Build foundation of data-driven decision-making culture and develop trusted, democratized data sets.What You'll Be Doing?
241	Senior Data Analyst	Remote in Austin, TX 78701	Guideline, Inc.	Estimated $98.4K - $125K a year	The team consists of three sub-teams: data analytics team, data engineering team and data science team.Perform Deep Dive data explorations.
242	Data Science Manager (Remote Friendly)	Remote in Austin, TX	Mission Lane LLC	Estimated $106K - $135K a year	A low-ego, respectful, data science team committed to solving practical problems together.You have a deep understanding of the field of data science and can…
243	Principal, Data Science/Analytics	Austin, TX 73301 (St Edwards area)	Splunk	$110,000 a year	Develop standardized data and insights to drive pricing decisions.Lead development of Tableau dashboards to surface and redefine data.What You'll Be Doing:
244	Senior Data Analyst	Austin, TX 78758 (North Austin area)	Code42	$85,000 - $100,000 a year	Leading the usage of data by championing best practices and data processes; define, assist, monitor, and refine the approach.WHAT YOU’LL BE DOING:
245	Product Lead - Marketplace Intelligence, Growth Data Product...	Austin, TX	OJO Labs	Estimated $117K - $149K a year	Work closely with engineering and data science to define the data products that will deliver on OJO's vision of a better and more equitable home journey.
246	Machine Learning Engineer (Remote)	Remote in Austin, TX	Quora	Estimated $108K - $136K a year	Take end to end ownership of machine learning systems - from data pipelines, feature engineering, candidate extraction, model training, as well as integration…
247	Machine Learning Engineer	Austin, TX+3 locations	Glassdoor	$129,300 - $193,900 a year	Build scalable production systems for data collection, data transformation, feature extraction, model training, and testing, using distributed software tools.
248	Director - Statistical Analyst	Hybrid remote in Austin, TX	Charles Schwab	$113,900 - $227,700 a year	Strong skills and experience in the complete data extraction-to-data preparation process including data reduction, transformations, manipulation, cleaning/QA,…
249	Machine Learning Operations Engineer	Austin, TX	sharethrough	Estimated $97.3K - $123K a year	Write Airflow ETLs to prepare data for consumption by ML models.Work with the data science team to facilitate model development and deployment.
250	Data Engineer II	Austin, TX	SparkCognition	Estimated $110K - $139K a year	3+ years of experience in data engineering & strong understanding of data engineering principles using big data technologies.
251	Senior Data Analyst - Revenue Operations	Remote in Austin, TX	Rev.com	Estimated $98.2K - $124K a year	Building automated data pipelines to deliver relevant data/insights to various audiences.5+ years of proficiency in manipulating data sets in SQL or equivalent…
252	Machine Learning Engineer	Remote in Austin, TX	SparkCognition	Estimated $127K - $161K a year	Working closely with data scientists to understand core challenges and develop solutions which improve data science productivity.
253	Machine Learning Engineer	Austin, TX+1 location	Unity Technologies	Estimated $121K - $153K a year	Build a world-class recommendation system and computer vision analysis of video content.Deliver complete machine learning solutions to address critical product…
254	Senior Data Analyst	Remote in Austin, TX 78701	Trupanion	Estimated $86.3K - $109K a year	Extract and reconcile data from our robust data warehouse or identify and strategize new data to be collected through third party partnerships, surveys and more…
255	Meter Data Analyst III/Sr./or Lead	Hybrid remote in Austin, TX	ERCOT/Electric Reliability Council of Texas	Estimated $97.5K - $123K a year	Investigates and mediates meter data disputes raised by market participants.Evaluates and expands data aggregation system in support of ERCOT market settlement…
256	Machine Learning Researcher	Austin, TX	Optiver	Estimated $91.1K - $115K a year	Experience in computationally intensive research and managing and analyzing very large data sets.PhD required in computer science, statistics, data science,…
257	R&D Data Analysis Software Engineering Scientist R18401	Austin, TX 78758 (North Burnet area)	Applied Research Laboratories	$88,000 - $130,000 a year	The Environmental Sciences Laboratory (ESL) delivers capabilities to government customers for diverse applications, from on-site real-time data-intensive…
258	Machine Learning Engineer (Cloud)	Remote in Austin, TX	Ivanti	Estimated $108K - $137K a year	Construct optimized data pipelines to feed ML models.1+ years of experience building production-ready data pipelines that feed ML models.
259	Machine Learning Engineer (Austin or US Remote)	Remote in Austin, TX	Katana Graph	Estimated $117K - $149K a year	Katana Graph is an AI-powered graph intelligence company providing faster, deeper and more accurate insights on massive and complex data..
260	DevOps Engineer - Machine Learning	Austin, TX	Logic20/20 Inc.	Estimated $116K - $147K a year	The Logic20/20 Advanced Analytics team is where skilled professionals in data engineering, data science, and visual analytics join forces to build simple…
261	Sr. Product Manager (Data Science/Integrations)	Remote in Austin, TX	Pachyderm	Estimated $101K - $129K a year	We're building the data foundation that allows data science teams to automate and scale their machine learning lifecycle while guaranteeing reproducibility.
262	Mathematician II	Austin, TX+1 location	Everi Games Inc	Estimated $77.8K - $98.4K a year	Are you ready to be part of something great!Everi is looking for talented candidates to join our Game Development Studio in Austin, Texas!
263	DPS - FIN - CAPPS Financial Senior Data Analyst - 0256	Austin, TX 78752 (Highland area)	TEXAS DEPARTMENT OF PUBLIC SAFETY	$6,500 - $8,000 a month	Accounting Knowledge - Analyzing facts, data, and narrative reports.DPS - FIN - CAPPS Financial Senior Data Analyst - 0256 (00022693).
264	Machine Learning Technical Marketing Director	Austin, TX	Infineon Technologies	None	Infineon Technologies takes data privacy and identity theft very seriously.We are looking for the most innovative talent in the world to develop and define and…
265	Applied Machine Learning Scientist (Austin)	Austin, TX	Lightmatter	Estimated $126K - $160K a year	Ability to manipulate and analyze complex, high-volume, high-dimensional data from different sources.With modern human progress relying heavily on computers,…
266	Senior ML Engineer	Austin, TX	EasyPost	Estimated $124K - $157K a year	O Large-scale training using data structures and algorithms.For information on personal data processing, please see our Privacy Policy: https://www.easypost…
267	Data Scientist	Austin, TX	EasyPost	Estimated $92.4K - $117K a year	We are looking for a data scientist to join our team who is excited about exploring large data sets to build compelling products and provide insights to drive…
268	Senior Machine Learning Engineer (MLOps)	Remote in Austin, TX	Urbint	Estimated $127K - $161K a year	Develop self-service tools for data scientists that support feature engineering pipeline, model testing and deployment.
269	Documentation Engineer (ML/AI/Kubernetes)	Remote in Austin, TX	Pachyderm	Estimated $118K - $150K a year	Pachyderm helps customers get their ML and AI projects to market faster, lower data processing and storage costs, and supports strict data governance…
270	Director of Machine Learning - Remote	Remote in Austin, TX	Babylon	Estimated $155K - $196K a year	Together with other leaders in engineering, product, and design, you will drive a consistent strategy that stitches our members, our clinicians, and our…
271	Data Engineer	Austin, TX	Micron	Estimated $110K - $139K a year	Familiarity with software architecture (data structures, data schemas, etc.).Work with Data Scientists to implement strategies for cleaning and preparing data…
272	Full Stack Engineer - Viralspace.ai	Temporarily Remote in Austin, TX	Smartly.io	Estimated $95.5K - $121K a year	Although our engineers have a core focus/expertise, they tend to work cross functionaly and across our tech stack.Follow best/secure coding practices.
273	Sr. Engineering Manager, Machine Learning	Remote in Austin, TX+1 location	Homebound	Estimated $137K - $173K a year	Recruit and mentor a growing team of leading data/ML professionals.5+ years of professional industry experience as a ML Engineer, Data Scientist, or Software…
274	Ml/Ai Logic Feasibility Engineer - Austin / San Diego	Austin, TX 78759 (Arboretum area)	225 Qualcomm Technologies, Inc.	Estimated $90.4K - $114K a year	Deductive and inductive problem solving is required; multiple approaches may be taken/necessary to solve the problem; often information is missing or incomplete…
275	Senior Analyst Statistical Operations (US Remote CST or EST)	Remote in Austin, TX	Humanity	Estimated $81.2K - $103K a year	Take lead role in recommending and implementing new and improved ways to effectively process data and execute methodologies within Statistical Operations.
276	Principal ML & NLP Engineer	Remote in Austin, TX 73301	Recruiting From Scratch	$140,000 - $200,000 a year	Given you are constructing the foundation on which our global data infrastructure will be built, you need to pay close attention to detail and maintain a…
277	Senior Technical Sourcer, Machine Learning	Remote in Austin, TX	Upstart Network, Inc.	Estimated $113K - $143K a year	Maintain candidate information and data accurately in our company ATS.4+ years of technical sourcing experience with demonstrated understanding of data science…
278	Director of Marketing - AI, Data Science Services and Soluti...	Remote in Austin, TX+1 location	Xen.ai	Estimated $117K - $149K a year	Xen.AI is looking for Director of Marketing - AI, Machine Learning and Data Science Services and solutions.This can be a full time or part-time role.
279	User Experience Designer II, Machine Learning Platform	Temporarily Remote in Austin, TX	TuSimple, Inc.	None	Professional experience as a software engineer or data scientist.Related experience in software development, either as a software engineer or data scientist.
280	Statistical Ops Analyst (US Remote)	Remote in Austin, TX	Humanity	Estimated $76.6K - $97K a year	Experience handling, manipulating and analyzing data.Take lead role in recommending and implementing new and improved ways to effectively process data and…
281	Machine Learning Performance Engineer - Sr. Engineer / Staff...	Austin, TX 78759 (Arboretum area)	225 Qualcomm Technologies, Inc.	Estimated $119K - $150K a year	Develops and maintains databases for technology data mining and analysis.Analyzes equipment to establish operation data, conducts experimental tests, and…
282	Senior Software Engineer, Machine Learning	Austin, TX+2 locations	Roku	Estimated $132K - $168K a year	Can work with large scale computing frameworks, data analysis systems and modeling environments.The data and advertising group at Roku is looking for seasoned…
283	Data Scientist	Remote in Austin, TX	Signifyd	$95,000 a year	Work with distributed data pipelines.Design experiments and collect data.The Data Science team builds production machine learning models that are the core of…
284	Senior Data Scientist	Remote in Austin, TX	Honor	Estimated $144K - $182K a year	We're looking for data scientists to join our team.We're looking for generalist data scientists who are excited to jump into new problems and write production…
285	Data Miner Coordinator	Austin, TX	Austin Independent School District	Estimated $51K - $64.6K a year	JobID: 45442 Position Type: 05 - Administration: Central Office/Coordinator Date Posted: 5/10/2022 Location: AISD HQ Pay Grade: AP5 COMPENSATION:…
286	Research Data Scientist	Austin, TX 78759 (North Shoal Creek area)+2 locations	Signature Science, LLC	Estimated $89.7K - $114K a year	Performs data analytics, specifically data clean-up, data processing, machine learning modeling, statistical analysis, multivariate data analysis, and/or data…
287	Senior Research Data Scientist	Austin, TX	Roku	Estimated $141K - $178K a year	Provide expert consultative assistance on AI to other teams in the company, including research data scientists working in other areas of Roku's stack, and…
288	Senior Data Engineer	Remote in Austin, TX 78744	SAIC	$125,001 - $150,000 a year	The data engineer also implements data tests for quality and also focuses on improving inefficient tooling and adopting new transformative technologies while…
289	Senior Data Analyst	Remote in Austin, TX	ACCEL Schools	Estimated $91.9K - $116K a year	Leads report creation of financial data across the company.Collaborate with team members to collect and analyze data.
290	Senior Data Scientist	Austin, TX	Kibo Commerce	Estimated $114K - $145K a year	Collaborate with and learn from a like-minded group of data scientists.Develop models with a variety of requirements (online learning, large data sets,…
291	Software Engineer III, Machine Learning, Fuchsia OS	Hybrid remote in Austin, TX+1 location	Google	None	2 years of experience with data structures or algorithms in either an academic or industry setting.We're looking for engineers who bring fresh ideas from all…
292	Senior Data Analyst	Austin, TX 78746	BazaarVoice	Estimated $80.8K - $102K a year	Analyze the world’s largest shopper data network, both structured and unstructured data sets.4+ years proven work experience in a technical analytics role…
293	Mathematician II	Austin, TX+1 location	Everi Games Inc	None	As a Mathematician you will be responsible for writing and testing production code, while implementing mathematical logic for game play.
294	Machine Learning Engineer	Austin, TX	Armorblox	Estimated $92.8K - $118K a year	2+ years of work experience as a machine learning engineer, data scientist and software developer.Familiarity with NoSQL, SQL, relational and graph data stores…
295	Sr. Data Analyst - Marketing (Remote)	Remote in Austin, TX	Fjuri	Estimated $92.6K - $117K a year	Run deep-dive analysis to help answer specific business questions; provide strategic recommendations to marketing leaders based on data trends.
296	Machine Learning Firmware Developer	Austin, TX 78759 (Arboretum area)	225 Qualcomm Technologies, Inc.	Estimated $97.3K - $123K a year	Manages project team to complete complex tasks and troubleshoot issues related to the engineering and management of machine learning data.
297	Cloud Performance Engineer	Austin, TX	Arm	Estimated $116K - $146K a year	Experience in workload setup, load distribution both scale-up and scale-out, performance data collection, cleansing and analytics.
298	Machine Learning Compiler Engineer, Senior Staff	Austin, TX 78759 (Arboretum area)	112 Qualcomm Innovation Center, Inc.	Estimated $128K - $163K a year	Stores, retrieves, and manipulates data for analysis of system capabilities and requirements.Using deductive and inductive problem solving; multiple approaches…
299	Senior Software Engineer, Machine Learning	Austin, TX	Roku	Estimated $132K - $168K a year	Can work with large scale computing frameworks, data analysis systems and modeling environments.The data and advertising group at Roku is looking for seasoned…
300	Ml/Ai Logic Feasibility Engineer - Austin / San Diego	Austin, TX 78759 (Arboretum area)	225 Qualcomm Technologies, Inc.	Estimated $86.8K - $110K a year	Deductive and inductive problem solving is required; multiple approaches may be taken/necessary to solve the problem; often information is missing or incomplete…
301	Senior Technical Sourcer, Machine Learning	Remote in Austin, TX	Upstart Network, Inc.	Estimated $113K - $143K a year	Passion for data quality and data integrity.Uphold data integrity and be a proponent for data-driven recruiting.How you’ll make an impact:
302	Cloud Performance Engineer	Austin, TX	Arm	Estimated $116K - $146K a year	Experience in workload setup, load distribution both scale-up and scale-out, performance data collection, cleansing and analytics.Your new job at Arm.
303	Machine Learning Performance And Test Engineer	Austin, TX 78759 (Arboretum area)+2 locations	225 Qualcomm Technologies, Inc.	Estimated $86K - $109K a year	You will develop software to aid in power/performance data analysis and visualization.You will develop software to aid in power/performance data analysis and…
