	Title	Location	Company	Salary	Synopsis
0	Jr. Data Scientist	Austin, TX	Insight Global	$60 - $80 an hour	Working on call center data.This Data Scientist will be joining the Customer Operations team involved in analyzing call center data.
1	Marketing Data Scientist	Austin, TX	Synergis	$119,809 - $255,131 a year	Provide insight at scale through building automated reports and data pipelines.Experience with turning data into insights at scale using algorithms and machine…
2	Data Scientist	Remote in Austin, TX 78704	ClosedLoop	Estimated $108K - $136K a year	Train and educate customer data scientists on best practices for data science in healthcare.ClosedLoop data scientists utilize our platform and work alongside…
3	Data Scientist	Remote in Austin, TX	Urbint	Estimated $108K - $137K a year	You will develop machine learning solutions for well-defined data science problems, with focus on speed to value (mvp & iterative approach).
4	Junior Data Scientist	Austin, TX 78735	Kestra Financial	Estimated $84.2K - $107K a year	Create complex data pipelines, while learning Kestra's newly developed big data ecosystem.Intermediate Python/R programming skills, data aggregations, data…
5	Sr. Data Scientist	Austin, TX	Dutech Systems	$70 - $80 an hour	Data science and data governance: 8 years (Preferred).Knowledge of local, state, and federal laws and regulations relevant to data science and data governance;…
6	Data Scientist I (22-0623)	Austin, TX 78741 (Pleasant Valley area)	Office of the Attorney General of Texas	$6,999 - $9,583 a month	Develops data quality measures, analyzes data quality results, and implements necessary changes to ensure data quality improvement.Ability to travel up to 5%.
7	Data Scientist	Remote in Austin, TX 73301+1 location	S&P Global	$68,300 - $155,900 a year	3+ years of experience in data analysis or similar role.Strong statistical knowledge and intuition, especially for applying analysis to real data.
8	Senior Data Scientist	Remote in Austin, TX	Honor	Estimated $144K - $182K a year	We're looking for generalist data scientists who are excited to jump into new problems and write production-quality code.
9	Data Scientist	Remote in Austin, TX	Signifyd	$95,000 a year	Work with distributed data pipelines.Design experiments and collect data.We also improve the e-commerce shopping experience for individuals by reducing the…
10	Data Scientist - remote	Remote in Austin, TX 78758	Kershner Trading	Estimated $114K - $145K a year	A passion for analyzing large data sets.Work with a team of Data Scientists to analyze data and create intraday algorithmic trading strategies.
11	Data Scientist I (22-0623)	Austin, TX 78741 (Pleasant Valley area)	OFFICE OF THE ATTORNEY GENERAL	$6,999 - $9,583 a month	Develops data quality measures, analyzes data quality results, and implements necessary changes to ensure data quality improvement.Ability to travel up to 5%.
12	Junior Data Scientist	Austin, TX	ANALYTOS	Estimated $67.6K - $85.6K a year	Designs and drives the creation of new standards and best practices in the use of statistical data modeling, big data and optimization tools.
13	Data Scientist (100% Remote)	Remote in Austin, TX 78703	Frontdoor	Estimated $124K - $157K a year	Solid foundation in data structures and algorithms.Process massive amounts of structured and unstructured data.Run A/B test experiments and analyze results.
14	Senior Data Scientist	Remote in Austin, TX	Homeward	Estimated $139K - $177K a year	Partner with data engineering and analytics teams to drive data-driven decision making throughout the business and define the data models required to support it…
15	Data Scientist II	Remote in Austin, TX	Braze	Estimated $96.7K - $122K a year	Build processes to help catalog, maintain, and share the above with fellow data scientists and engineers.Explore and analyze the billions of daily data points…
16	Data Scientist	Remote in Austin, TX 78758	Kershner Trading Group	Estimated $114K - $144K a year	A passion for analyzing large data sets.Work with a team of Data Scientists to analyze data and create intraday algorithmic trading strategies.
17	NLP Data Scientist (Remote)	Remote in Austin, TX 73301	Celsius	$110,000 - $175,000 a year	As a senior member of the data science team, play a key role in the team while mentoring junior data scientists.Deep learning experience is an advantage.
18	Data Scientist, Staff	Remote in Austin, TX 78701+1 location	Guideline, Inc.	Estimated $141K - $179K a year	Guide all stages in the data science project lifecycle, from prototype to production to operationalization.Experience in full-cycle data science development,…
19	Data Scientist	Hybrid remote in Austin, TX	YETI	Estimated $110K - $139K a year	Experience with data visualization tools (e.g. Tableau, PowerBI).Collaborate with Data Engineer(s) to support data modelling and testing during projects.
20	Data Scientist	Austin, TX+2 locations	sharethrough	Estimated $104K - $132K a year	We’re looking for data scientist who share our passion for building data-driven products, as well as the belief data should be tightly integrated into the…
21	Data Scientist	Remote in Austin, TX 78731	[redacted]	Estimated $106K - $134K a year	Knowledgeable with modern application and data structures.Work with complex data sets to solve multiple challenging problems using statistical approaches.
22	R&D Data Visualization/WebGL/React/Systems Engineering Scien...	Austin, TX 78712 (University of Texas area)+1 location	University of Texas at Austin	$76,000 - $90,000 a year	Design and implement new features (e.g., advanced data visualization) for a web-based data processing and visualization application.
23	Sr. Data Scientist	Remote in Austin, TX	Hypergiant	Estimated $140K - $178K a year	Design, implement, and manage data science workflows, including processes and standards for collecting, cleaning and regularizing data.
24	Sr. Data Scientist	Remote in Austin, TX	SparkCognition	Estimated $135K - $172K a year	Partnering with and guide other data scientists in developing and applying ML expertise in developing and delivering novel solutions.
25	Data Scientist	Austin, TX 78701 (Downtown area)	Zilliant	Estimated $110K - $140K a year	Experience implementing data science routines in Python.To do so, the scientist must be comfortable with independent interactions with clients, guiding clients…
26	Data Scientist	Remote in Austin, TX	CBI Remote	Estimated $125K - $159K a year	Exposure to big data technologies.Our system retrieves large amounts of structured and unstructured data and uses scientific methods to extract knowledge and…
27	Data Scientist	Austin, TX 78702 (Rosewood area)	Sysco Labs	Estimated $114K - $144K a year	Experience with event data, AWS cloud infrastructure, S3 data lake with a Presto/Athena interface, and Optimizely’s online testing platform preferred.
28	Associate Mathematician	Austin, TX	SciPlay	Estimated $57K - $72.2K a year	Assist in the design of math models for gaming products and work closely with the game development artists, sound designers, game designers and producers.
29	Senior Data Analyst	Remote in Austin, TX 78701	Guideline, Inc.	Estimated $98.4K - $125K a year	Perform Deep Dive data explorations.Continuously maintain accuracy and availability of data.Translate internal data needs into technical specifications.
30	Data Scientist	Remote in Austin, TX	Circle	Estimated $118K - $149K a year	Identify data, metrics and analyses needs for business partners; Initiate, develop and maintain data pipelines and data models that powers dashboards and data…
31	Senior Data Scientist	Remote in Austin, TX	CrowdStreet	Estimated $117K - $149K a year	Comfortable working in cloud-native data warehouses and data lakes to manipulate large data sets (Snowflake a plus).
32	Senior Product Data Scientist, Work Management	Austin, TX 78701 (Downtown area)	Atlassian	Estimated $131K - $166K a year	Expertise in data manipulation and statistical programming languages (e.g. SQL, R or Python).Envision, scope, and execute projects by collaborating with…
33	Senior Data Scientist/Machine Learning Engineer	Austin, TX	Salesforce	$82,400 a year	Build tools to monitor data pipeline performance, data quality and models in production.Experience working as part of a data team working with mature data…
34	Senior Business Data Analyst	Austin, TX	Zscaler	Estimated $103K - $130K a year	Proven track record of executing data roadmap for support groups by translating business data needs into functional and technical requirements for the data…
35	Senior Data Scientist at Rent-to-Own Startup	Remote in Austin, TX 73301	Recruiting From Scratch	$120,000 - $190,000 a year	You have 3+ years of experience working in data science.Day to day, you will perform a mix of exploratory data analysis, statistical modeling, software…
36	Manager, Analytics and Data Science	Remote in Austin, TX 78701	Monumental	Estimated $132K - $167K a year	5+ years of work experience in data science, machine learning or analytics roles.Experience with some or all of the following within games: player behavioral…
37	Principal Data Scientist	Austin, TX 78735 (West Oak Hill area)	NXP Semiconductors	Estimated $117K - $149K a year	The data analytics aspect requires synthesizing data from multiple databases to identify better ways of working.
38	Data Scientist - Tiktok Monetization Business Integrity	Austin, TX 78745	TikTok	Estimated $96.1K - $122K a year	Preferred: Experience working with digital advertising data and products.Conduct root cause analysis on data discrepancy issues to identify resolution path.
39	Meter Data Analyst Sr	Austin, TX 78732	Lower Colorado River Authority	Estimated $77.2K - $97.8K a year	Five or more years of experience in data collection, data manipulation, database software, data analysis, or electric utility operations, including experience…
40	Data Science Manager (Remote Friendly)	Remote in Austin, TX	Mission Lane LLC	Estimated $106K - $135K a year	You have a deep understanding of the field of data science and can develop and communicate a vision to your team on how the field can be applied to solve…
41	Sr. Data Scientist	Remote in Austin, TX	SparkCognition	Estimated $135K - $172K a year	Voted Best Places to Work in Austin, Best Paying Companies, and Top Startup Companies by Forbes SparkCognition looks to bring in the best talent in the world…
42	Data Scientist	Austin, TX	ANALYTOS	Estimated $97.7K - $124K a year	You will collaborate with the brightest technical minds in building futuristic products, researching groundbreaking concepts, and influencing new ideas to…
43	Director, Data Science	Austin, TX	Bain & Company	Estimated $137K - $173K a year	WHAT MAKES US A GREAT PLACE TO WORK We are proud to be [1] consistently recognized as one of the world's best places to work, a champion of diversity and a…
44	Data Scientist	Austin, TX 78702 (Rosewood area)	Sysco Labs	Estimated $114K - $144K a year	About Sysco Labs Sysco LABS is a technology-focused division within Sysco, dedicated to reimagining foodservice through innovation. An extension of Sysco’s…
45	Senior Data Scientist	Remote in Austin, TX	Homeward	Estimated $139K - $177K a year	About Homeward Buying a home should be an exciting milestone. But all too often, it's stressful, especially in a competitive market or when you're buying and…
46	Sr. Data Scientist	Remote in Austin, TX	Hypergiant	Estimated $140K - $178K a year	**Please Note: Applicants selected will be subject to a security investigation and may need to meet eligibility requirements for access to classified…
47	Senior/Lead Data Scientist	Austin, TX	Salesforce	$82,400 a year	To get the best candidate experience, please consider applying for a maximum of 3 roles within 12 months to ensure you are not duplicating efforts. Job…
48	Senior Data Scientist	Remote in Austin, TX	CrowdStreet	Estimated $117K - $149K a year	Senior Data Scientist: Build Something Meaningful Role Summary: At CrowdStreet we're building a data science team to combine machine learning with business…
49	Senior Data Analyst	Austin, TX 78758 (North Austin area)	Code42	$85,000 - $100,000 a year	We are: Accelerators of innovation. Enablers of collaboration. Protectors of ideas. Code42 speeds the time to detect and respond to Insider Risks by…
50	Quantitative Researcher	Austin, TX 78746	Bridgefront Capital	Estimated $76.2K - $96.4K a year	Quantitative Researchers work directly with our portfolio managers to innovate in our lab and manage production strategies. Our research team has excelled at…
51	(Junior / Senior) Machine Learning (ML) Engineer - Sports An...	Remote in Austin, TX	Zelus Analytics	$75,000 - $150,000 a year	We are seeking machine learning engineers with a passion for sports to implement, automate, and optimize the quantitative models that power our world-class…
52	Data Scientist, Customer Care	Austin, TX	SunPower	None	Do you want to change the world? We do, too. Solar penetration is less than 1%, but just one hour of sunlight, if harnessed, could power the entire world for…
53	Sr. Data Scientist (Austin or US Remote)	Remote in Austin, TX	Katana Graph	Estimated $138K - $175K a year	Katana Graph is an AI-powered graph intelligence company providing faster, deeper and more accurate insights on massive and complex data.. Our graph…
54	Head of Data Science and Analytics	Remote in Austin, TX	Robin Healthcare	Estimated $122K - $154K a year	Have you ever felt let down by our healthcare system? (An understatement?) Us too. At Robin, we're on a mission to remove barriers to health, and we can't do…
55	Lead Data Scientist, Presales	Austin, TX	Moveworks.ai	Estimated $118K - $150K a year	Lead Data Scientist, Presales As a Tech Lead for the Presales Data Science team based in the Austin office of Moveworks, you will be an important member of…
56	Associate Data & Machine Learning Engineer	Austin, TX	Amazon Web Services, Inc.	$82,600 a year	Hands on experience working on large-scale data science/data analytics projects.Hands on experience with building data or machine learning pipeline.
57	(Senior) Research/Data Scientist	Austin, TX	Onto Innovation	Estimated $109K - $138K a year	The highly self-motivated individual will work closely with data/research scientists, software developers and application scientists to innovate, prototype,…
58	Machine Learning Algorithm Developer	Austin, TX 78712 (University of Texas area)	University of Texas at Austin	$76,000 - $90,000 a year	Experience with implementing and testing of data processing algorithms.Travel in support of data collection and system evaluation testing.
59	Senior/Principal Data Scientist	Austin, TX 78701 (Downtown area)	Atlassian	Estimated $88.2K - $112K a year	Work closely with Data Engineering team on measurement and data instrumentation maturity and scale capabilities and complexity along with the business.
60	Senior Data Scientist (Remote-US based)	Remote in Austin, TX	Plum Lending	Estimated $121K - $153K a year	Experience with data visualization and strong design sensibilities.Leverage external data sources to support customer acquisition and retention effort.
61	Senior Machine Learning Scientist	Remote in Austin, TX	StockX	Estimated $140K - $177K a year	Experience with big data platforms like Spark.You have dealt with data exploration, analysis, and feature engineering.
62	Senior Technical Product Manager, Data	Remote in Austin, TX 78758	Imagine Learning	Estimated $140K - $177K a year	Experience in defining data models and data dictionaries for enterprise data platforms with development teams is required.401k plan with a company match.
63	Senior GNSS Data Analyst and Research Associate R14977	Austin, TX 78758 (North Burnet area)+1 location	Applied Research Laboratories	$90,000 - $130,000 a year	Five years experience in data analysis specific to GNSS observation and navigation data.Three years relevant professional work experience in data analysis,…
64	Senior Data Scientist (Product)	Remote in Austin, TX	BetterUp	Estimated $120K - $151K a year	You're a data wrangler: processing, cleansing, enriching, augmenting, and verifying the integrity of data used for analysis.
65	PROGRAM STATISTICIAN	Austin, TX	Cancer Prevention and Research Institute of Texas	$69,415 - $117,397 a year	Interprets and analyzes data as it pertains to population health in Texas and CPRIT award and impact data to identify trends and relationships among the data.
66	Head of Data Science and Analytics	Remote in Austin, TX	Robin Healthcare	Estimated $122K - $154K a year	Build foundation of data-driven decision-making culture and develop trusted, democratized data sets.Work closely with product and engineering teams, data…
67	Senior Analyst for Instructional Support (Data Analyst V)	Austin, TX 78701 (Downtown area)	TEXAS EDUCATION AGENCY	$5,785 - $7,784 a month	Serves as subject matter expert for data related to Instructional Support, including data related to initiatives in the Instructional Support department,…
68	Senior Research Data Scientist	Austin, TX+1 location	Roku	Estimated $141K - $178K a year	Provide expert consultative assistance on AI to other teams in the company, including research data scientists working in other areas of Roku's stack, and…
69	Staff Data Scientist - REMOTE USA	Remote in Austin, TX	Mandiant	$160,000 a year	Identify data sources; iterate and grow datasets over time.Explore and analyze data; perform ad-hoc analyses to answer targeted questions.
70	Lead Senior Data Scientist	Austin, TX 78758 (North Austin area)	JBT Corporation	Estimated $117K - $148K a year	You will manage a team of data scientists and data and machine learning engineers to connect advanced data analysis and models to critical business processes…
71	Principal Data Scientist	Austin, TX 78735 (West Oak Hill area)+2 locations	NXP Semiconductors	Estimated $117K - $149K a year	The data analytics aspect requires synthesizing data from multiple databases to identify better ways of working.
72	Senior Fraud Data Analyst	Austin, TX 78758 (North Burnet area)	Health & Human Services Comm	$4,917 - $8,060 a month	Experience programming complex logic to isolate specific patterns in data.Effectively communicates verbally and in writing investigative data analysis and…
73	Principal, Data Science/Analytics	Austin, TX 73301 (St Edwards area)	Splunk	$110,000 a year	Develop standardized data and insights to drive pricing decisions.Lead development of Tableau dashboards to surface and redefine data.
74	Data Plane Engineer	Remote in Austin, TX 73301	Recruiting From Scratch	$140,000 - $200,000 a year	Troubleshooting and optimizing data path.Architect the next generation 5G base station on a chip’s data path.Strong programming experience in c/c++.
75	Data Scientist (Hybrid - Remote / Office - Austin, TX)	Remote in Austin, TX 78726	SailPoint	Estimated $105K - $133K a year	Experience with GPU data science tools e.g. rapids.ai.Familiarity with network graph data structures and related algorithms.2+ years Data Science experience.
76	(Junior / Senior) Machine Learning (ML) Engineer - Sports An...	Remote in Austin, TX	Zelus Analytics	$75,000 - $150,000 a year	Collaborate with data scientists to define and manage model productionalization and platform release plans.Collaborate with product and data science leads to…
77	Senior Data Analyst	Austin, TX 78758 (North Austin area)	Code42	$85,000 - $100,000 a year	Leading the usage of data by championing best practices and data processes; define, assist, monitor, and refine the approach.At Code42 everyone is an owner.
78	Data Science Lead	Remote in Austin, TX	Apiture	Estimated $126K - $160K a year	Prior experience with data exploration and data visualization tools such as Domo, Tableau, Looker, etc.Build, grow and lead a team of data analysts and machine…
79	Machine Learning Engineer	Remote in Austin, TX	Slingshot Aerospace	Estimated $109K - $139K a year	Ability to collaborate effectively with data scientists, product management, engineering, UI/UX.Experience developing data science / machine learning…
80	Senior GNSS Data Analyst and Team Lead	Austin, TX 78712 (University of Texas area)	University of Texas at Austin	$92,000 - $140,000 a year	Three or more years relevant professional work experience in data analysis, data engineering, or data science, with an emphasis on analysis software development…
81	Senior Data Analyst	Austin, TX 78741 (Parker Lane area)	Central Health	None	Clinical data and claims data (Medicaid or other public programs preferred).Five years of related experience in data analysis including exposure to large data…
82	Senior GNSS Data Analyst and Team Lead	Austin, TX 78712 (University of Texas area)+1 location	University of Texas at Austin	$92,000 - $140,000 a year	Three or more years relevant professional work experience in data analysis, data engineering, or data science, with an emphasis on analysis software development…
83	Senior Data Science Analyst	Austin, TX 78756 (Brentwood area)	Dept of Family & Protectve Svc	$4,917 - $6,667 a month	The Lead Analyst should be well-practiced and versed in modern data science methods, with at least 2 years of experience working on data-focused projects.
84	Senior Staff Data Scientist	Austin, TX 78735 (East Oak Hill area)	SolarWinds	Estimated $137K - $173K a year	We process several billions of data points a day, and design and build ML-powered applications that provide our customers meaningful insights from their data…
85	Staff Data Analyst	Austin, TX 78702 (Rosewood area)	Freedom Financial Network	Estimated $83K - $105K a year	You have a strong understanding on how data should be captured within products and services and are able to collaborate & guide the business and data…
86	Software Engineer III, Machine Learning, Fuchsia OS	Hybrid remote in Austin, TX	Google	$120,000 - $129,000 a year	2 years of experience with data structures or algorithms in either an academic or industry setting.We're looking for engineers who bring fresh ideas from all…
87	Machine Learning Engineer	Austin, TX	X2logicsstaffingsolution.com	$100,000 - $130,000 a year	Machine Learning Experience of 5 to 10 Years.Machine Learning Engineer with more Computer Vision experience.Python Experience of at least 3 Years.
88	Director, Data Operations	Austin, TX	DISCO	None	On a day-to-day basis, be the point of contact for any escalations related to Data Operations services including data processing, exception remediation, data…
89	Data Steward	Temporarily Remote in Austin, TX 78701	Employees Retirement System of Texas	None	Profiles data for statistical analysis and assessment of data to document the effectiveness of data quality controls and identifies improvement opportunities.
90	Principal Data Scientist	Austin, TX	Micron	Estimated $129K - $163K a year	Expert knowledge in feature engineering, dimensionality reduction for labeled and unlabeled data sets, handling imbalance, intelligent representative sampling,…
91	Data Platform Manager, Reable Suite	Austin, TX	SparkCognition	Estimated $158K - $200K a year	Building and managing a growing team of data engineers & data analysts.5+ years of hands-on experience in data engineering & strong understanding of data…
92	Computer Vision Engineer (All levels)	Remote in Austin, TX	Socure	Estimated $106K - $134K a year	A minimum of 2+ years experience as a data scientist, Machine Learning or Computer Vision engineer or research scientist, applied scientist contributing in both…
93	Machine Learning Engineer, Staff	Remote in Austin, TX 78701+1 location	Guideline, Inc.	Estimated $152K - $192K a year	Experience in full-cycle machine learning engineering, applied statistics, and data science modeling.We are looking for a Staff Machine Learning Engineer to…
94	Data Plane Engineer	Remote in Austin, TX 73301	Recruiting From Scratch	$140,000 - $200,000 a year	Troubleshooting and optimizing data path.Architect the next generation 5G base station on a chip’s data path.Who is Recruiting from Scratch:
95	Senior RevOps Data Analyst	Austin, TX 78703 (Clarksville area)	Zello	Estimated $83.9K - $106K a year	Understanding of data management best practices and data analytics.Enable automation of analytics and data collection.
96	Data Operations Manager: OmniSales (SQL Database/ Machine Le...	Remote in Austin, TX	Humanity	Estimated $93K - $118K a year	Our approach marries proprietary NielsenIQ data with other data sources to help clients around the world understand what’s happening now, what’s happening next,…
97	Machine Learning Engineer	Austin, TX	Armorblox	Estimated $92.9K - $118K a year	2+ years of work experience as a machine learning engineer, data scientist and software developer.Familiarity with NoSQL, SQL, relational and graph data stores…
98	Senior Manager (Lead), Data Science	Austin, TX	Unity Technologies	Estimated $153K - $194K a year	Experience launching new ML or data products.Experience architecting, developing and supporting large scale data processing pipelines, especially in machine…
99	Senior Machine Learning Engineer	Remote in Austin, TX	BetterUp	Estimated $125K - $159K a year	You're a data wrangler: processing, cleansing, enriching, augmenting, and verifying the integrity of data used for analysis.Frankly, it's not for everyone.
100	Senior Technical Product Manager, Data	Remote in Austin, TX 78758	Imagine Learning	Estimated $140K - $177K a year	Experience in defining data models and data dictionaries for enterprise data platforms with development teams is required.It drives everything we do.
101	Marketing Analytics & Data Science Manager	Austin, TX	Self Financial	Estimated $102K - $129K a year	Drive higher acquisitions by continuously providing data driven insights.As a Marketing Analytics & Data Science Manager focused on acquisitions, channel…
