	Title	Location	Company	Salary	Synopsis
0	Data Scientist	Lexington, MA 02421	Vanu, Inc.	$100,000 - $150,000 a year	Master’s degree or better in engineering or science-related field.Demonstrable experience with Geodata and mapping technology (tif, shp, kmz, appropriate…
1	Data Scientist I - Gabuzda Lab	Remote in Boston, MA 02215+5 locations	Dana-Farber Cancer Institute	None	Bioinformatics scientists work closely with wet lab scientists to generate, analyze, and interpret large-scale datasets using various analytical and…
2	Senior Data Scientist	Remote in Boston, MA 02127	CyberCoders	$150,000 - $170,000 a year	Develop our data science function.Experience with structured/unstructured data sources.RSUs, Annual Bonus, 401(k), Unlimited PTO.
3	Data Scientist	Remote in Boston, MA 02110	Nexamp	Estimated $91.4K - $116K a year	Nexamp is seeking an experienced data scientist to work with diverse data sets including weather, equipment performance, solar energy generation, ISO grid…
4	Senior Data Scientist	Boston, MA	Compunnel Inc.	$110,338 - $145,516 a year	(We Provide Fulltime Salary and H1B/GC Sponsorship aided with immigration assistance).Candidate should have strong python & a good comfort level of Linux &…
5	1628 Data Scientist	Boston, MA	Infoorigin inc	$125,000 - $175,000 a year	The data scientist will help clients transform their business and solve complex problems using data-driven approaches and help to deliver projects using data…
6	CO-OP, DATA SCIENCE	Somerville, MA	PUMA	Estimated $44K - $55.8K a year	Leveraging internal and external data to identify signal and generate recommendations.Using data analysis to solve problems, identify trends, and predict…
7	Data Scientist	Remote in Boston, MA 02110+3 locations	S&P Global	$68,300 - $155,900 a year	3+ years of experience in data analysis or similar role.Strong statistical knowledge and intuition, especially for applying analysis to real data.
8	Data Scientist	Boston, MA 02215 (Fenway-Kenmore area)	Chen Lab @ Boston University	Estimated $93.7K - $119K a year	Data…
9	Data Scientist-Computational Sciences	Hybrid remote in Watertown, MA	Neumora	Estimated $107K - $135K a year	Work closely with other data scientists and engineers to set up and run data processing, feature engineering, quality control, computational analysis, and…
10	Associate Data Scientist	Remote in Boston, MA 02110+1 location	Corvus Insurance	Estimated $94.3K - $119K a year	You will identify, ingest and cleanse innovative sources of data to support existing products, including but not limited to cybersecurity data.
11	Senior Data Scientist (Interview This Week)	Boston, MA+2 locations	Syrinx	Estimated $125K - $158K a year	Analyze large data sets to develop multiple, custom models and algorithms to drive innovative correlations for fraud and acceptance data as well as social data.
12	Data Scientist	Boston, MA	BSC Group	Estimated $86.2K - $109K a year	Demonstrated ability with data management and modeling software.Suggest methods to use data analytics to streamline processes.
13	Data Scientist	Boston, MA	Lantern	Estimated $89.7K - $114K a year	You have _3+ years experience with a _technical toolset that mirrors a seasoned data scientist (Complex SQL, Python, Scikit, Git, visualization tools, etc).
14	Data Scientist	Boston, MA 02111 (Leather District area)	PowerAdvocate	Estimated $96.3K - $122K a year	Full-stack data science/data engineering experience.Develop and maintain data pipelines to deliver data to multiple parties.
15	Staff Data Scientist	Boston, MA 02210 (South Boston area)	Gradient AI	$130,000 - $185,000 a year	Synthesize research data, turning data to actionable insights, and specific model requirements.Experience working with insurance data or building insurance…
16	Data Scientist	Boston, MA	Pison	Estimated $122K - $154K a year	Experience working with IMU sensor data.Analyze data, including evaluating signal quality, performing feature analysis and visualization, and quantifying other…
17	Data Analyst	Remote in Boston, MA	6 River Systems	Estimated $84.6K - $107K a year	Develop SQL to transform raw data into data models and build production level data visualizations.Design and implement end-to-end data pipelines: work closely…
18	Data Scientist	Charlestown, MA 02129	Catalog Technologies, Inc.	Estimated $101K - $128K a year	Experience in programming with Python, including usage of standard data science libraries: pandas, scipy, numpy, matplotlib.
19	Data Scientist, Growth	Remote in Boston, MA	Spotify	Estimated $96K - $122K a year	Work closely with data scientists, user researchers, product managers, designers and engineers.Familiar with qualitative research methods, utilizing data from…
20	Product Data Scientist (Cambridge)	Cambridge, MA+1 location	Philo	Estimated $95.4K - $121K a year	You'll be working closely with other data scientists and engineers to build and deploy solutions directly for our service.
21	Data Scientist	Remote in Boston, MA	Datavant	Estimated $122K - $155K a year	2+ years of industry experience working as a data scientist or engineer, using Python, and contributing to production code.
22	Statistician/Data Scientist	Boston, MA 02129	9Rooftops	Estimated $125K - $159K a year	O Communication skills to ask questions of clients and internal partners to clarify data definitions, data structure and data generation biases.
23	Data Scientist	Cambridge, MA 02139 (Cambridgeport area)	MORSE Corp	Estimated $108K - $137K a year	MORSE is searching for a Data Scientist with expertise in data analysis, data science, and algorithm development in one or more of a variety of fields including…
24	Data Scientist	Cambridge, MA 02142 (Kendall Square area)	Whitehead Institute	Estimated $88.6K - $112K a year	Perform data analysis on new experiments and make conclusions based on data.Increase speed and efficiency of big data analysis.
25	Data Scientist – Predictive Analytics	Remote in Boston, MA	Biofourmis	Estimated $101K - $128K a year	Design and conduct exploratory and statistical analyses to understand the complex human systems and health data.
26	Full Stack Data Scientist	Boston, MA	Klaviyo	Estimated $127K - $161K a year	The full stack data scientist position is a multidisciplinary role that combines data and algorithm discovery, UX design, and software engineering.
27	Data Scientist	Remote in Boston, MA	Circle	Estimated $119K - $151K a year	Identify data, metrics and analyses needs for business partners; Initiate, develop and maintain data pipelines and data models that powers dashboards and data…
28	Senior Data Scientist	Cambridge, MA	Cambridge Mobile Telematics	Estimated $138K - $175K a year	Ability to write and navigate code, request data from data sources and code from scratch.Experience building scalable data processing systems for production…
29	Lead Data Scientist	Cambridge, MA 02138 (West Cambridge area)	S&P Global	$83,200 - $190,100 a year	Experience performing data analysis, modeling, and generating visualizations.Extracting insights from messy, usually un-labeled, data across multiple languages…
30	Sr Data Scientist	Boston, MA	AtScale	Estimated $124K - $157K a year	Work closely with external users and customers (data scientists, machine learning engineers, business analysts) to pilot new offerings.
31	Customer Data Scientist	Cambridge, MA	Einblick	Estimated $107K - $136K a year	3+ years of experience as a data scientist OR technical pre-sales / sales engineer experience in the analytics or data science space.
32	Principal Marketing Data Scientist	Remote in Needham, MA	Humanity	Estimated $130K - $164K a year	As a principal marketing data scientist, you will be leading or contributing to the research, design, testing, and implementation of various advanced marketing…
33	Data Scientist, Data Quality Engineer	Remote in Cambridge, MA 02142	InsideTracker	None	Direct experience with any or all of the following: data quality, data management, data governance, data science, and/or data-intensive software development…
34	Data Scientist	Boston, MA	L.E.K. Consulting	Estimated $97.9K - $124K a year	Analytical needs can include: data aggregation / creation, data cleaning / manipulation, commercial data science (e.g., geospatial, machine learning, predictive…
35	Data Scientist	Beverly, MA 01915	Axcelis Technologies Inc.	Estimated $85.3K - $108K a year	Continue to monitor and review data analytics and data science publications to bring new tools to the organization.Bachelors Degree in related field required.
36	Data Scientist	Hybrid remote in Boston, MA 02199	Blue Cross Blue Shield of Massachusetts	Estimated $128K - $162K a year	 Responsible for detailed data science business requirements documentation. Experience in working with assignments that involve moderately complex to complex…
37	Data Scientist	Boston, MA 02116 (South End area)	Apexon	$105 an hour	Develop custom data models and algorithms to apply to data sets.Assess the effectiveness and accuracy of new data sources and data gathering techniques.
38	Visualization/Data Scientist	Waltham, MA 02451	Vita Data Sciences	Estimated $82.6K - $105K a year	1+ years working with Clinical related data.Codes software applications to adhere to designs supporting internal business requirements or external customers.
39	Senior Acquisition Data Scientist (Remote)	Remote in Boston, MA	Drizly	$123,000 a year	Develop data science products roadmap across the Acquisition Marketing Team.You have utilized time-boxed experimentation to optimize data science products to…
40	Data Scientist	Boston, MA 02210 (Downtown area)	Wellframe	Estimated $87.5K - $111K a year	Technically proficient: Strong data science skills.Capable of manipulating large data sets, cleaning and normalizing data, feature engineering, building ML…
41	Associate Data Scientist/Data Scientist	Quincy, MA+1 location	Arbella Insurance Group	Estimated $80.1K - $101K a year	Support data science projects leveraging big data technology to extract value from unstructured and semi-structured internal and third party data, including…
42	Data Scientist	Remote in Lexington, MA	Odyssey Systems Consulting Group, Ltd.	Estimated $107K - $135K a year	The Group is seeking to hire an engineer to be responsible for maintaining data quality, developing data models & inferred analytics, and will contribute to the…
43	Principal Data Scientist	Cambridge, MA	Cambridge Mobile Telematics	Estimated $137K - $174K a year	Work independently or lead a group of data scientists to develop solutions through the full development stages, from data pre-processing, modeling, testing,…
44	Data Scientist	Remote in Boston, MA	Cohere Health	Estimated $107K - $135K a year	Strong interest and understanding of EMR data, Claims and SDOH data.Strong experience using a variety of data mining/data analysis methods, utilizing a variety…
45	Data Scientist	Hybrid remote in Burlington, MA	Butterfly Network	Estimated $95.7K - $121K a year	Minimum 3 years data science experience.Bring data into all decisions at Butterfly.Able to create compelling data visualizations, using Tableau or similar…
46	Bioinformatician/Data Scientist	Cambridge, MA	Cygnal Therapeutics	None	Expert in data mining and data analysis.Implement and develop data analysis/visualization tools to enable biologists accessing data.
47	Data Scientist	Hybrid remote in Cambridge, MA 02142	Insurify	Estimated $108K - $137K a year	Reporting to the Director of Analytics, this role will be one of the first on our Customer Acquisition Data Science team.Catered lunches in the office.
48	Staff Data Scientist	Remote in Boston, MA	Samurai Hire	Estimated $139K - $176K a year	Responsible for Mining and Analyzing data pertaining to customer’s business experience.Do you have experience working with insurance data or building insurance…
49	Data Scientist	Cambridge, MA 02142 (East Cambridge area)	Context Labs	Estimated $89.6K - $113K a year	Performing exploratory data analysis to derive business insights.Familiarity with conceptual and logical data modeling principles.
50	Senior Data Scientist	Framingham, MA	Unity Technologies	Estimated $124K - $157K a year	Good communication skills to help collaboration with other data scientists and engineers.Enthusiasm about machine learning and data science.
51	Data Scientist	Boston, MA	Tagup, Inc.	Estimated $113K - $143K a year	Integrate new data sources into our data pipeline.Develop and deploy analytic models on industrial data.Build and maintain data processing and visualization…
52	Senior Data Scientist	Remote in Boston, MA 02110	meQuilibrium	Estimated $123K - $155K a year	Leverage existing data sets and engineer new data sets including development of SQL queries, data integration and resolution of data quality issues.
53	Data Scientist	Remote in Boston, MA+1 location	Comcentric	$139,000 - $276,000 a year	Mentor and grow other software engineers, data scientists, and ML engineers across teams.Solid knowledge of data structures and algorithms.
54	Senior Data Scientist	Boston, MA	Pagaya Investments	Estimated $114K - $144K a year	2+ years of experience working as a data scientist or a similar role involving data extraction, analysis, and statistical modeling.
55	Data Scientist	Boston, MA 02116 (South End area)	Natixis Investment Managers	Estimated $98.3K - $124K a year	Share insights with departments, through data visualization and data storytelling.Assist with data architecture and governance throughout the Business.
56	Data Scientist (Product Analytics)	Boston, MA	Jellyfish	Estimated $112K - $142K a year	Help the data science and analytics team improve our analytics tech stack to better collect, store, and process the analytics data we care about, as well as…
57	Data Scientist	Cambridge, MA 02138 (Cambridge Highlands area)	Vizgen	None	Build and implement data analysis pipelines to transform data into accessible and presentable formats.Experience with biological or instrumentation data.
58	Data Scientist	Cambridge, MA+4 locations	Iterative Scopes	Estimated $107K - $135K a year	Experience working with more data types (e.g. EMR, genomics, biometrics, images).The core responsibilities of this role include designing and implementing…
59	Senior Data Scientist - All regions	Boston, MA 02210 (South Boston area)	Cervello Inc	Estimated $119K - $151K a year	Experience leading data scientists in client-facing projects, driving them to deliver results.Experience with large data sets and big data computing…
60	Senior Data Scientist	Boston, MA	Vectra AI	Estimated $130K - $165K a year	Familiarity with data structures and algorithms.Be on the leading edge of applying machine learning and data modeling to the world of advanced cyber security.
61	Data Science Statistician	Hybrid remote in Boston, MA 02215+3 locations	Dana-Farber Cancer Institute	Estimated $86.5K - $110K a year	Performs data analyses and assures reproducibility of results.Responsible for statistical aspects of study/experiment design, identification of appropriate…
62	Data Scientist/Senior Data Scientist	Boston, MA	Tive	Estimated $116K - $147K a year	Prior industry data science experience,.Prior experience building forecasting models from multivariate data,.Strong Python and SQL skills,.
63	ANALYTICS MANAGER, CRM (DATA SCIENCE)	Remote in Boston, MA	DraftKings	None	Proficiency in Tableau or similar data visualization tools.Comfortable presenting complicated data views to cross-functional audiences and senior leadership.
64	Data Scientist, Analytics	Boston, MA	TikTok	Estimated $110K - $139K a year	Expert experience developing large and complex data pipelines using SQL.Experience with a data visualization tool (e.g. Tableau).Familiarity with Python or R.
65	Biomedical Data Scientist	Remote in Boston, MA	PathAI	None	Background in clinical data/oncology/immuno-oncology and/or experience working with clinical trial data is a plus.
66	Senior Clinical Data Scientist (RWE) – Remote	Remote in Cambridge, MA 02139	EQRX	Estimated $118K - $149K a year	You will conduct analyses using various disparate types of healthcare data (e.g., real-world insurance claims data, electronic health record (EHR) data, and…
67	Data Science Data Analyst	Hybrid remote in Cambridge, MA 02141	CarGurus	Estimated $71K - $90K a year	Work closely with data scientists, and collaborate closely on new data science projects.Build automated tests to ensure the integrity of the data ingested by…
68	Data Scientist, R&D	Remote in Boston, MA 02110	Tutela Technologies	Estimated $98.1K - $124K a year	Use understanding of the underlying data and business objectives to optimize feature engineering for input data.Experience with largescale geospatial data.
69	Data Scientist	Boston, MA+2 locations	OM1	Estimated $98.3K - $124K a year	Use our standardized, linked data.Eagerness to dig into the data.Develop solutions that read large volumes of data and produce insights in real time.
70	Data Scientist	Remote in Boston, MA 02114	Archetype	Estimated $112K - $142K a year	Advanced experience in performing exploratory data analysis, feature engineering, data normalization and hyperparameter tuning.
71	Data Science Data Analyst	Hybrid remote in Cambridge, MA 02141+1 location	CarGurus	Estimated $71K - $90K a year	Work closely with data scientists, and collaborate closely on new data science projects.Build automated tests to ensure the integrity of the data ingested by…
72	Data Scientist	Boston, MA+1 location	OM1	Estimated $98.3K - $124K a year	Use our standardized, linked data.Eagerness to dig into the data.Develop solutions that read large volumes of data and produce insights in real time.
73	Scientist I, Data Management	Cambridge, MA	Foundation Medicine, Inc.	None	Perform the data integration and transformation and deliver data tables based on data specifications.Perform ad-hoc data management and data analysis tasks.
74	Senior Data Scientist (Remote-US based)	Remote in Boston, MA	Plum Lending	Estimated $128K - $162K a year	Experience with data visualization and strong design sensibilities.Leverage external data sources to support customer acquisition and retention effort.
75	Data Scientist (Remote)	Remote in Lexington, MA 02420+1 location	Solidus Technical Solutions	Estimated $96.1K - $122K a year	Successful individual will contribute to the analytics and management of data solutions, and would be responsible for maintaining data quality, developing data…
76	Senior Data Scientist - Security and Trust	Remote in Boston, MA	Klaviyo	Estimated $134K - $169K a year	Use data science to help Klaviyo grow faster.The company's hybrid customer-data and marketing-platform model allows companies to grow by fostering direct…
77	NLP Research Scientist	Remote in Boston, MA+1 location	Invitae	Estimated $120K - $152K a year	Formulate healthcare data structuring challenges into ML/NLP solvable problems.Innovate and ideate novel ML/NLP-driven solutions for structuring healthcare…
78	Data Scientist	Cambridge, MA	DeepHealth	Estimated $107K - $135K a year	Investigate and improve data quality.Expertise with data visualization techniques.Experience working with medical data.Reports To: VP of Data Science.
79	Senior Data Scientist	Cambridge, MA	Bryant Staffing Solutions	None	Analysis of multi-omics data (including spatial and single-cell data).Familiarity with data visualization and dimensionality reduction algorithms.
80	Computational Scientist - Data Analyst	Charlestown, MA 02129	PD Theranostics	$90,000 - $130,000 a year	There is additional opportunity to refine current approaches and develop novel methods for data analysis.You will also work closely with the senior scientists…
81	Machine Learning Engineer	Remote in Boston, MA	Snowplow Analytics	Estimated $112K - $142K a year	Passion for data and continuous product development.LOVE Data…Track record of using data and building models to inform.MacBook and home office equipment.
82	Data Scientist	Lowell, MA	M/A Com Technolgy Solutions	Estimated $97.6K - $124K a year	Develop software, algorithms, and applications to apply mathematics to data, perform large scale experimentation and build data driven apps to translate data…
83	Senior Data Analyst People Analytics	Boston, MA 02212 (Central area)	2020 Tech IQ	Estimated $98.5K - $125K a year	Minimum of 5 years in a previous data analytics or data science role.This role will also focus on enabling our organizational leaders to make better data…
84	Data Scientist, Analytics	Remote in Burlington, MA 01803	Veracode	Estimated $111K - $141K a year	Strong SQL skills, including writing complex queries to extract and analyze large volumes of data.Leverage and improve our data science platform consisting of…
85	Senior Data Scientist	Natick, MA	DOTS Technology Corp	Estimated $143K - $180K a year	The successful candidate will have a strong background in development of image and signal processing algorithms as well as analysis of high throughput…
86	Data Scientist, Pricing & Analytics	Boston, MA	Perch	Estimated $33.8K - $42.8K a year	Support data scientists and economists by building new feature sets that reduce error and monitor model prediction.
87	REMOTE* Machine Learning Engineer	Remote in Boston, MA	Piper Companies	$55 - $70 an hour	Serve as a mentor to junior-level scientists and engineers, focusing on software engineering skills and best practices.
88	Data Scientist – High Throughput/High Content Screening	Boston, MA 02210 (South Boston area)	Dewpoint Therapeutics	Estimated $86.6K - $110K a year	Work with biologists, chemists and fellow data scientists to perform exploratory and predictive analysis on a wide range of data sources including microscopy…
89	Senior/Lead Data Scientist	Boston, MA 02116 (Back Bay area)	Salesforce	$82,400 a year	Each team is made up of data scientists, engineers, growth analysts, and information management experts who are dedicated to driving product strategy with data…
90	Data Scientist II	Boston, MA 02210 (South Boston area)+1 location	Teikametrics	Estimated $96.3K - $122K a year	3+ years of experience working as a professional software developer or data scientist, 2 of which may be graduate-level work in a hard science.
91	Data Scientist	Framingham, MA	Workhuman	Estimated $110K - $139K a year	Experience working with text data annotation.Experience working with speech and/or language data.Work with linguists and engineers in actively providing…
92	Senior Data Scientist/Machine Learning Engineer	Remote in Boston, MA 02109+23 locations	Recruiting From Scratch	$140,000 - $200,000 a year	Work with cross-functional teams, including lawyers, data protection and security researchers.Gather training data, and train and evaluate state-of-the-art…
93	Director, Data Science	Boston, MA 02116 (Back Bay area)	Bain & Company	Estimated $140K - $177K a year	3+ years of experience managing data scientists.Translate business objectives into data and analytics solutions and, translate results into business insights…
94	Data Scientist, Computational Biology and Rx Creation	Cambridge, MA 02139 (The Port area)+2 locations	EQRX	None	You’ll drive the adoption of data products based on seamless, transparent, data and bioinformatic tools across a data-first life sciences company.
95	Lead Data Engineer	Cambridge, MA	DeepHealth	Estimated $120K - $152K a year	Experience with imaging data (medical image data preferred).The Lead Data Engineer is responsible for managing all imaging data, metadata, and tools for…
96	Sr Data Scientist/Lead Data Scientist	Hybrid remote in Watertown, MA	Neumora	Estimated $138K - $175K a year	Mentor and supervise other data sciences.Work closely with other data scientists and engineers to help set up and run data processing, feature engineering,…
97	LEAD MACHINE LEARNING ENGINEER	Remote in Boston, MA	DraftKings	Estimated $133K - $169K a year	Collaborate with business stakeholders across the company to plan and execute valuable data science projects.Take ownership of engineering design, development,…
98	Senior Data Scientist	Boston, MA	Jerry	Estimated $126K - $159K a year	You will join a team of data engineers, data analysts, and data scientists.Partner with other data scientists to evolve, optimize and integrate machine…
99	Senior Data Analyst People Analytics	Boston, MA	Hart Consulting	$80,000 - $105,000 a year	Minimum of 5 years in a previous data analytics or data science role.The incumbent will use strong business acumen and data analytics to deliver solutions,…
100	Senior Data Scientist	Remote in Boston, MA	SimpliSafe	Estimated $115K - $146K a year	SQL and relational data modeling.Tools commonly used for data analysis such as Jupyter Notebooks.Core data science methods like machine & deep learning,…
101	Data Visualization Designer	Cambridge, MA 02139 (Cambridgeport area)	MORSE Corp	None	Experience designing and prototyping visualizations for large and complex data sets.M.S. or Ph.D. in Human Computer Interaction that focuses on data…
102	Senior Data Analyst People Analytics - Boston, MA - USA	Boston, MA	Crescentia GTS	Estimated $95.4K - $121K a year	Minimum of 5 years in a previous data analytics or data science role.The incumbent will use strong business acumen and data analytics to deliver solutions,…
103	Lead Data Scientist	Boston, MA	Putnam Investments	Estimated $134K - $170K a year	Strong ability to work across disciplines to collaborate with data scientists, software engineers, and product teams.
104	Scientist Statistician	Billerica, MA	Lantheus Medical Imaging, Inc.	Estimated $88.7K - $112K a year	Familiarized with data mining of extensive or cloud-based database platforms and ability to construct trend analysis.
105	Statistical Programmer - Entry Level	Brookline, MA 02446+1 location	Frontier Science	Estimated $61.6K - $78K a year	As a Statistical Programmer, this role is responsible for supporting the organization’s statisticians, data managers, and other staff through the use of SAS in…
