	Title	Location	Company	Salary	Synopsis
106	Senior Machine Learning Research Scientist, Prediction	Remote in Boston, MA 02210	Motional	$172,020 a year	Work closely with the Planning team to integrate your motion prediction models with our state-of-the-art driving system.Fluency in Python or C++.
107	Data Scientist / Engineer - US (Hybrid /Remote)	Remote in Boston, MA	Shift Technology	Estimated $113K - $143K a year	Implementation of the data engineering, usually from client extracts to the insertion of the data in our data stores (SQL, ElasticSearch).
108	Senior Data Analyst	Boston, MA	Epic Games	Estimated $111K - $141K a year	Perform statistical data analysis using data querying tools such as SQL and Spark.Passion for sharing data with others.Overall desire to make things better.
109	Data Scientist, Bioinformatics and Machine Learning	Cambridge, MA	Voyager Therapeutics	None	Work directly with the scientists to develop and train on consistent data management procedures around assay execution and data curation.
110	Senior Data Engineer	Cambridge, MA 02139 (Cambridgeport area)+2 locations	MORSE Corp	Estimated $128K - $162K a year	A successful candidate will be working with data scientists, software engineers, and data providers to maintain data and transforms on that data.
111	Catastrophe Analyst	Boston, MA 02111 (Central area)	Berkshire Hathaway Specialty Insurance	Estimated $74K - $93.8K a year	Experience in SQL and understanding of AIR or RMS data structure preferred, required for Senior Catastrophe Analyst.Conduct periodic training for underwriters.
112	Lead Data Scientist/ML Engineer	Remote in Boston, MA 02114	Pixability	Estimated $135K - $172K a year	Data warehousing with Snowflake and data visualization with Looker.3+ years of experience as a technical lead on successful, high-performing data science…
113	Staff Data Scientist	Boston, MA	Syrinx	Estimated $122K - $155K a year	Analyze large data sets to develop multiple, custom models and algorithms to drive innovative correlations for fraud and acceptance data as well as social data.
114	Data Analyst	Hybrid remote in Cambridge, MA 02142	Insurify	Estimated $90K - $114K a year	Building new data views + optimizing existing ones to empower teams across the business.Experience in data analysis in consumer / retail / e-commerce / SaaS.
115	Machine Learning Engineer	Boston, MA	Pison	Estimated $108K - $136K a year	Mentor junior-level scientists and engineers, focusing on software engineering skills and practices.Pison leverages our patented electroneurography (ENG)…
116	Data Scientist	Boston, MA 02110 (Downtown Crossing area)	LogRocket	Estimated $144K - $183K a year	Experience presenting insights to executives and nontechnical audiences about product analytics data.Brainstorm and test new data product ideas with the…
117	R&D Engineer	Natick, MA 01760	Delsys Incorporated	Estimated $92.1K - $117K a year	Collaborate with a multidisciplinary team of scientists, engineers, and clinicians to design technology for evaluating human movements, including exercise &…
118	Application Data Scientist (Medical Diagnostics Application)	Bedford, MA 01730	Werfen	Estimated $97.9K - $124K a year	Database development and data analysis.Experience applying data science expertise in medical diagnostics a major plus.Part of ATD sub-team in AI/ML area.
119	Statistical Programmer (SAS)	Braintree, MA	PepsiCo	$77,900 - $112,900 a year	Assist data scientists and subject matter experts in operating and improving the forecasting engines.4 years of SAS programming and data analysis experience…
120	Machine Learning Applied Scientist	Remote in Boston, MA	OfferFit	Estimated $89.1K - $113K a year	This allows lifecycle marketers to test & improve the performance of their campaigns much faster than before.Architecture/DevOps: Kubernetes, Airflow, Ansible,…
121	Statistician	Boston, MA 02116 (Back Bay area)	Karen Clark & Company	Estimated $85.9K - $109K a year	In this position, you will work closely with scientists and engineers to integrate sound statistical methods into KCC catastrophe models and conduct data…
122	Senior Data Analyst	Boston, MA 02109 (Downtown area)	Decision Point Healthcare	Estimated $90.1K - $114K a year	Understand data storage and data sharing methods.Compile and organize traditional and non-traditional healthcare data (medical claims, satisfaction survey data…
123	Quantitative Researcher	Boston, MA	Arrowstreet Capital	None	Participating in data architecture decision-making to support the Research data platform.Experience analyzing large data sets.
124	Lead Data Scientist - W-2 Only	Boston, MA	Syrinx	Estimated $146K - $185K a year	Key Responsibilities Understands and improves how data is sourced from different sources and ingested with the data integration solution Ensures that enterprise…
125	Data Scientist	Boston, MA 02116 (South End area)+2 locations	Medidata Solutions	None	Acorn AI is looking for data scientists who will help us tackle some of the most complex questions facing the industry today using our proprietary Acorn…
126	Applied Scientist - SLAM, Autonomous Mobility	Cambridge, MA	Amazon.com Services LLC	$123,300 - $160,000 a year	Experience building machine learning models or developing algorithms for business application.1+ years of experience programming in Java, C++, Python or…
127	Machine Learning Engineer	Cambridge, MA 02142 (Kendall Square area)+8 locations	Flagship Pioneering, Inc.	Estimated $114K - $144K a year	Proficiency in Python and experience analyzing data with Numpy/Scipy, R, or similar.They will collaborate closely with computational and life scientists to…
128	Associate Director/Director, Data Science	Somerville, MA	Flagship Pioneering, Inc.	Estimated $153K - $193K a year	Collaborate closely with experimental scientists to ensure that data is generated and used effectively.Recruit, lead, mentor, and develop a talented team of…
129	Senior Applied Scientist	Remote in Boston, MA	StockX	Estimated $136K - $173K a year	Experience with big data platforms like Spark.You have dealt with data exploration, analysis, and feature engineering.
130	Machine Learning Scientist	Remote in Cambridge, MA	Kebotix	Estimated $95.3K - $121K a year	You will be responsible for research and development of novel AI/ML methods that help solving practical problems in accelerating discovery of novel functional…
131	Senior Data Scientist, Product	Cambridge, MA 02138 (West Cambridge area)+1 location	ConcertAI	Estimated $125K - $159K a year	You will collaborate with clinical data scientists, product and software engineers on prototypes and its productization.
132	Data Scientist/Sr. Data Scientist, AI and Computational Biol...	Cambridge, MA 02142 (Kendall Square area)+2 locations	Flagship Pioneering, Inc.	None	Preprocessing of data sets and data clean up.Mine and analyze large data sets.Analyze genomic data for feature selection.
133	Machine Learning Engineer	Remote in Cambridge, MA+2 locations	Alldus	Estimated $125K - $159K a year	Obtains data sets through partnerships and collaborations with research organization's.2 years industry experience including software development in Machine…
134	Associate Director of Data Science	Remote in Needham, MA 02494	Tripadvisor	Estimated $176K - $222K a year	6+ years of industry experience in data science or machine learning.Beyond leading a team of ML scientists, you will also be expected to work cross…
135	Senior Data Analyst	Remote in Boston, MA	Overjet	Estimated $116K - $148K a year	Continuously identify areas of improvement to enhance data driven decision making throughout the organization.
136	NLP Engineer	Boston, MA	IMMUNITY HEALTH	Estimated $120K - $152K a year	Maintain data assets, manage data harvesting and processing projects.Immunity Health uses natural language processing, machine learning, and electronic health…
137	Content Writer - Data and Research	Remote in Cambridge, MA 02142	Insurify	None	Research/collect data for and write original editorial pieces targeted at auto insurance shoppers (research will involve data-driven analysis, so a head for…
138	1629 Data Architect	Boston, MA	Infoorigin inc	$125,000 - $195,000 a year	Responsibilities: Install and configure information systems to ensure functionality Analyze structural requirements for new software and applications Migrate…
139	Senior Data Analyst	Hybrid remote in Cambridge, MA 02142	Insurify	Estimated $109K - $138K a year	Orchestrate data solutions that improve our data quality from our insurance partners to increase trust in the data.Catered lunches in the office.
140	Machine Learning Engineering	Boston, MA	Tutor Intelligence	Estimated $98.3K - $124K a year	State-of-the-art data collection and machine learning pipelines, where on-distribution data is generated live on demand by a network of remote human workers …
141	Senior Research Data Scientist	Boston, MA	Roku	Estimated $144K - $183K a year	Provide expert consultative assistance on AI to other teams in the company, including research data scientists working in other areas of Roku's stack, and…
142	Machine Learning Engineer	Remote in Boston, MA	Manifold AI	Estimated $143K - $181K a year	You thrive on data-driven development—always looking for ways to analyze and improve with data.You've worked with large data sets.
143	Senior Data Analyst	Boston, MA 02118 (North Dorchester area)	The Greater Boston Food	Estimated $89K - $113K a year	Knowledge of data governance, data quality management concepts and data quality tools.Develop data solutions, tools, and capabilities to enable self-service…
144	Senior Data Analyst People Analytics	Boston, MA 02132 (Roslindale area)	Bryant Staffing Solutions	Estimated $108K - $136K a year	Minimum of 5 years in a previous data analytics or data science role.The incumbent will use strong business acumen and data analytics to deliver solutions,…
145	Statistical Analyst	Boston, MA	OM1	Estimated $84.6K - $107K a year	Perform data investigation and database queries.Work with clinical informatics, epidemiology, data science and engineering to develop innovative solutions to…
146	Lead Data Scientist	Needham, MA	Humanity	Estimated $94.8K - $120K a year	Developing statistical and machine learning models to predict consumer behavior, integrating survey, household and retail sales data.
147	Machine Learning Engineer	Boston, MA+2 locations	Glassdoor	Estimated $91.9K - $116K a year	Build scalable production systems for data collection, data transformation, feature extraction, model training, and testing, using distributed software tools.
148	Senior Data Analyst (Hybrid)	Waltham, MA	ZoomInfo Technologies LLC	Estimated $98.8K - $125K a year	Experience with big data analysis.Experience in data search and/or master data management (MDM) technologies/pipelines is a plus.
149	Computational Biologist, Human Data Scientist	Cambridge, MA	Vor Biopharma	None	The successful candidate will work with a group of multi-disciplinary scientists and apply data mining expertise to support the development of innovative cell…
150	Data Science Manager, Marketing Analytics (Remote)	Remote in Boston, MA	Drizly	$137,141 a year	Building and executing a data science product portfolio that supports our Marketing and Strategic Partnerships teams.Health, Dental, and Vision Insurance.
151	Senior Data Analyst	Boston, MA	Piaggio Fast Forward	Estimated $103K - $130K a year	You're obsessed with technology and data.Expertise in all relevant business data sets at PFF.Experience with data warehousing and Business Intelligence tools…
152	Sr. Data Analyst, Neurosurgery & General Surgery	Remote in Burlington, MA 01803	BK Medical	Estimated $72.8K - $92.2K a year	Continuously improve quality of company data.Publish weekly, monthly, and quarterly reports in the form of data stories and/ or Excel-based reports to…
153	Senior Claims Data Analyst	Remote in Boston, MA	Cohere Health	None	Strong interest and understanding of EMR data, Claims and SDOH data.Perform and review quality checks on incoming, outgoing and aggregated data in order to…
154	OCT Image Processing and Machine Learning Fellowship	Boston, MA 02114 (West End area)	The Tearney Lab	Estimated $103K - $130K a year	The fellowship will focus on advancing state-of-the-art in automated cancer detection via medical image analysis to solve challenging problems in processing,…
155	Sr. Director of Data Science	Boston, MA	Catapult Sports	Estimated $197K - $249K a year	Prior experience as a data scientist developing and iterating models using various algorithms and techniques.Strong expertise in data science/machine learning.
156	Senior Clinical Data Analyst	Remote in Boston, MA 02215	Dana-Farber Cancer Institute	None	Collaborate with researchers and other informatics staff to develop data dictionaries, data models and other metadata that will enhance the usability of the…
157	Business Intelligence Analyst	Remote in Hudson, MA 01749	ECC	Estimated $64K - $81K a year	Strong data analysis skills, identify data anomalies and review data trends.Collaborating with team members for the purpose of collecting data and executing…
158	Data Science Team Leader	Boston, MA	Pagaya	Estimated $127K - $161K a year	We're looking for a technical leader who can direct data science projects, delegate tasks in order to manage team workloads and mentor junior researchers…
159	Senior Principal Data Scientist	Boston, MA	Cambridge Consultants Ltd	Estimated $160K - $202K a year	You will bring your strong team leadership and collaborative skills to bear by taking significant responsibility for technical delivery, on projects ranging…
160	Data Science Team Leader	Boston, MA	Pagaya Investments	Estimated $127K - $161K a year	We’re looking for a technical leader who can direct data science projects, delegate tasks in order to manage team workloads and mentor junior researchers…
161	Associate Scientist III(Python,C++,Genomics,Machine Learning...	Cambridge, MA	Tellus Solutions	$36.00 - $36.73 an hour	Must be expert in at least one area of causal inference such as interpretable machine learning or data fusion problem, e.g., to reduce space of plausible causal…
162	Machine Learning Engineer / Senior Machine Learning Engineer	Cambridge, MA+1 location	Modulate	$125,000 a year	Analyze model performance across large amounts of in-domain data.Come work on making voice chat safer and more inclusive with Modulate's Machine Learning Team!
163	Data Engineer	Remote in Boston, MA 02110	Corvus Insurance	Estimated $116K - $148K a year	Design data pipelines to gather and store large quantities of cyber security data.Managing research, ingestion and synthesis of new data sources, including…
164	Polymer Physicist/Mathematician	Hybrid remote in Boston, MA 02128	Cybertech Inc	Up to $80,000 a year	Background in mathematics and demonstrated experience in data filtering and regression.Our Fortune 500 client seeks a Polymer Physicist to join their team in a…
165	Senior Statistician	Remote in Boston, MA 02108	Alimentiv	Estimated $104K - $132K a year	Work with data management team to ensure data captured incorporates and corresponds to project protocols and requirements.DEPARTMENT/UNIT NAME: Data Sciences.
166	Director Data Science AI	Cambridge, MA 02138 (West Cambridge area)	ConcertAI	Estimated $145K - $183K a year	5+ years of data science experience (statistics, data mining, machine learning).As the Company’s strategy is designing studies based around both study intent…
167	Senior Machine Learning Engineer	Remote in Boston, MA+1 location	PathAI	Estimated $144K - $182K a year	We're looking for experienced machine learning scientists to join our team and help solve some of these challenges.
168	Senior Product Data Analyst	Hybrid remote in Cambridge, MA 02141	CarGurus	Estimated $96K - $122K a year	"Curiosity about creative data visualizations.Doing so will require distilling unstructured ""big data"" into practical insights.Our work makes a real impact."
169	Senior Data Analyst	Remote in Framingham, MA 01701	Definitive Healthcare, LLC	Estimated $77.2K - $97.8K a year	Manage the completion of client data integration projects.Design and implement optimized solutions using feedback from other data analysts.
170	Senior Machine Learning Software Engineer	Somerville, MA 02144 (Davis Square area)+1 location	Podimetrics Inc	Estimated $136K - $172K a year	Analyzing data to contribute to the advancement of scientific state of the art in diabetic foot research.Podimetrics, Inc. a virtual care management company is…
171	Sr HR Data Analyst	Cambridge, MA 02140 (North Cambridge area)	Forrester Research	Estimated $84.3K - $107K a year	Experience with reporting and data analysis, including data aggregation and normalization; eight years’ relevant work is preferred.
172	Machine Learning Engineer (I/II)	Remote in Boston, MA+1 location	Cohere Health	Estimated $89K - $113K a year	Experience with healthcare data such as claims and EMR data.Find the signal in incoherent clinical data.Expert in R, SQL, Python or other common analytical…
173	Lead, Machine Learning Engineering & AI Research	Boston, MA+1 location	1910 Genetics	Estimated $143K - $181K a year	Advances in big chemical data, massive computing power, artificial intelligence, and molecular dynamics simulation are changing the way we develop new drugs.
174	Senior Data Analyst	Boston, MA 02116 (Back Bay area)	Mass Dept of Transportation	$66,683 - $98,337 a year	Perform assigned tasks involving data analyses, reporting, and dashboards.Advise on best practices for data structure and analysis to communicate key messages…
175	Data Science Manager - Public Sector Environment & Climate P...	Cambridge, MA	Abt JTA	$105,000 - $168,000 a year	Provide data science/analytics leadership on public-sector environmental projects.Be accomplished in a professional service setting where they are bringing…
176	Machine Learning Manager	Boston, MA+2 locations	PathAI	Estimated $101K - $128K a year	The mission of PathAI's machine learning group is to develop models that solve a wide range of scientific and clinical problems in pathology aimed at improving…
177	Sr. Data Analyst	Remote in Hingham, MA 02043	Blue Cross Blue Shield of Massachusetts	Estimated $83K - $105K a year	Minimum 3 - 5 years of data analytics or related experience.Understanding of healthcare data reporting and the healthcare industry preferred.
178	Senior Data Scientist	Boston, MA	Genpact	$120,000 - $140,000 a year	Conduct explanatory data analysis and prepare data sources to be analyzed.Think strategically about data as a core enterprise asset and assist in all phases of…
179	Data Engineer - Data Pipelines & Data Science Platforms	Cambridge, MA 02138 (West Cambridge area)	S&P Global	$68,300 - $155,900 a year	Working with our data scientists to turn large-scale messy, diverse, and often unstructured data into a source of meaningful insights for our customers.
180	Machine Learning Scientist	Natick, MA	Exponent	Estimated $110K - $140K a year	Networking data analysis and visualization.Machine learning data set design or optimization.Supporting a range of consulting activities related to large-scale…
181	Senior Data Analyst - Financial	Boston, MA 02116 (Back Bay area)	Massachusetts Bay Transportation Authority	$75,170 - $100,260 a year	Bachelor’s degree in mathematics, statistics, data analytics.The Senior Data Analyst - Financial partners closely with IT architect data structure for assigned…
182	Analytics and Data Engineer	Remote in Boston, MA	Pippin Title	Estimated $102K - $129K a year	3+ years of experience as a data scientist, engineer, or equivalent.Experience working with data warehousing tools.
183	Principal Computer Vision and Machine Learning Engineer	Boston, MA+1 location	Dexai Robotics	Estimated $109K - $138K a year	Dexai builds futuristic robot sous-chefs which prepare food using the same tools and in the same fashion as human chefs.
184	Sr. Data Analyst, MS&T	Norwood, MA 02062	Moderna	Estimated $97.3K - $123K a year	Direct and support various data pipeline activities including source data engineering, data intake, data contextualization, and validation.
185	Harvard Postdoctoral (Postdoc) Job in Machine Learning for E...	Temporarily Remote in Boston, MA	Schepens Eye Research Institute, Massachusetts Eye...	$50,000 - $55,000 a year	In the course of this interdisciplinary project, you will collaborate with a team of world-class scientists and clinicians with backgrounds in visual…
186	Data Science Manager - Public Sector Environment & Climate P...	Cambridge, MA	Abt Associates	$105,000 - $168,000 a year	Provide data science/analytics leadership on public-sector environmental projects.Be accomplished in a professional service setting where they are bringing…
187	Research Scientist, Computational Protein Design & Machine L...	Cambridge, MA 02138 (West Cambridge area)	Manus Bio	Estimated $106K - $134K a year	Leverage the in-house enzyme engineering data to enhance machine-learning/deep-learning models.Growing knowledge of data science methods (random forest,…
188	Senior Data Scientist	Natick, MA 01760	Pillar Biosciences	None	Proven relevant experience in NGS data analytics.Proficiency with SQL in a data analysis context.Understand and explore data patterns, perform feature…
189	Senior Business Data Analyst	Boston, MA	Zscaler	Estimated $106K - $135K a year	Proven track record of executing data roadmap for support groups by translating business data needs into functional and technical requirements for the data…
190	Senior Manager, Data Science	Boston, MA 02116 (Back Bay area)+1 location	Bain & Company	Estimated $130K - $164K a year	Train relevant AAG team members to support big data/data science initiatives.Develop, prototype, test, and deploy machine learning solutions on wide ranging…
191	Senior Marketing Data Analyst	Boston, MA	RUE GILT GROUPE	Estimated $97.3K - $123K a year	Required: Working knowledge of databases and data warehousing techniques.RGG business stakeholders are extremely data savvy and analytical.
192	Senior Machine Learning Engineer	Cambridge, MA+2 locations	Iterative Scopes	Estimated $124K - $157K a year	The successful candidate will work collaboratively with a diverse team of engineers and scientists in addition to having a track record of developing machine…
193	Machine Learning Infrastructure Engineer	Boston, MA	Dexai Robotics	Estimated $124K - $157K a year	Working python skills to support custom data pipelines.The ideal candidate has experience in writing big data systems or on machine learning infrastructure.
194	Machine Learning Engineer	Remote in Boston, MA	Brightcove	Estimated $136K - $173K a year	Experience with data pipelines and large scale data stores (data lake, data warehouse, Hadoop, MapReduce, Spark).
195	Senior Machine Learning Engineer - SMS	Remote in Boston, MA	Klaviyo	Estimated $142K - $179K a year	The company's hybrid customer-data and marketing-platform model allows companies to grow by fostering direct relationships with customers, without giving up…
196	AI Engineer	Newton, MA 02458	PaxeraHealth	Estimated $87.4K - $111K a year	The AI chatbot “ Erabot'' Is designed to enable direct interaction with the PACS through voice commands allowing providers to seamlessly review relevant patient…
197	Principal Computer Vision and Machine Learning Engineer	Boston, MA+2 locations	Dexai Robotics	Estimated $109K - $138K a year	Dexai builds futuristic robot sous-chefs which prepare food using the same tools and in the same fashion as human chefs.
198	Senior Data Analyst - NLP	Framingham, MA	Workhuman	Estimated $98K - $124K a year	Master's or above degree in data science, data analytics, computer science or other relevant field.Work with data scientists, researchers, engineers and…
199	Senior Data Scientist II	Boston, MA 02116 (South End area)	Medidata Solutions	None	Our team is composed of over 40 PhD/Masters statisticians, data scientists, analytical product leads, former FDA biostatisticians and computational genomicists.
200	Sr Data Science Specialist	Remote in Somerville, MA 02144+1 location	The Trustees of Tufts College	Estimated $96.4K - $122K a year	Data science scholarship includes cutting-edge methods and tools for data engineering, data analysis, and data visualization.
201	Polymer Physicist/Mathematician	Hybrid remote in Boston, MA 02128	Cybertech Inc	Up to $80,000 a year	Background in mathematics and demonstrated experience in data filtering and regression.Simulate compression of various types of membrane filters.
202	Statistical Analyst	Burlington, MA 01803	MedAdvisor & Adheris Health	Estimated $71.4K - $90.4K a year	Experience with advanced data manipulation techniques required.Previous experience with healthcare data a plus.Recent college grads strongly considered.
203	Autonomous AI/ML Software Engineer	Cambridge, MA 02138 (West Cambridge area)	Aurora Flight Sciences	Estimated $83K - $105K a year	As such, candidates must have excellent communication and organizational skills and the desire to take on new tasks and develop new skills.C/C++, Qt, or Java.
204	Senior Marketing Data Analyst	Remote in Boston, MA	Circle	Estimated $96.3K - $122K a year	Identifying trends in the data to inform ongoing strategy.Collecting and analyzing data from multiple sources to arrive at critical information for the…
205	Machine Learning Engineer	Hybrid remote in Watertown, MA	Neumora	Estimated $115K - $146K a year	Collaborate with a cross-disciplinary team of scientists, clinicians, data scientists and data engineers.Bachelor's Degree in Computer Science/Data Science…
206	Associate Director, Statistical Programming - 2250	Cambridge, MA	Editas Medicine	Estimated $112K - $142K a year	Implements sophisticated algorithms to derive complex datasets, and address emerging data.Documents data and programming information in accordance with SOPs,…
