	Title	Location	Company	Salary	Synopsis
0	Senior Data Analyst	Remote in Texas	Hire With Jarvis	$120,000 - $170,000 a year	Expertise in SQL and data visualization.Experience working with relational data models and statistical principles.This is a fully remote permanent position.
1	Data Scientist - (2+ yrs of statistics & R programming exp....	Texas	#twiceasnice Recruiting	Estimated $96.7K - $122K a year	Salary: Commensurate with Experience + Bonus + Benefits.Benefits: Medical, Dental, Vision, 401k, Holidays, Unlimited PTO .
2	Data Scientist - Entry to Expert Level Virtual Hiring Event	United States	National Security Agency (NSA)	$74,682 - $176,300 a year	Passing this examination is a requirement in order to be considered for selection into a data scientist position.
3	Senior Data Scientist - International	United States	Indeed	$123,000 - $179,000 a year	Passion to answer Product/Engineering questions with data.Can train and deploy deep learning models for natural language data.
4	Senior Data Scientist	United States	Good Parents Inc.	From $110,000 a year	REST APIs, data pipelines and annotation tools.Experience or familiarity with data exploration, analysis and visualization tools.
5	Director, Data Science- SMB Labs	Remote in United States	Indeed	$214,000 - $310,000 a year	In this role, you will lead teams of machine learning engineers, scientists, and statisticians who exhibit high energy, deep technical skills, and a drive to…
6	Senior Data Engineer	Remote in United States	SAIC	$125,001 - $150,000 a year	The data engineer also implements data tests for quality and also focuses on improving inefficient tooling and adopting new transformative technologies while…
