	Title	Location	Company	Salary	Synopsis
697	AI Compiler Engineer	San Jose, CA	聯發科技	Estimated $96.9K - $123K a year	分公司地點 聖荷西(加州) 職類 Algorithm & Architecture 工作經驗 小於兩年工作經驗 教育程度 碩士 As an AI compiler engineer you will work on the design and implementation of a neural network…
698	Geophysics ML Engineer, Early Stage Project	Mountain View, CA	Loon	Estimated $107K - $136K a year	X is Alphabet’s moonshot factory. We are a diverse group of inventors and entrepreneurs who build and launch technologies that aim to improve the lives of…
699	Software Development Engineer, Alexa AI	Sunnyvale, CA	Amazon.com Services LLC	$143,650 - $194,349 a year	1+ years of experience contributing to the architecture and design (architecture, design patterns, reliability and scaling) of new and current systems. 2+…
700	AI/ML Research Engineer	San Jose, CA	聯發科技	Estimated $131K - $165K a year	分公司地點 聖荷西(加州) 職類 Software 工作經驗 兩年以上工作經驗 教育程度 碩士 Research professionals in MediaTek are defined by their innovative creations. MediaTek has the corporate…
701	2022 PhD Residency - Artificial Intelligence	Mountain View, CA	Loon	Estimated $50.7K - $64.3K a year	X is Alphabet’s moonshot factory. We are a diverse group of inventors and entrepreneurs who build and launch technologies that aim to improve the lives of…
702	AI DEVELOPER	Sunnyvale, CA 94089 (Lakewood area)	Acuitus	Estimated $97.1K - $123K a year	We are leveraging the state-of-the-art in Artificial Intelligence along several critical dimensions. Our psychological modeling, for capturing the behaviors…
703	Automotive AI / Machine Learning Engineer	Sunnyvale, CA+1 location	Bertrandt	Estimated $119K - $151K a year	Overview: Bertrandt - your trustworthy engineering partner Looking for a career, not just a job? Want to join a dynamic team working for an international…
704	Java Machine Learning Programmers & Scientists	Santa Clara, CA 95051	PerformanceStar	Estimated $42.3K - $53.5K a year	PerformanceStar LLC is seeking software developers and software scientists to join our team. The successful candidate must thrive on developing and…
705	Manager, Data Science & Analytics	San Mateo, CA	Verkada	Estimated $109K - $138K a year	Who We Are At Verkada, we’re rethinking what it means to be physically safe. Designed with simplicity in mind, we currently offer five product lines (video…
706	Development Senior Data Analyst	San Jose, CA 95134 (North San Jose area)	Second Harvest of Silicon Valley	Estimated $87.9K - $111K a year	About Second Harvest Food Bank Founded in 1974, Second Harvest of Silicon Valley is one of the largest food banks in the nation and a trusted nonprofit…
707	Software Engineer - Machine Learning	San Jose, CA	Coactive AI	Estimated $137K - $173K a year	At Coactive AI, we are empowering data practitioners and data-driven teams to unlock insights in unstructured image and video data.What you can expect from us:
708	Data Scientist	Redwood City, CA	Earli, Inc.	Estimated $91.6K - $116K a year	Minimum of 1-2 years of relevant experience in database schema design, data clean, data analysis, and data visualization.It's called a Synthetic Biopsy.
709	Senior/Lead Software Analytics Engineer (Machine Learning an...	San Jose, CA	FICO	Estimated $158K - $200K a year	Prior experience preparing data for analysis, building predictive models on large scale platforms, and helping to drive innovation into the modeling process…
710	Data Scientist	Mountain View, CA	HolyGrail	None	We are looking for a data scientist to join our team and help bring our modular CO2 scrubbers to market.We are looking for proactive candidates who are ready…
711	EDA Machine Learning Software Engineer	San Jose, CA 95134 (North San Jose area)	Cadence Design Systems	Estimated $118K - $150K a year	At Cadence, we hire and develop leaders and innovators who want to make an impact on the world of technology.Did you know that every semiconductor chip in your…
712	Senior Sales Data Analyst	Remote in Mountain View, CA	HackerRank	None	Equip GTM leaders with data and insights required to make key decisions.5+ years of managing and analyzing complex data sets from various sources.
713	Machine Learning Engineer - US	Redwood City, CA 94063 (Middlefield area)+1 location	MOLOCO	Estimated $107K - $135K a year	Moloco is a machine learning company that enables businesses to unleash the power of their own data for fast, sustainable growth and performance through the…
714	Software Engineer - Machine Learning	Mountain View, CA	Applied Intuition	Estimated $115K - $145K a year	Experience productionizing software frameworks or tools with a focus on using machine learning and data pipelines at scale.We're looking for someone who:
715	Machine Learning Engineer	Palo Alto, CA 94303	LVIS Corporation	Estimated $131K - $166K a year	Analyze, process, and augment unrefined various signal and image data.Develop, experiment, and verify a deep learning model based on signal and image data.
716	Staff Engineer, Deep Learning (NLP)	Santa Clara, CA	Eightfold.AI	Estimated $121K - $154K a year	Build data pipelines that are able to generate structure from unstructured data.Experience with analyzing large data sets, using Hadoop, Spark.
717	EDA Machine Learning Software Engineer	San Jose, CA 95134 (North San Jose area)	Cadence Design Systems	Estimated $118K - $150K a year	As a condition of employment with Cadence, newly hired employees will be required to provide Cadence with proof of full vaccination, unless legally entitled to…
718	Senior Software Engineer, Machine Learning Platform	Palo Alto, CA 94304	Woven Planet	Estimated $140K - $177K a year	Woven Planet is developing automated driving technology using a data-driven approach.Be a champion for model and data code quality and maintain a high standard…
719	Software Engineer - Data Processing and Machine Learning Pla...	San Jose, CA 95002 (North San Jose area)	Hewlett Packard Enterprise	$97,000 - $140,000 a year	The goal is to provide a platform for data scientists and machine learning engineers that is self-service, easy to use, and meets enterprise scaling…
720	Sr. Machine Learning Infrastructure Engineer	Burlingame, CA 94010	Lyra Health	Estimated $131K - $166K a year	Create data systems to collect, clean, label and store data used for model features.Experience with transforming data in both batch and streaming contexts.
721	Tech Lead Manager, Machine Learning Fairness	Mountain View, CA	ByteDance	Estimated $130K - $165K a year	Lead a team to achieve technical breakthroughs and conduct cutting-edge research in machine learning fairness and related fields.
722	Applied Data Scientist	Sunnyvale, CA 94089	Juniper Networks	Estimated $99.9K - $126K a year	You will work closely with other data scientists and domain experts throughout the life cycles of data science projects, leveraging our large datasets of…
723	VP of Research & Development – AI	Santa Clara, CA 95054	CYBER FORZA	Estimated $143K - $181K a year	7+ years of experience architecting scalable data solutions.You will be developing scalable R & D micro services, data structures and have the opportunity to…
724	Technical Project Manager (SaaS application development)	San Jose, CA 95134 (North San Jose area)	Zscaler	Estimated $105K - $133K a year	We are looking for data scientists with experience applying machine learning and modeling techniques, including natural language processing, anomaly detection,…
725	Product Manager, Machine Learning	Palo Alto, CA 94304+1 location	Woven Planet	Estimated $128K - $162K a year	Familiarity with Big Data frameworks and experience working with data products.Woven Planet is developing automated driving technology using a data-driven…
726	Machine Learning Engineer - US	Redwood City, CA 94063 (Middlefield area)+1 location	MOLOCO	Estimated $107K - $135K a year	Construct and maintain data pipelines for model training and serving using Google cloud products such as Apache Beam/Dataflow, BigQuery, and BigTable.
727	Machine Learning Infrastructure Engineer	Mountain View, CA	Boston Dynamics	Estimated $119K - $150K a year	You will have the opportunity to work alongside world-class researchers in robotics, machine learning, and computer vision.Strong C++ and Python skills.
728	Sr. Machine Learning Engineer	Palo Alto, CA	Rubrik Job Board	Estimated $133K - $168K a year	Experience with ML with sparse data is preferred.Rubrik's big idea is to provide data security and data protection on a single platform, including Zero Trust…
729	Full Stack Software Engineer - Machine Learning Infrastructu...	Mountain View, CA 94041 (Old Mountain View area)	TikTok	Estimated $108K - $136K a year	Manage and improve the pipeline of machine learning iteration, from training data management, model management, resource scheduling, push online for AB etc.
730	Software and Machine Learning Lead (Wearable Robotics Projec...	Mountain View, CA+2 locations	Loon	Estimated $141K - $178K a year	Work with internal and external partners to scope and execute data collection and testing as needed.You will be the project’s technical lead for software,…
731	Statistical Programmer	Campbell, CA 95008 (Creekside area)	Saama Technologies Inc	Estimated $107K - $135K a year	 Programming in Python/SAS for analyzing data and producing SDTM, Safety ADaM and. To provide details or data to the supervisor for updating the matrices on…
732	Senior Data Analyst, Business Operations	San Mateo, CA	Coupa Software	Estimated $108K - $137K a year	Collaborate with data engineering to improve data infrastructure and BI service model.Ability to translate quantitative data into actionable business…
733	Algorithms and Machine Learning Lead	Remote in Palo Alto, CA	Tesseract	Estimated $143K - $181K a year	Experience managing and leading teams of ML engineers and scientists.Knowledge and experience in infrastructure including cloud services (Amazon AWS),…
734	Manager, Machine Learning	Redwood City, CA	Light Labs, Inc.	Estimated $121K - $153K a year	Lead a team leveraging Light's unique data streams to generate state-of-the-art deep learning models helping to enable machines to see better than humans.
735	Cloud Data Architect Advisor	San Jose, CA	Micron	None	Strong experience with data warehouses, data virtualization, enterprise data management technologies and analytics platforms.
736	Data Engineer	San Jose, CA+1 location	Micron	Estimated $121K - $153K a year	Work with Data Scientists to implement strategies for cleaning and preparing data for analysis, to develop data imputation algorithms, and optimize performance…
737	AI Engineer	Mountain View, CA	Huddl	Estimated $110K - $139K a year	Use NLP and ML techniques to bring order to unstructured data.The ideal candidate will have experience in the latest techniques in Artificial Intelligence,…
738	Director, Data Science & Analytics - Growth	San Mateo, CA	Roblox	Estimated $156K - $197K a year	We cover a wide area of the data spectrum including analytical data engineering, product analytics, experimentation, causal inference, statistical modeling and…
739	Analytics Software – Artificial Intelligence Engineer	San Jose, CA	FICO	Estimated $113K - $143K a year	Prior experience preparing data for analysis, building predictive models on large scale platforms, and helping to drive innovation into the modeling process…
740	Software Engineer, Machine Learning and Artificial Intellige...	Palo Alto, CA	Mashgin	Estimated $121K - $153K a year	Working with the product team to come up with innovative ways to collect large data sets for training AI systems or generating equivalent synthetic data.
741	Machine Learning Engineer	Redwood City, CA	UnifyID	Estimated $136K - $172K a year	Experience working with high volumes of data, ideally with machine learning playing a critical role.Knowledge of cybersecurity, signals processing, or…
742	Machine Learning Software Engineer, Avatar	San Mateo, CA+2 locations	Roblox	Estimated $106K - $134K a year	As a Machine Learning Engineer, you will use the latest advances in deep learning, computer vision, NLP and graphics to empower the creation of immersive…
743	Machine Learning Hardware Engineer	Palo Alto, CA+2 locations	Rivian Automotive	Estimated $97K - $123K a year	Strong understanding of sensor data formats.In this position you will be a key member of a team involved in the selection, design, development and system level…
744	SR Machine Learning Engineer	San Jose, CA	Micron	Estimated $122K - $154K a year	Familiarity with software architecture (data structures, data schemas, etc.).3+ years of experience with big data processing and/or developing applications and…
745	Manager, Data Science	Mountain View, CA	Moveworks.ai	Estimated $111K - $140K a year	As a data science leader you will set strategic product direction through data, influence cross-company stakeholders, and grow a data science team.
746	Machine Learning (ML) Design Verification Engineer (AI2061)	San Jose, CA	SiMa.ai	Estimated $130K - $164K a year	As the Machine Learning Design Verification Engineer, you will participate in definition and develop the verification methodology for SiMa.ai’s MLSoC™.
747	SWE, Machine Learning Platform (All levels including Princip...	San Jose, CA 95134 (North San Jose area)	Zscaler	Estimated $147K - $186K a year	You will be working with the massive scale of network data, security data, and enterprise data every day.You may not have prior data science and ML background…
748	Sr Manager, Site Reliability Engineering	San Jose, CA 95134 (North San Jose area)+1 location	Zscaler	Estimated $142K - $180K a year	We are looking for data scientists with experience applying machine learning and modeling techniques, including natural language processing, anomaly detection,…
749	Distinguished Engineer, Lead Architect for Machine Learning	San Jose, CA	Infineon Technologies	Estimated $146K - $184K a year	In charge of architecture definition of the In-Memory Compute product and implementation as well as engagement with customers and partners.
750	NLP Algorithm Engineer-TikTok E-commerce	Mountain View, CA 94041 (Old Mountain View area)+1 location	TikTok	Estimated $89K - $113K a year	Master basic big data related components (Hadoop/Spark/Hive/Flink), and have experience in large-scale text data processing and cleaning.
751	Product Manager, AI/Machine Learning	Redwood City, CA	C3 AI	Estimated $124K - $157K a year	5+ years of technical product management and data science experience, with project experience in AI/ Machine Learning and enterprise software.
752	Senior Software Engineer - Machine Learning	Redwood City, CA	C3 AI	Estimated $143K - $181K a year	Build systems and tools that enable data scientists to create machine learning applications using the C3 AI Platform.Mentors junior members of the team.
753	Staff/Senior Statistical Programmer Analyst (Contractor)	Menlo Park, CA	GRAIL, Inc.	Estimated $113K - $143K a year	Have opportunities to work with data scientists closely on machine learning projects.The Senior or Staff Statistical Analyst contributes to the analysis of…
754	Software Engineer/Researcher, Graph & ML Infra, Infrastructu...	Mountain View, CA	ByteDance	Estimated $120K - $152K a year	Distributed data analytics and processing, e.g. data transforming, shuffling, and loading, etc.Knowledge graphs (e.g., construction, storage, and querying,…
755	Lead Software Engineer - Data Platform (AN)	Santa Clara, CA	Eightfold.AI	Estimated $147K - $186K a year	Contribute to the design and development of Eightfold's data platform.Large-scale distributed system design, problem-solving, and data analysis skills.
756	Senior Software Engineer, Machine Learning	San Jose, CA	Roku	Estimated $151K - $191K a year	Can work with large scale computing frameworks, data analysis systems and modeling environments.The data and advertising group at Roku is looking for seasoned…
757	Senior Data Scientist - #10758	San Mateo, CA	Fanatics Inc.	Estimated $125K - $158K a year	Ability to use SQL to perform data analysis.Leads the work of others in small groups of four to six data scientists to deliver complex models, analytical…
758	Deep Learning DevOps Engineer	Remote in San Jose, CA	Micron	Estimated $117K - $148K a year	Work with Micron IT to implement development, testing and deployment automation tools.Identify strategies and metrics for continuously improve product delivery…
759	Senior Deep Learning Engineer, Autonomy	Palo Alto, CA 94304+2 locations	Woven Planet	Estimated $153K - $194K a year	Woven Planet is developing automated driving technology using a data-driven approach.Employ supervised and self-supervised, end-to-end learned methods and…
760	Senior Principal AI System Design and Architecture Engineer...	San Jose, CA 95110 (Downtown area)	SiMa Technologies	Estimated $134K - $170K a year	SiMa.ai is looking for a Senior Principal AI System Design and Architecture Engineer to define and bring to production products for AI Embedded Edge market,…
761	Machine Learning Engineer	Redwood City, CA	Juvena Therapeutics	Estimated $108K - $137K a year	The engineer will design and implement new machine learning algorithms and collaborate with some of the top scientists in the field to reach new insights.
762	Senior Principal AI System Design and Architecture Engineer...	San Jose, CA	SiMa.ai	Estimated $134K - $170K a year	SiMa.ai is looking for a Senior Principal AI System Design and Architecture Engineer to define and bring to production products for AI Embedded Edge market,…
763	Manager, Statistical Programming (South San Francisco, CA)	San Carlos, CA 94070	Sutro Biopharma	Estimated $111K - $140K a year	Develops programs to assist data cleaning and safety review such as custom listings for manual review.Review/revise SOPs and Work Instructions, maintain…
764	Machine Learning Engineer	Fremont, CA 94538	Ascentt Business Systems	Estimated $139K - $176K a year	Experience working with data science in automotive telematics data and video is a plus.Use statistical and machine learning techniques to create scalable…
765	Senior Software Engineer - Machine Learning	San Mateo, CA	Area 1 Security	Estimated $166K - $210K a year	1 year of experience working with big data and cloud services (Amazon, Google)Familiarity with current large-scale data processing and training using efficient…
766	PhD Residency - Computer Vision/Machine Learning	Mountain View, CA	Loon	Estimated $82.7K - $105K a year	You’ll be positively challenged and pushed professionally, in ways that you may have never experienced.To be placed on one of our confidential or public X…
767	Software Engineer, AI	Santa Clara, CA	Celestial AI	Estimated $125K - $158K a year	Celestial AI is combining the strengths of photonics, mixed signal ASICs, and advanced packaging to enable a disruptive and sustainable improvement in AI…
768	Deep Learning Neural Architecture Search Researcher	Santa Clara, CA	Qcom	Estimated $92K - $117K a year	Engineering Group, Engineering Group > Machine Learning Researcher.The R&D work responsibility for this position focuses on the following.
769	Senior Machine Learning Engineer	Palo Alto, CA	AppLovin	Estimated $131K - $166K a year	Optimize integration between popular machine learning libraries and cloud ML and data processing frameworks.Collaborate with colleagues across multiple teams …
770	Senior Software Engineer - Machine Learning	San Jose, CA	Coactive AI	Estimated $143K - $181K a year	Research and implement the cutting edge in data-centric AI and representation learning.Collaborate with a world-class team of engineers, researchers, and…
771	Sr./Staff SDET of Autonomous Driving Data & Deep Learning	Santa Clara, CA+1 location	Faraday Future, Inc.	Estimated $112K - $141K a year	Experience with tools for manipulating big data.Analyze data sources and develop performance evaluation metrics.3+ years of test experience in AD test.
772	Senior Software Engineer, Machine Learning Big Data / Infras...	Palo Alto, CA	AppLovin	Estimated $125K - $158K a year	Optimize integration between popular machine learning libraries and cloud ML and data processing frameworks.Collaborate with colleagues across multiple teams …
773	Data Scientist	Santa Clara, CA 95050	Diskriter inc.	Up to $65 an hour	Knowledge of data analysis techniques.Help to evolve large scale Data Management Platform and tools in all aspects, from data collection to data processing,…
774	Senior Data Scientist	Santa Clara, CA 95054	Enormous Enterprise LLC	$56 - $65 an hour	Knowledge of data analysis techniques.Help to evolve large scale Data Management Platform and tools in all aspects, from data collection to data processing,…
775	Senior Data Scientist	Milpitas, CA	Tarana Wireless	Estimated $128K - $162K a year	Experience with data visualization tools.Strong skills with statistical and data software such as Pandas, Matlab.EDA toolkit design and implementation.
776	Data Scientist, ML Algorithm	Remote in San Jose, CA	ParkourSC	Estimated $127K - $161K a year	Design data-driven algorithms to infer key transportation metrics from various data sources, both ParkourSC's own data and third-party data services.
777	Data Scientist - Analytics	Remote in San Jose, CA 95131+1 location	Hypersonix Inc.	Estimated $107K - $135K a year	Should have the ability to handle structured /unstructured data and have prior experience in loading, validating, and cleaning various types of data.
778	Data Scientist, Analytics (Partnerships)	Palo Alto, CA 94306 (Evergreen Park area)+5 locations	Next Insurance	Estimated $101K - $128K a year	Partner with data engineering to design the right data model, logging, and data-pipeline foundations.Create a clear, compelling, and actionable insights based…
779	Data Scientist	Remote in Palo Alto, CA 94306	Plume	Estimated $114K - $144K a year	Design and develop data pipelines from various data sources by processing structured and unstructured data to support our machine learning and analytic needs.
780	Data Scientist	Remote in Palo Alto, CA 94301	Step	Estimated $128K - $163K a year	5+ years experience in data engineering or data science.Help build the next generation of data products at Step.Stock in an early-stage startup.
781	NLP Scientist (Remote)	Remote in Los Gatos, CA	aiXplain	Estimated $97.8K - $124K a year	Deep understanding of data structures, algorithms, and excellent problem-solving skills.Hands-on experience with horizontally scalable data stores such as…
782	Data Scientist, Biology	San Carlos, CA 94070	Atreca	Estimated $101K - $128K a year	Previous experience in data reporting.In collaboration with scientists and other stakeholders, identify R&D data to capture in our database and develop reports…
783	Data Scientist	Palo Alto, CA	Eversight	Estimated $108K - $137K a year	You will analyze the data and develop production code using the newest Data Science and Machine Learning techniques to determine the optimal prices and…
784	Data Scientist, Product	Remote in San Carlos, CA 94070+2 locations	Farmer's Business Network, Inc.	None	3+ years working with software product data to drive key business outcomes.Makes meaningful improvements in the world by translating data science into products…
785	R&D Data Scientist III	Foster City, CA	Motiv Power Systems	Estimated $105K - $133K a year	As part of a small team, you will distill business- and customer-critical information from various data sources, chiefly Motiv's extensive warehouse of vehicle…
786	Sr. Data Scientist, Product	Fremont, CA 94538 (Baylands area)	Weee! Inc	Estimated $126K - $160K a year	Partner with Data Engineering to craft our data infrastructure investments in support of BI needs and insure the proper tracking and quality of the data.
787	Senior Data Scientist - Machine Learning	Mountain View, CA 94043	CaaStle	Estimated $132K - $168K a year	Solve business problems using large-scale data analytics and algorithms.Collaborate with other teams and across systems, bringing expertise in data solutions…
788	Principal Data Scientist	Remote in San Jose, CA 95131	Hypersonix Inc.	Estimated $138K - $174K a year	Experience in data structures & algorithms skills.Experience in working on massively large-scale data.An ideal candidate should have a strong grasp of depth…
789	Sr Data Scientist	Burlingame, CA	Caban Systems	Estimated $126K - $160K a year	Define KPIs and data to be collected for measuring the success of business strategies, and work with cross-functional teams to democratize the data to make…
790	Data Scientist and AI Engineer	Santa Clara, CA	SKT Lab	None	Experience with big data tools.We are looking for a candidate with 5+ years of experience in a Data Scientist role, who has Bachelor's or Graduate degree in…
791	Senior Data Scientist at Rent-to-Own Startup	Remote in Cupertino, CA+8 locations	Recruiting From Scratch	None	You have 3+ years of experience working in data science.Day to day, you will perform a mix of exploratory data analysis, statistical modeling, software…
792	Data Scientist, Presales	Remote in Mountain View, CA+1 location	Moveworks	None	Focus on improving data quality and anomaly detection to increase trust in data.Expertise in data modeling, ETL (or relevant toolkit), and data warehousing…
793	Senior Scientist, Research Data Collection	Sunnyvale, CA	23andMe	None	Understand and review available health data with stakeholders.Optimize health data collection strategy for genetic discovery.
794	Product Intelligence Data Scientist	San Carlos, CA 94070	Joby Aviation	None	Hands-on experience with geospatial data processing and visualization.Hands-on experience with designing and implementing efficient data pipelines for TB+…
