	Title	Location	Company	Salary	Synopsis
0	Data Scientist, Operations Data Science	Hybrid remote in Mountain View, CA	Google	None	2 years of relevant work experience (e.g., as a data scientist) or equivalent.4 years of relevant work experience (e.g., as a data scientist), including…
1	Data Scientist	Santa Clara, CA+1 location	Cimetrix	$150,000 - $200,000 a year	Ability to create model-ready data from raw data, at scale.Help design, implement, and validate the ML Pipelines while collaborating with other data scientists…
2	Data Scientist - New College Grad	Remote in Palo Alto, CA 94301+1 location	Wealthfront	Estimated $109K - $138K a year	The Wealthfront data science team creates data products to deliver personalized financial product experiences, develops best in class investment algorithms, and…
3	Data Scientist, User Experience	Mountain View, CA 94041 (Old Mountain View area)+24 locations	TikTok	None	We are looking for seasoned data analysts who have strong data analysis skills to identify high-impact opportunities.
4	Research Scientist, Deep Learning L001	Mountain View, CA 94041 (Old Mountain View area)+1 location	TikTok	Estimated $107K - $136K a year	Intelligent Creations focuses on conducting cutting-edge research and development in the area of Computer Graphics, Computer Vision, Augmented Reality and Deep…
5	Data Scientist	San Jose, CA	Amply Power	Estimated $83.9K - $106K a year	Aggregate data from various sources to construct streamlined data pipelines and integrate data from multiple systems.
6	Associate Data Scientist I	San Jose, CA	UST Global	Estimated $80.6K - $102K a year	Develop data-driven solutions for difficult business challenges.Creates reports depicting the trends and behaviours from the analysed data.
7	Data Scientist	Santa Clara, CA	Colsh Consultants	Estimated $105K - $132K a year	Interpret data and analyze results.Leverage Python to analyze complex data.Assess the potential usefulness and validity of new data sources.
8	Data Scientist	San Jose, CA	ELT Solutions	Estimated $94.4K - $120K a year	Work with data engineers to ensure the availability of accurate and timely data.Assess usability of new data sources.Demonstrate ability and job history of.
9	Research Scientist - Risk Data Mining	Mountain View, CA 94041 (Old Mountain View area)+6 locations	TikTok	Estimated $74.8K - $94.8K a year	Familiarity with data mining, data science or machine learning.Reason and communicate in result-oriented, data-driven manner.
10	Data Scientist (Analytics & Statistics Focus)	Fremont, CA 94538 (Baylands area)+1 location	Clip Health	Estimated $85K - $108K a year	Building analysis tools and data dashboards.Collaborating with scientists on the design of experiments.Experience applying unsupervised machine learning and…
11	Vitria Data Scientist	Remote in Menlo Park, CA 94025	Vitria Technology	Estimated $119K - $150K a year	Proven data science or data analysis experience.Experience analysis time-series data.Detect and correlate anomalies across disparate time-series data.
12	Data Scientist, Mountain View	Mountain View, CA	Rhombus	Estimated $111K - $141K a year	Validation and quality assurance of data, models and results.Large-scale data processing and implementing batch processing pipelines in HPC or cloud…
13	Senior Data Scientist	San Jose, CA	AppZen	Estimated $136K - $172K a year	You have 5+ years of non internship professional data science experience.Our patented artificial intelligence software uses deep learning, semantic analysis,…
14	Principal Data Scientist	Santa Clara, CA	Palo Alto Networks	$111,400 a year	Collaborate with data engineers to identify data preparation, cleansing, and ETL pipelines.Experience designing unsupervised machine learning algorithms using…
15	Data Scientist	San Jose, CA+2 locations	sharethrough	Estimated $112K - $142K a year	Present findings to data scientists and product managers to influence product roadmaps.Work with our data engineering team to make the data needed for your…
16	Data Scientist, Business Intelligence	Remote in Palo Alto, CA 94306	Jumio Corporation	Estimated $117K - $148K a year	Analyzing large volume transactional data.Optimize business processes thru use of data.Analyzing high volume data flows identifying complex patterns.
17	Applied Scientist, Machine Learning	Sunnyvale, CA	Amazon.com Services LLC	$262,800 - $350,000 a year	Exposure to high-velocity time series data processing techniques.You’ll be developing state-of-the-art machine learning skills daily and collaborating with…
18	Data Scientist	Menlo Park, CA	Gayathri's Sandbox	Estimated $98.2K - $124K a year	Experiment engineers will be expected to help define and develop our core software for designing and deploying advanced experiments.
19	Staff Data Scientist, Connectivity Data and Insights	Palo Alto, CA	Rivian Automotive	Estimated $140K - $178K a year	Deep knowledge of AWS technologies on big data.You will be responsible for providing insights to the business teams and fostering a data-driven decision-making…
20	Senior Data Scientist, Recommendation & TikTok Ecosystem, US...	Mountain View, CA 94041 (Old Mountain View area)+7 locations	TikTok	Estimated $126K - $160K a year	Use data and experiments to verify hypotheses around bottlenecks in product growth, and consult on the direction for improvement.
21	Lead Data Scientist, Risk Data Mining	Mountain View, CA 94041 (Old Mountain View area)+1 location	TikTok	Estimated $128K - $162K a year	Align risk teams and their stakeholders on risk control numeric goals, promote impact-oriented, data-driven data science practices for risks.
22	Data Scientist	Palo Alto, CA 94301 (Downtown North area)	Step Mobile	Estimated $129K - $163K a year	5+ years experience in data engineering or data science.Help build the next generation of data products at Step.Stock in an early-stage startup.
23	Data Scientist	Remote in Cupertino, CA+1 location	Comcentric	$139,000 - $276,000 a year	Mentor and grow other software engineers, data scientists, and ML engineers across teams.Solid knowledge of data structures and algorithms.
24	Applied Data Scientist	San Carlos, CA 94070	Spring Discovery	Estimated $109K - $138K a year	You’re able to lead an analysis from the earliest stages of acquiring data all the way through to reaching conclusions from that data.
25	Data Scientist, Data Science and Analytics	Remote in Palo Alto, CA 94306	QuestBridge	Estimated $110K - $139K a year	Ability to leverage best coding practices to conduct data cleaning, data wrangling, analyses, and build data products.
26	Senior Data Scientist	Sunnyvale, CA 94086 (East Murphy area)	Fortinet	Estimated $132K - $167K a year	Tune the algorithms with customer data.Scale the algorithms on a big data platforms.Fortinet is currently looking for a talented individual to join our…
27	Data Scientist	Mountain View, CA 94043	Aromyx Corporation	Estimated $105K - $133K a year	Experience leveraging data analysis to construct strategic narratives.3+ years relevant experience within data science or analysis.
28	Head of Product Data Science, Workplace Management	Mountain View, CA+1 location	Atlassian	Estimated $156K - $198K a year	Lead a team of data science managers and plan insight and measurement roadmaps by collaborating with product partners, customer research, data engineers and…
29	Senior Data Scientist	Mountain View, CA	Tubular Labs	Estimated $142K - $179K a year	Develop and apply skills in challenging data science problems while working with petabyte-scale data sets.Enthusiasm to be an active and contributing member of…
30	Principal Data Scientist	Palo Alto, CA	BXGI	Estimated $120K - $152K a year	They are looking for an experienced scientist with a proven track record in taking ML and DL algorithms from concept to production.
31	VP of Data Science	Santa Clara, CA	Keewi	Estimated $116K - $147K a year	Be a jack of all trades in data: work on all stages of data science projects from understanding the data and the insights they provide to implementing solutions…
32	Principal/Senior Data Scientist, Proteomics	San Mateo, CA	PrognomIQ	None	Work closely in collaboration with laboratory and assay development scientists in order to design experiments and optimize our proteomics assays.
33	Staff Product Data Scientist	Palo Alto, CA	Celonis SE	Estimated $154K - $195K a year	Continuously engage in refining data engineering processes to ensure data accuracy, consistency, and integrity through continuous audit and review.
34	Data Scientist - Tiktok Ads, Growth Marketing	Mountain View, CA	ByteDance	Estimated $128K - $162K a year	Mentor and partner with embedded data scientists on individual channel teams to drive business performance.Examples of projects you would work on include, but…
35	Data Scientist - Tiktok Ads, Growth Marketing	Mountain View, CA 94041 (Old Mountain View area)	TikTok	Estimated $128K - $162K a year	Mentor and partner with embedded data scientists on individual channel teams to drive business performance.Examples of projects you would work on include, but…
36	Data Scientist	Redwood City, CA 94063 (Middlefield area)	MOLOCO	Estimated $95.6K - $121K a year	Data validation: verifying the data we obtain from ad exchange and the third party mobile app tracking solutions so that our campaign models get trained with…
37	PhD Residency Tapestry - Machine Learning/Time Series	Mountain View, CA+7 locations	Loon	Estimated $50.7K - $64.3K a year	You’ll be positively challenged and pushed professionally, in ways that you may have never experienced.To be placed on one of our confidential or public X…
38	Senior Data Scientist	Sunnyvale, CA 94086	NextNav	Estimated $113K - $143K a year	Demonstrated experience in rapid prototyping and an excellent data analyst of a variety of atmospheric, geospatial and time series data.
39	Senior Data Scientist - ZDX	San Jose, CA 95134 (North San Jose area)	Zscaler	Estimated $131K - $165K a year	Experience with big data tools like Hadoop, Spark, BigQuery or equivalent.Build tools to label data and work with domain experts to accelerate labeling of…
40	Principal Data Scientist	Santa Clara, CA 95054	Ordr, Inc.	Estimated $158K - $200K a year	10+ years industry experience as a senior or principal data scientist.An individual contributor role to help solve network security problems using advanced…
41	Machine Learning Engineer, Push Notification	Mountain View, CA 94041 (Old Mountain View area)+40 locations	TikTok	Estimated $100K - $127K a year	Solid experience with data structures or algorithms.Experience in one or more of the following areas: machine learning, recommendation systems, data mining or…
42	Senior Director, Data Science and AI (remote)	Remote in Santa Clara, CA	Solidigm	Estimated $163K - $207K a year	3+ years of experience in effectively managing data science teams (5-10 people).3+ years of experience in effectively managing data science teams (5-10 people)…
43	Data Scientist - Internal Audit and Risk Control	Mountain View, CA 94041 (Old Mountain View area)	TikTok	Estimated $106K - $134K a year	Participate in the deployment, testing, launch and subsequent optimization of the data model in the data development for internal systems.
44	Data Scientist (Local or Remote)	Remote in Palo Alto, CA 94301	Point Digital Finance	Estimated $81.5K - $103K a year	Play an instrumental role across various data-intensive projects.You have 2-5 years of experience in a data science role.You're skilled in R or Python.
45	Senior Research Data Scientist	San Jose, CA+1 location	Roku	Estimated $142K - $180K a year	Provide expert consultative assistance on AI to other teams in the company, including research data scientists working in other areas of Roku's stack, and…
46	Data Scientist, Strategic Customers	Mountain View, CA+2 locations	Moveworks.ai	Estimated $109K - $138K a year	You will focus on improving data quality and anomaly detection to increase trust in data.You will turn custom data solutions into product features and drive…
47	Marketing Data Scientist	Remote in Newark, CA 94560	Logitech	Estimated $101K - $128K a year	Ability to partner with the data engineering and BI teams to run workflows, requirements, and project roadmap to ensure consistent data availability, data…
48	Data Scientist & Data Storyteller, Ocean Projects (Tidal)	Mountain View, CA	Loon	Estimated $97.9K - $124K a year	Thorough understanding of the full ML pipeline, starting from data collection to model building to experimental framework to data analytics.
49	Business Analyst/Data Scientist	Menlo Park, CA	ACL Digital	Estimated $82K - $104K a year	SQL, Big Data, Python, Tableau, data modeling, data visualization and data science is required.Create new & advanced analyses using internal and external data.
50	Principal Data Scientist	Santa Clara, CA	Ordr	Estimated $145K - $184K a year	10+ years industry experience as a senior or principal data scientist.An individual contributor role to help solve network security problems using advanced…
51	Senior Data Scientist – Optimization	Redwood City, CA	C3 AI	Estimated $144K - $182K a year	You will work directly with data scientists, software engineers, and subject matter experts in the definition of new analytics capabilities able to provide our…
52	Staff Data Scientist (Applied Science), Education	Remote in Redwood City, CA	Chan Zuckerberg Initiative	Estimated $136K - $172K a year	Experience working cross-functionally with teams of product managers, engineers, designers, researchers and data scientists.
53	Machine Learning Engineer	Sunnyvale, CA 94085 (West Murphy area)+2 locations	Mercedes-Benz Research & Development North...	Estimated $94.5K - $120K a year	Very strong interest and passion in machine learning, data science and related fields.Distributed data processing in Hadoop, Spark, BigQuery, or Apache Beam.
54	Data Scientist	Remote in Menlo Park, CA	Teknatio	Estimated $112K - $141K a year	Design and develop data analytics system for networking telemetry and configuration data;Qualification: Bachelors’ degree in Computer Science or a related…
55	Research Scientist, Quantum Chemistry and Machine Learning	Mountain View, CA+6 locations	ByteDance	None	Carry out interdisciplinary research in quantum chemistry and machine learning.Perform theoretical analysis on machine-learning-based quantum chemical models.
56	Senior Data Scientist, Core DS	Mountain View, CA+1 location	Moveworks.ai	Estimated $124K - $157K a year	Collaborate with data and analytics engineers to build scalable data pipelines to support key business metrics.
57	Senior Data Scientist, Product Analytics	Mountain View, CA	Atlassian	Estimated $120K - $152K a year	Expertise in data manipulation and statistical programming languages (e.g. SQL, R, Python), and knowledge of cloud data environments (e.g. AWS).
58	Director of Machine Learning, Wake Word	Remote in Santa Clara, CA+1 location	SoundHound Inc.	Estimated $182K - $230K a year	You will have an opportunity to combine your management background and deep knowledge of ML and Software Engineering in a product-driven research environment.
59	Senior Data Scientist	Foster City, CA 94404 (Town Center area)	DISH	$115,115 a year	Ready to do efficient iterative end to end data science - from eda to model definition, hypothesis creation and testing.
60	Data Scientist / ML Engineer	Remote in Milpitas, CA 95035	INFISWIFT TECHNOLOGIES	Estimated $116K - $147K a year	Proficiency in computer science fundamentals such as data structures, algorithms and networking.Optimization of complex manufacturing pipelines using machine…
61	Principal, Data Science/Analytics	San Jose, CA 95128 (Willow Glen area)	Splunk	$110,000 a year	Develop standardized data and insights to drive pricing decisions.Lead development of Tableau dashboards to surface and redefine data.
62	Lead Data Scientist	Mountain View, CA	Cape Analytics	Estimated $104K - $131K a year	Demonstrated expertise in building data tools for ETL and data analysis.1-3 yrs of technical management experience of other data scientists.
63	Senior Data Analyst - US	Redwood City, CA 94063 (Middlefield area)	MOLOCO	Estimated $100K - $127K a year	6+ years of experience in data analytics.Experience working with data visualization tools like Looker and Tableau.
64	Senior Data Analyst	Foster City, CA 94404 (Town Center area)	DISH	$86,940 a year	Ability to tell an insightful story from the data.Do Ad-hoc analysis and explain value of data driven approach to business stakeholders.
65	Machine Learning Engineer	Mountain View, CA+4 locations	Moveworks.ai	Estimated $109K - $138K a year	Apply machine learning, NLP, and deep learning methods to unstructured data sets and complex systems.Use the latest advances in machine learning, data science,…
66	Data Science Engineer	San Jose, CA 95128 (Willow Glen area)	DTEX Systems	Estimated $98.6K - $125K a year	Translate business requirements into data models, algorithms, and processes in order to produce results from customer data sets; and,.
67	Senior Artificial Intelligence/Machine Learning Software Sci...	Santa Clara, CA 95051	PerformanceStar	Estimated $121K - $153K a year	Build flexible prototype applications for performing non-trivial analysis and reasoning over rich media data sets (sensor data, video data and audio data).
68	Sr. Machine Learning RTL Engineer	San Jose, CA 95131 (North San Jose area)	Lattice Semiconductor Corp	Estimated $140K - $177K a year	Our technology, long-standing relationships and commitment to world-class support enables our customers to quickly and easily unleash innovative solutions to…
69	Senior Data Analyst	Remote in Redwood City, CA	Zuora	Estimated $99.6K - $126K a year	Basic statistical analysis, particularly for monitoring data quality.Working cross-functionally to define and implement policies for data governance, including…
70	Machine Learning Engineer	Mountain View, CA	HolyGrail	Estimated $86.3K - $109K a year	Advanced degree in data science or equivalent experience.Detail-oriented with a creative approach to science and engineering.
71	Performance-Centric Machine Learning Research Scientist	Los Altos, CA 94022+1 location	Toyota Research Institute	Estimated $115K - $146K a year	Explore data and simulation-driven approaches to decision-making, replacing human assumptions and expertise with learned models and priors.
72	Senior Data Analyst	Remote in Mountain View, CA	Otter.ai	Estimated $96.5K - $122K a year	4+ years of work experience in a data analysis role.Partner with data engineering to enhance and curate datasets that unlock business opportunities.
73	Senior Data Scientist	Redwood City, CA 94063 (Middlefield area)	MOLOCO	Estimated $128K - $162K a year	Data validation: verifying the data we obtain from ad exchange and the third party mobile app tracking solutions so that our campaign models get trained with…
74	Managing Data Scientist	Menlo Park, CA 94025	Exponent	None	Providing expertise in machine learning, data analytics, and software development for a wide range of data including text, images, medical records, and sensor…
75	Geophysics ML Engineer, Early Stage Project	Mountain View, CA	Loon	Estimated $109K - $137K a year	Resident geophysicist on the team: define ML experiments, perform data reviews.Experience building ML models on geophysical data (seismic surveys, gravity/mag,…
76	Machine Learning Engineer, Confluence	Mountain View, CA+1 location	Atlassian	Estimated $113K - $143K a year	Work with large datasets of behavioral and textual data.2+ years of related industry experience in the data science domain.
77	Chief Data Scientist	Union City, CA 94587	Express Global Solutions	Estimated $96.6K - $122K a year	Statistical analysis: Identify patterns in data.Data storytelling: Communicate actionable insights using data, often for a non-technical audience.
78	Data Scientist, BCI Applications	Fremont, CA	Neuralink	Estimated $98.9K - $125K a year	2+ years experience in data analysis and ML.You will work with neuroscientists, physicians, software and electrical engineers to develop the next generation…
79	Sr. Data Analyst	Santa Clara, CA	Workforce Logiq	Estimated $90.1K - $114K a year	4+ years of work into data analytics.Comfortable with both structured and unstructured data.You will create data driven attribution statistical models of…
80	Business Intelligence Analyst	Remote in Burlingame, CA 94010	ECC	Estimated $64.7K - $81.9K a year	Strong data analysis skills, identify data anomalies and review data trends.Collaborating with team members for the purpose of collecting data and executing…
81	Experienced Aircraft Health Machine Learning Researcher	San Jose, CA	BOEING	$101,430 - $188,370 a year	Additionally, you will develop data mining approaches reconciling parametric system and flight characteristic data that was collected in the fleet management…
82	Sr Software Engineer - Data & Core Infrastructure	Santa Clara, CA	Eightfold.AI	Estimated $144K - $182K a year	Build data integrations and frameworks to ensure data quality/integration efficiency.We’re looking for engineers with a systems mindset who are curious and are…
83	Software and Machine Learning Lead (Wearable Robotics Projec...	Mountain View, CA+2 locations	Loon	Estimated $139K - $176K a year	Work with internal and external partners to scope and execute data collection and testing as needed.You will be the project’s technical lead for software,…
84	Machine Learning Infrastructure Engineer	Mountain View, CA	Boston Dynamics	Estimated $116K - $147K a year	You will have the opportunity to work alongside world-class researchers in robotics, machine learning, and computer vision.Strong C++ and Python skills.
85	Machine Learning Engineer	Remote in San Jose, CA	Lambda	Estimated $127K - $160K a year	Lambda's products accelerate AI research at thousands of organizations, including Intel, Microsoft, Amazon Research, Tencent, Kaiser Permanente, MIT, Harvard,…
86	Senior Data Analyst	San Jose, CA	Algonomy	Estimated $113K - $143K a year	Strong understanding of data warehouse architecture.Perform data analysis to report on program and initiative level performance.
87	Machine Learning Operations Engineer	San Jose, CA	sharethrough	Estimated $109K - $139K a year	Write Airflow ETLs to prepare data for consumption by ML models.Work with the data science team to facilitate model development and deployment.
88	Senior Machine Learning Data Engineer	Santa Clara, CA	Palo Alto Networks	Estimated $126K - $160K a year	Handle cloud deployment requirements from data scientists.Ability to understand the complex application data flows and bridge the gap between the data…
89	Machine Learning Scientist - Computer Vision	San Carlos, CA 94070	Spring Discovery	Estimated $130K - $164K a year	Experience working with microscopy data acquisition in various image file formats.Overcome analytical challenges inherent in the study of high throughput…
90	Scientist, Data Mining	San Jose, CA 95110 (North San Jose area)	TCL Research America	Estimated $109K - $138K a year	The ideal candidate is an expert in data mining and statistical analysis of large-scale data sets, for example, media content and meta-data, or user behavior…
91	Senior/Principal Data Scientist - Immunology/Oncology	Menlo Park, CA	Adicet Bio	None	Perform and support efforts in correlative data analysis from Data platform-derived data sources.The Immunology/Oncology leaning Data Scientist will perform…
92	Machine Learning and Optimization Research Engineer	Mountain View, CA	Loon	None	This capability could enable applications ranging from integrated photonics to metasurfaces, and requires technical developments in ultra-large-scale simulators…
93	Computer Vision Data Scientist	Palo Alto, CA+2 locations	Rivian Automotive	Estimated $118K - $150K a year	Experience in data analysis and data mining.Work on the data infrastructure to support data analytics and annotation using computer vision and deep learning…
94	AI Software Engineer	San Jose, CA 95117 (West San Jose area)	Juji	Estimated $101K - $128K a year	Expert-level programming experience in numerical data processing.Our ideal candidates are open-minded and well-trained individuals who are skillful and…
95	Machine Learning/Computer Vision Scientist	Remote in Palo Alto, CA	Tesseract	Estimated $132K - $168K a year	5 years of strong experience in medical imaging, with a preference for ophthalmic imaging data such as OCT and fundus images.
96	DEMQRA Data Analytics Engineer	San Jose, CA+1 location	Micron	Estimated $93.9K - $119K a year	Possess the ability to start at any point in the process and trace either backwards or forwards through a combination of SQL queries, use of custom Micron data…
97	Director, Clinical Programming & Data Science	Remote in Palo Alto, CA 94306	Vincerx Pharma, Inc.	Estimated $152K - $192K a year	Develop standardized processes for clinical data downloads and data transfers to and from service providers.Develop SAS macro libraries to standardize routine…
98	Senior ML Engineer	Santa Clara, CA	Celestial AI	Estimated $124K - $158K a year	Experience as an ML Engineer or data scientist, either in academia or in industry.Experience writing code in Python and using Python data-science frameworks.
99	Computer Vision Data Scientist	Palo Alto, CA	Rivian Automotive	Estimated $118K - $150K a year	Experience in data analysis and data mining.Work on the data infrastructure to support data analytics and annotation using computer vision and deep learning…
100	Manager, Data Science	Palo Alto, CA 94306	Orbital Insight	Estimated $113K - $143K a year	Prior experience working with a team of high-performing data scientists.Experience with time series, geospatial datasets, and applications where there exists…
