	Title	Location	Company	Salary	Synopsis
402	Sr. Data Analyst	Santa Clara, CA	Workforce Logiq	Estimated $87.5K - $111K a year	4+ years of work into data analytics.Comfortable with both structured and unstructured data.You will create data driven attribution statistical models of…
403	Business Analyst/Data Scientist	Menlo Park, CA+1 location	ACL Digital	Estimated $82K - $104K a year	SQL, Big Data, Python, Tableau, data modeling, data visualization and data science is required.Create new & advanced analyses using internal and external data.
404	Senior Research Data Scientist	San Jose, CA+1 location	Roku	Estimated $147K - $186K a year	Provide expert consultative assistance on AI to other teams in the company, including research data scientists working in other areas of Roku's stack, and…
405	DATA SCIENTIST - SMART MFG & AI	San Jose, CA+2 locations	Micron	Estimated $122K - $154K a year	Ability to extract data from different databases via SQL and other query languages and applying data cleansing, outlier identification, and missing data…
406	Data Scientist	Remote in Menlo Park, CA	Teknatio	Estimated $112K - $142K a year	Design and develop data analytics system for networking telemetry and configuration data;Qualification: Bachelors’ degree in Computer Science or a related…
407	Senior Data Scientist – Optimization	Redwood City, CA	C3 AI	Estimated $140K - $177K a year	You will work directly with data scientists, software engineers, and subject matter experts in the definition of new analytics capabilities able to provide our…
408	Principal Data Scientist	Santa Clara, CA 95054	Ordr, Inc.	Estimated $156K - $198K a year	10+ years industry experience as a senior or principal data scientist.An individual contributor role to help solve network security problems using advanced…
409	Director, Data Science	Hybrid remote in Belmont, CA 94002	RingCentral	Estimated $147K - $186K a year	Evangelize the data science and research function within RingCentral and foster a strong data science community.Paid parental leave and new parent gift boxes.
410	Sr. Data Scientist, Assay Development	Palo Alto, CA	Delfi Diagnostics	None	The Senior Data Scientist will collaborate with a cross-functional team of laboratory scientists, clinicians, engineers, and other data scientists to develop…
411	Machine Learning Engineer, Push Notification	Mountain View, CA 94041 (Old Mountain View area)+39 locations	TikTok	Estimated $100K - $127K a year	Solid experience with data structures or algorithms.Experience in one or more of the following areas: machine learning, recommendation systems, data mining or…
412	Lead Software Engineer - Data Platform (AN)	Santa Clara, CA	Eightfold.AI	Estimated $185K - $235K a year	Contribute to the design and development of Eightfold's data platform.Large-scale distributed system design, problem-solving, and data analysis skills.
413	Senior Data Scientist - #10758	San Mateo, CA	Fanatics Inc.	Estimated $127K - $161K a year	Ability to use SQL to perform data analysis.Leads the work of others in small groups of four to six data scientists to deliver complex models, analytical…
414	Principal Data Scientist - #11619	San Mateo, CA+1 location	Fanatics Inc.	Estimated $133K - $168K a year	Ability to use SQL to perform data analysis.Leads the work of others in small groups of four to six data scientists to deliver complex models, analytical…
415	Research Scientist, Deep Learning L001	Mountain View, CA+4 locations	ByteDance	Estimated $107K - $136K a year	Intelligent Creations focuses on conducting cutting-edge research and development in the area of Computer Graphics, Computer Vision, Augmented Reality and Deep…
416	Scientist/Senior Scientist	Menlo Park, CA 94025	Exponent	Estimated $132K - $168K a year	Providing expertise in data analytics and/or machine learning for a wide range of data, including text, numeric, geographic, and sensor data, as well as medical…
417	Senior Data Analyst - US	Redwood City, CA 94063 (Middlefield area)	MOLOCO	Estimated $96.1K - $122K a year	6+ years of experience in data analytics.Experience working with data visualization tools like Looker and Tableau.
418	Talent Acquisition Partner - Machine Learning - Mountain Vie...	Mountain View, CA 94041 (Old Mountain View area)	TikTok	Estimated $86.8K - $110K a year	Demonstrated success filling data or machine learning-related engineering roles.Partner closely with hiring managers and other stakeholders to develop sourcing…
419	Deep Learning Engineer, EDR	Palo Alto, CA+2 locations	Rivian Automotive	Estimated $96.7K - $122K a year	In this role, you will be develop real-time software algorithms that will involve interacting different messaging channels (like ethernet and CAN) with other…
420	Artificial Intelligence (AI) Trainer	San Jose, CA 95117 (West San Jose area)	Juji	Estimated $76K - $96.2K a year	Familiar with basic statistics and data processing software.Our ideal candidates are open-minded, multi-talented individuals who are sensitive to the nuances…
421	Head of Data Science	Palo Alto, CA 94304	Juvena Therapeutics	None	Experience in analyzing and data mining human and animal model OMICs datasets.PhD with 10+ years of biotech industry experience focused on data science and…
422	Sr. Machine Learning RTL Engineer	San Jose, CA 95131 (North San Jose area)	Lattice Semiconductor Corp	Estimated $120K - $152K a year	Our technology, long-standing relationships and commitment to world-class support enables our customers to quickly and easily unleash innovative solutions to…
423	Machine Learning Engineer	Remote in San Jose, CA	Cadent	Estimated $115K - $145K a year	Experience analyzing and deriving insights from massive amounts of data.Experience maintaining big-data pipelines a big plus.Python and SQL are required.
424	Sr, Data Analyst	San Mateo, CA	NetStrive Consulting, LLC	Estimated $81.1K - $103K a year	Write scripts to Perform data management and data quality checks on the huge volumes historical data received, streamline and align with current data received…
425	Engineering Manager, Risk Data Mining	Mountain View, CA 94041 (Old Mountain View area)	TikTok	Estimated $128K - $162K a year	Familiarity with data mining, data science, machine learning or finance/social plaform risk defense.2+ years of software engineering or data science managerial…
426	Engineering Manager, Machine Learning - Trust & Safety	Mountain View, CA 94041 (Old Mountain View area)	TikTok	Estimated $140K - $178K a year	Collaborate with production engineering team, product team, data analyst team for developing novel solutions to challenging problems in the Trust and Safety…
427	Machine Learning Engineer	Palo Alto, CA 94303	LVIS Corporation	Estimated $139K - $177K a year	Analyze, process, and augment unrefined various signal and image data.Develop, experiment, and verify a deep learning model based on signal and image data.
428	Senior Staff Software Engineer, Machine Learning, Recommenda...	Hybrid remote in Mountain View, CA+2 locations	Google	None	8 years of experience in software development and with data structures/algorithms.We're looking for engineers who bring fresh ideas from all areas, including…
429	Data Science Engineer	San Jose, CA 95128 (Willow Glen area)	DTEX Systems	Estimated $95K - $120K a year	Translate business requirements into data models, algorithms, and processes in order to produce results from customer data sets; and,.
430	2022 PhD Residency - Artificial Intelligence	Mountain View, CA	Loon	Estimated $50.7K - $64.3K a year	You’ll be positively challenged and pushed professionally, in ways that you may have never experienced.To be placed on one of our confidential or public X…
431	Data Scientist – Biology	Menlo Park, CA 94025	Octave Bioscience	None	The data scientist will be primarily responsible for delivering actionable insights from our proteomic biomarker program but also be involved with projects…
432	Senior Data Scientist	Redwood City, CA 94063 (Middlefield area)	MOLOCO	Estimated $123K - $155K a year	Data validation: verifying the data we obtain from ad exchange and the third party mobile app tracking solutions so that our campaign models get trained with…
433	Researcher in Machine Learning Systems	Mountain View, CA+7 locations	ByteDance	Estimated $92.4K - $117K a year	The following experiences are a plus: GPU based high-performance computing, RDMA high-performance network; Tensorflow, Caffe, MxNet, PyTorch or other deep…
434	Senior Data Analyst, Product Analytics	Hybrid remote in Palo Alto, CA	Hippo Insurance	Estimated $101K - $128K a year	At least 4 years of industry experience as a data scientist.Enjoy exploring large, messy data sets to extract signal and insights.
435	Scientist, Data Mining	San Jose, CA 95110 (North San Jose area)	TCL Research America	Estimated $112K - $142K a year	The ideal candidate is an expert in data mining and statistical analysis of large-scale data sets, for example, media content and meta-data, or user behavior…
436	Machine Learning Scientist - Computer Vision	San Carlos, CA 94070	Spring Discovery	Estimated $124K - $157K a year	Experience working with microscopy data acquisition in various image file formats.Overcome analytical challenges inherent in the study of high throughput…
437	Technical Lead, Machine Learning RTL Development	San Jose, CA 95131 (North San Jose area)	Lattice Semiconductor Corp	Estimated $140K - $177K a year	Our technology, long-standing relationships and commitment to world-class support enables our customers to quickly and easily unleash innovative solutions to…
438	Senior Data Scientist - Observability	San Mateo, CA+1 location	Roblox	Estimated $138K - $174K a year	Strong data engineering background. e.g. telemetry logging, data pipeline building.An expert collecting and transforming data with SQL and a scripting language…
439	Tech Lead - Machine Learning, TikTok Business Integrity	Mountain View, CA 94041 (Old Mountain View area)+1 location	TikTok	Estimated $138K - $175K a year	Build highly scalable machine learning systems in one of the following areas: ad fraud detection, risk control, ads/business integrity, to improve TikTok user's…
440	Sr. Machine Learning Engineer, Search Team	San Jose, CA+2 locations	Roku	Estimated $135K - $172K a year	You will research and prototype state of the art models, A/B test, and launch search relevance improvements in production by making data-driven decisions.
441	Machine Learning Engineer	Palo Alto, CA	Robby Technologies	Estimated $110K - $139K a year	Use deep learning or classical machine learning to do object detection, recognition or other related tasks.Experience in using Torch, TensorFlow, or equivalent…
442	Machine Learning Imaging Engineer	Remote in Palo Alto, CA+1 location	Tesseract	Estimated $138K - $175K a year	Mindset for hardware-to-algorithms imaging systems, and ability to see the bigger picture on how the source of data (hardware) relates to the algorithms.
443	Machine Learning Engineer/Scientist	Burlingame, CA+1 location	GotIt!	Estimated $108K - $137K a year	Strong software design and development skills and experience working effectively with science, data processing, and software engineering teams.
444	Senior Manager Global Facilities Technology Team Advanced Da...	San Jose, CA	Micron	Estimated $107K - $135K a year	As a Global Facilities Technology Team Senior Manager of Advanced Data and Controls, you will develop and management a team of Subject Matter Experts in the…
445	Machine Learning Engineer - US	Redwood City, CA 94063 (Middlefield area)+1 location	MOLOCO	Estimated $108K - $137K a year	Construct and maintain data pipelines for model training and serving using Google cloud products such as Apache Beam/Dataflow, BigQuery, and BigTable.
446	AI DEVELOPER	Sunnyvale, CA 94089 (Lakewood area)	Acuitus	Estimated $97.3K - $123K a year	We are looking to hire an AI Developer to continue to develop two-dimensional handwriting recognition, our human-tutor interface, as well as the modeling of…
447	Machine Learning Scientist/ Sr ML Researcher	Milpitas, CA 95035	SpanIdea	Estimated $114K - $144K a year	Research and develop advanced to core AI/Machine Learning algorithms.Read, understand, implement, improve, and explain state-of-the-art papers in the above…
448	Automotive AI / Machine Learning Engineer	Sunnyvale, CA+1 location	Bertrandt	Estimated $121K - $153K a year	And/or similar data coming from simulation (e.g. CARLA etc.).A total of around 13,000 employees at 53 locations guarantee extensive know-how, sustainable…
449	Software Engineer - Machine Learning	Mountain View, CA	Applied Intuition	Estimated $115K - $145K a year	Experience productionizing software frameworks or tools with a focus on using machine learning and data pipelines at scale.
450	AI Compiler Engineer	San Jose, CA	聯發科技	Estimated $93.2K - $118K a year	As part of a research team, you will contribute to the development of a compiler toolchain, ranging from its intermediate representations all the way to its…
451	Sr. Machine Learning Engineer	Palo Alto, CA	Rubrik Job Board	Estimated $128K - $161K a year	Experience with ML with sparse data is preferred.Rubrik’s big idea is to provide data security and data protection on a single platform, including Zero Trust…
452	Senior Data Platform Engineer - Photonics	Mountain View, CA	Aeva	Estimated $118K - $149K a year	Develop an integrated data management solution that ties-in fab & assembly manufacturing systems, test, and system data correlation database system with a user…
453	Sr. Machine Learning Engineer, SMAI	San Jose, CA	Micron	Estimated $127K - $160K a year	Familiarity with software architecture (data structures, data schemas, etc.).3+ years of experience with big data processing and/or developing applications and…
454	Program Manager, Discovery & Early Development	San Carlos, CA 94070	Spring Discovery	Estimated $110K - $139K a year	3+ years of direct project management experience in biotech or pharma.Familiarity with the overall drug discovery and development process up to initial…
455	Staff Engineer, Deep Learning (NLP)	Santa Clara, CA	Eightfold.AI	Estimated $133K - $168K a year	Build data pipelines that are able to generate structure from unstructured data.Experience with analyzing large data sets, using Hadoop, Spark.
456	Senior Deep Learning Engineer, Autonomy	Palo Alto, CA 94304+2 locations	Woven Planet	Estimated $138K - $175K a year	Woven Planet Level 5 is developing automated driving technology using a data-driven approach.Employ supervised and self-supervised, end-to-end learned methods…
457	Manager, Machine Learning	Redwood City, CA	Light Labs, Inc.	Estimated $127K - $161K a year	Lead a team leveraging Light's unique data streams to generate state-of-the-art deep learning models helping to enable machines to see better than humans.
458	Full Stack Software Engineer - Machine Learning Infrastructu...	Mountain View, CA 94041 (Old Mountain View area)	TikTok	Estimated $113K - $143K a year	Manage and improve the pipeline of machine learning iteration, from training data management, model management, resource scheduling, push online for AB etc.
459	R&D Systems Engineer (Embedded Machine Learning Algorithm De...	Santa Clara, CA 95051+1 location	225 Qualcomm Technologies, Inc.	Estimated $113K - $143K a year	Using deductive and inductive problem solving; multiple approaches may be taken/necessary to solve the problem; often information is missing or conflicting;…
460	NLP Algorithm Engineer-TikTok E-commerce	Mountain View, CA 94041 (Old Mountain View area)+1 location	TikTok	Estimated $88.3K - $112K a year	Master basic big data related components (Hadoop/Spark/Hive/Flink), and have experience in large-scale text data processing and cleaning.
461	Machine Learning Engineer	Palo Alto, CA 94304	Juvena Therapeutics	Estimated $99.4K - $126K a year	Lastly, he or she will have the ability to flexibly support multiple research projects as the ML expert iteratively deploys insights from models and integrates…
462	IoT Machine Learning Software Engineer	Santa Clara, CA	Palo Alto Networks	Estimated $104K - $132K a year	Discover new data and vulnerability insights by analyzing IoT network traffic data, and performing IoT data mining and possibly threat hunting.
463	Backend Software Engineer (AI + SaaS + Dist Systems)	Santa Clara, CA	Eightfold.AI	Estimated $131K - $166K a year	Design and develop safe and reliable data pipelines for high-scale data integration for the fortune 500 customers.Apache Spark, Solr, Mysql, Docker.
464	Manager, Data Science & Analytics	San Mateo, CA	Verkada	Estimated $108K - $137K a year	Experience building and architecting data pipelines.Build revenue optimization models using a wealth of structured in-house data.
465	Sr. ML Engineer	Remote in Los Gatos, CA 95030	Cradlepoint	Estimated $141K - $178K a year	Curate large, distributed data sets.Design ML pipeline optimized for the available data.You will work with a group of high-performing engineers who design,…
466	Senior Software Engineer - Machine Learning	Mountain View, CA	ByteDance	Estimated $130K - $164K a year	Experience with big data analytics platforms such as Spark and Flink.Experience with technologies enabling reliable data processing pipelines such as Kafka,…
467	Machine Learning Data Engineer -San Jose CA	Santa Clara, CA+1 location	Cimetrix	Estimated $113K - $143K a year	Ability to create model-ready data from raw data, at scale.Understanding of the data-centric aspects of machine learning pipelines including data retrieval,…
468	Sr Manager, Site Reliability Engineering	San Jose, CA 95134 (North San Jose area)+3 locations	Zscaler	Estimated $137K - $173K a year	We are looking for data scientists with experience applying machine learning and modeling techniques, including natural language processing, anomaly detection,…
469	AI Hardware Architect / Engineer	San Jose, CA	聯發科技	Estimated $110K - $139K a year	In this position, you'll conduct architectural research for the field of AI technology.You are expected to have knowledge in AI algorithms, and how they affect…
470	AI/ML Research Engineer	San Jose, CA	聯發科技	Estimated $96.7K - $122K a year	Research and develop machine learning systems for model training and inference.Research and develop new ML algorithms for next generation mobile, wireless…
471	Product Manager, AI/Machine Learning	Redwood City, CA	C3 AI	Estimated $132K - $168K a year	Mentor and provide expert guidance to data scientists and business leads from customer teams on C3 AI Suite capabilities.
472	Senior Software Engineer - Machine Learning	Redwood City, CA	C3 AI	Estimated $137K - $174K a year	Build systems and tools that enable data scientists to create machine learning applications using the C3 AI Platform.Mentors junior members of the team.
473	AI Engineer	Mountain View, CA	Huddl	Estimated $106K - $134K a year	Use NLP and ML techniques to bring order to unstructured data.The ideal candidate will have experience in the latest techniques in Artificial Intelligence,…
474	Senior Machine Learning Infrastructure Engineer	Mountain View, CA+1 location	Moveworks.ai	Estimated $132K - $167K a year	Leverage your experience to drive best practices in ML and data engineering.Collaborate with cross functional teams of engineers, data analytics, machine…
475	Senior Software Engineer - Machine Learning	San Mateo, CA	Area 1 Security	Estimated $148K - $187K a year	1 year of experience working with big data and cloud services (Amazon, Google)Familiarity with current large-scale data processing and training using efficient…
476	Senior Machine Learning Engineer, Confluence Cloud	Mountain View, CA	Atlassian	Estimated $130K - $165K a year	Work with large datasets of behavioral and textual data.5+ years of related industry experience in the data science domain.
477	Senior AI Engineer (Multi-year contract opportunity)	Belmont, CA	Volkswagen Group of America - Chattanooga...	None	Experience with data gathering, data quality, system architecture, coding best practices.Senior AI Engineer (Machine Learning/Deep Learning).
478	Staff Software Engineer (C & Networking)	San Jose, CA 95134 (North San Jose area)+1 location	Zscaler	Estimated $137K - $173K a year	We are looking for data scientists with experience applying machine learning and modeling techniques, including natural language processing, anomaly detection,…
479	Sr. Software Engineer (Windows Device Drivers)	San Jose, CA 95134 (North San Jose area)	Zscaler	Estimated $111K - $141K a year	We are looking for data scientists with experience applying machine learning and modeling techniques, including natural language processing, anomaly detection,…
480	Senior Principal AI System Design and Architecture Engineer...	San Jose, CA	SiMa.ai	Estimated $128K - $163K a year	SiMa.ai is looking for a Senior Principal AI System Design and Architecture Engineer to define and bring to production products for AI Embedded Edge market,…
481	Kubernetes and Docker Cloud Developer	Remote in San Jose, CA	Frontier Technology Inc.	Estimated $105K - $132K a year	Experience working with data stores/databases.Candidates must be able to work both independently and together with scientists and other software engineers in…
482	Senior Software Engineer, Conversation AI	Mountain View, CA	Moveworks.ai	Estimated $121K - $153K a year	Harvest and analyze user conversational behavior data.Deep understanding of data, relevance, and metrics.Hybrid expertise with framework API, data analysis,…
483	Senior Software Engineer, Machine Learning Big Data / Infras...	Palo Alto, CA	AppLovin	Estimated $115K - $145K a year	Optimize integration between popular machine learning libraries and cloud ML and data processing frameworks.The company’s first-party content includes over 200…
484	Senior Data Scientist	Santa Clara, CA	iTrending Solutions	$50 - $60 an hour	Knowledge of data analysis techniques.Experience in the implementation and validation of big data algorithms and models.Pay: $50.00 - $60.00 per hour.
485	Data Scientist	Santa Clara, CA 95050	American nexus Trading inc	$60 - $65 an hour	Position : Service Now HRSD (Specialist ).Location : Santa Clara , CA ( onsite ).HR Delivery Manager \*\*\* Certified Implementation Specialist – HR (CIS-HR)…
486	Data Scientist	San Jose, CA	Digital Dhara LLC	$60 - $70 an hour	Familiarity with data management tools.Strong data management technology background.Big data: 5 years (Preferred).Here's how you'll contribute:
487	Data Scientist	Santa Clara, CA	NutaNXT Technologies	Estimated $93.5K - $118K a year	Apply innovative analytical techniques to customer and transaction data to build risk mitigation strategies and processes.Develop and manage scoring models.
488	Data Scientist	Remote in Palo Alto, CA 94301	Step	Estimated $135K - $171K a year	5+ years experience in data engineering or data science.Help build the next generation of data products at Step.Gen Z is the generation of the side hustle.
489	Mathematical Scientist	San Jose, CA 95131 (North Valley area)	Pit.AI Technologies Inc.	$150,000 a year	Core to our research philosophy is the need to place as little assumptions on how the world behaves as possible, but rather let the data speak for itself, and…
490	Senior Data Analyst (Loyalty & Player Engagement)	San Mateo, CA	PlayStation Global	Estimated $114K - $144K a year	Outstanding ability to interpret data and evaluate statistical and analytical approaches.You will have a deep affinity for working with quantitative data while…
491	Data Scientist	Santa Clara, CA	NutaNXT Technologies	Estimated $93.5K - $118K a year	Apply innovative analytical techniques to customer and transaction data to build risk mitigation strategies and processes.
492	Data Scientist, Presales	Remote in Mountain View, CA+3 locations	Moveworks	Estimated $115K - $146K a year	Focus on improving data quality and anomaly detection to increase trust in data.Expertise in data modeling, ETL (or relevant toolkit), and data warehousing…
493	Senior Data Scientist	Santa Clara, CA	NutaNXT Technologies	Estimated $128K - $162K a year	Demonstrable history of devising and overseeing data-centered projects.Provide solutions that go beyond traditional methods – Using advanced AI/ML technologies…
494	Data Scientist and AI Engineer	Santa Clara, CA	SKT Lab	Estimated $122K - $155K a year	Experience with big data tools.We are looking for a candidate with 5+ years of experience in a Data Scientist role, who has Bachelor's or Graduate degree in…
495	Senior Data Scientist	Remote in Redwood City, CA	Legion	Estimated $118K - $149K a year	Develop custom data models and algorithms to apply to data sets.Assess the effectiveness and accuracy of new data sources and data gathering techniques.
496	Senior Scientist, Machine Learning	Hybrid remote in Sunnyvale, CA	Niantic	Estimated $138K - $174K a year	Collaborate with data engineers, product managers, and marketing to coordinate timely deployments from conception to release.
497	Applied Scientist, Data Science	Mountain View, CA+1 location	CooTek	Estimated $101K - $128K a year	2+ years as engineer/scientist in data science or related fields.Expertise in data science experiments.Apply data science to business problems.
498	Sr. Data Analyst	Remote in Redwood City, CA	Poshmark	Estimated $92K - $117K a year	Experience with big data in ecommerce or social platform is a plus.Build in the right processes and time to thoroughly QA data and insights.
499	Senior Data Analyst	Hybrid remote in Mountain View, CA 94043	CaaStle	Estimated $102K - $129K a year	Build scalable data products, self-service tools, data cubes to analyze and present data associated with acquisition, retention, product performance, operations…
