	Title	Location	Company	Salary	Synopsis
103	Solutions Architect (AI) - REMOTE	Remote in Greenwood Village, CO	MiTek Inc.	$120,000 - $150,000 a year	Today, MiTek delivers software, services, engineered products, and automated solutions that enable the building industry to improve efficiencies by optimizing…
104	Principal ML & NLP Engineer	Remote in Littleton, CO 80123+2 locations	Recruiting From Scratch	$140,000 - $200,000 a year	Given you are constructing the foundation on which our global data infrastructure will be built, you need to pay close attention to detail and maintain a…
105	Sr. Engineer - Software Design/Development – Linux for Machi...	Boulder, CO+1 location	Qcom	Estimated $101K - $127K a year	Engineering Group, Engineering Group > Software Engineering.Qualcomm CR&D is looking for an experienced software engineer in the areas of Linux user-mode and…
106	Software Development Engineer II, Machine Learning Platform...	Louisville, CO	Amazon.com Services LLC	$122,200 - $160,000 a year	Experience with machine learning techniques such as pre-processing data, training and evaluation of classification and regression models, and statistical…
107	Data Scientist - Entry to Expert Level Virtual Hiring Event	United States	National Security Agency (NSA)	$74,682 - $176,300 a year	Passing this examination is a requirement in order to be considered for selection into a data scientist position.
108	Senior Data Scientist - International	United States	Indeed	$123,000 - $179,000 a year	Passion to answer Product/Engineering questions with data.Can train and deploy deep learning models for natural language data.
109	Director, Statistical Programming	Remote in United States	Everest Clinical Research	Estimated $136K - $172K a year	In-depth knowledge of industry standards on how clinical trial data are structured, stored, analyzed, and presented.Manage sponsors and vendor relationship.
110	Senior Statistical Programmer	Remote in United States	Everest Clinical Research	Estimated $99.5K - $126K a year	Archive clinical trial data (study data tabulation models and analysis data models) and programming information in accordance with corporate archival SOPs and…
111	Senior Manager Engineering - Analytics Software in Studio AI	Remote in United States	Wind River	Estimated $101K - $128K a year	Real-time analytics: receiving and analyzing streaming data from distributed devices or applications (not just processing data at rest), and updating or…
112	Junior Data Science Engineer	United States	Enhance IT	From $32 an hour	Experience with command-line scripting, data structures and algorithms and ability to work in a Linux environment, processing large amounts of data in a cloud…
113	Senior Genomic Medicine Scientist - AI/Machine Learning	United States	Parexel - USA	Estimated $108K - $136K a year	Collaborate with computational scientists, pathologists and experimental scientists to design optimal experiments for model training and evaluation.
114	Senior Statistical Programmer/Principal Statistical Programm...	Remote in United States	Syneos Health - USA	Estimated $144K - $182K a year	 Uses SAS or other software to develop custom programming code to generate summary tables, data.As a Lead Statistical Programmer for projects of any…
115	Senior Statistical Programmer - Oncology	United States	Cytel, Inc (USA)	Estimated $110K - $140K a year	Strong SAS data manipulation, analysis and reporting skills- with strong output programming experience.You will report to the Associate Director, Statistical…
116	Senior Consultant - AI/ML Engineer	United States	Harnham	$140,000 - $150,000 a year	You will also play a leadership role in modestly sized data teams.You will be responsible for delivering on client data science projects from end-to-end.
117	Senior Statistician	United States	AL2S3 LTD	Estimated $105K - $133K a year	Molly Williams is looking for a Senior Statistician with an in-depth passion for delivering high quality work to join a globally recognised, mid-sized CRO…
118	Senior Data Engineer	Remote in United States	SAIC	$125,001 - $150,000 a year	The data engineer also implements data tests for quality and also focuses on improving inefficient tooling and adopting new transformative technologies while…
119	Senior Healthcare Data Analyst	United States	New Directions Behavioral Health	None	Experience with enterprise data warehouse and commercial/Medicare/Medicaid claims data.Strong analytic and data management skills.
120	Cloud Data Architect	Remote in United States	Oportun Inc	None	Strong expertise and experience managing complex data platforms through automation.Excellent communication skills to collaborate with the data engineering,…
121	Senior Data Scientist	United States	Good Parents Inc.	From $110,000 a year	REST APIs, data pipelines and annotation tools.Experience or familiarity with data exploration, analysis and visualization tools.
122	Senior Supply Chain Data Analyst	United States	Logistics Plus Inc	$25 - $29 an hour	The Central Planning and Analytics (CPA) team provides analytical and project management.Services for DSPA Global and Regional Planning teams.
123	Statistical Analyst I	Denver, CO 80202 (Highland area)	Medpace, Inc.	$65,000 - $145,000 a year	Knowledge of databases and data management process; and.Communicate the project requirements for cleanup and data capture to ensure the key study variables are…
124	Data Engineer - Data Pipelines & Data Science Platforms	Denver, CO 80201+1 location	S&P Global	$68,300 - $155,900 a year	Working with our data scientists to turn large-scale messy, diverse, and often unstructured data into a source of meaningful insights for our customers.
125	Senior Statistical Programmer	United States	AL2S3 LTD	Up to $150,000 a year	You will be working with some of the most advanced analytics.
126	Senior Financial Analyst, Technology and Data Science	Denver, CO 80202 (Union Station area)	S&P Global	$90,000 - $120,000 a year	The Role: Senior Financial Analyst, Technology and Data Science.The Impact: This role will be a key member of the finance team supporting the S&P Global Market…
127	Sr. Engineer - Software Design/Development – Linux for Machi...	Boulder, CO	Qcom	Estimated $101K - $127K a year	Engineering Group, Engineering Group > Software Engineering.Qualcomm CR&D is looking for an experienced software engineer in the areas of Linux user-mode and…
128	Engineer - Software Design/Development – Linux for Machine L...	Boulder, CO	Qcom	Estimated $94.8K - $120K a year	Stores, retrieves, and manipulates data for analysis of system capabilities and requirements.Using deductive and inductive problem solving; multiple approaches…
129	Marketing Data Science Manager	United States	Indeed	$145,000 - $210,000 a year	Participate and help hire, onboard, and coach marketing data scientists.Working knowledge of algorithms and data structures.
130	Principal Stat Programmer	United States	Syneos Health - USA	Estimated $112K - $141K a year	Uses SAS, or other software, to develop custom programming code to generate summary tables, data listings, graphs and derived datasets as specified in the…
131	Senior Statistical Programmer - Clinical Trials / Strong Ad-...	Remote in United States	Cytel - USA	Estimated $62.1K - $78.7K a year	Performing data manipulation, analysis and reporting of clinical trial data, both safety and efficacy (ISS/ISE), utilizing SAS programming.
132	Principal Statistician	Remote in United States	Worldwide Clinical Trials - USA	Estimated $124K - $157K a year	The Worldwide Biostatistics team is an experienced and diverse group of Statisticians/Biostatisticians who collaborate together as one team, both via regularly…
133	Data Scientist	Denver, CO (Virginia Village area)	Iontra LLC	$115,000 - $120,000 a year	Work collaboratively with research scientists and other data scientists on supervised and unsupervised models related to cutting edge battery charging…
134	Data Scientist Advanced Analytics	Denver, CO	Intellibee Inc	Estimated $121K - $154K a year	Experience in data science libraries like Tensor Flow, Data Visualization, Machine Learning, Salesforce.Skills: * 3+ years in Data Science, Python, Scala and…
135	Staff Data Scientist	Remote in Denver, CO	DispatchHealth	$180,000 - $210,000 a year	Adept at managing large quantities of data from disparate data sources and creating usable, repeatable features.
136	Data Scientist, Economic and Policy Research	Hybrid remote in Boulder, CO 80309	University of Colorado Boulder	$65,000 - $80,000 a year	Write articles and reports about data.Conduct analytical and statistical analysis of economic data.Create and deploy surveys for the collection of primary…
137	Athletics Gameday Statistician	Denver, CO	The University Of Denver	Estimated $62.4K - $79K a year	Work type: Staff Part-Time.The Division of Athletics & Recreation at the University of Denver is currently seeking part-time employees to serve as gameday…
138	Data Scientist	Remote in Denver, CO	GutCheck	$90,000 - $110,000 a year	Support cross-functional efforts to develop databases and data feeds consistent with our product and data strategy.Medical, Life, Dental and Vision Insurance.
139	Senior Data Scientist	Remote in Denver, CO	Snapdocs	$153,850 - $178,750 a year	The ideal candidate is someone who relishes pouring over messy data to find patterns and train machines to do so with high accuracy and recall.
140	Machine Learning Scientist	Denver, CO+1 location	Teladoc Health	$54,000 - $130,000 a year	This includes data transformation, feature engineering, unsupervised learning, supervised learning and time series modeling.
141	Data Scientist, Economic and Policy Research	Hybrid remote in Boulder, CO 80309+1 location	University of Colorado Boulder	$65,000 - $80,000 a year	Write articles and reports about data.Conduct analytical and statistical analysis of economic data.Create and deploy surveys for the collection of primary…
142	Principal Data Scientist	Remote in Denver, CO+1 location	Hotel Engine	$150,000 a year	Work with the VP, Data Science to build and coach a world-class team of data scientists, data engineers and machine learning engineers.
143	Staff Data Scientist, Metrics Intelligence - Slack	Denver, CO+2 locations	Salesforce	$150,200 a year	You will work with data scientists and business analysts (from various business groups) to understand, synthesize, and communicate evolving trends in product…
144	Senior Data Scientist at Rent-to-Own Startup	Remote in Denver, CO 80123+17 locations	Recruiting From Scratch	$120,000 - $190,000 a year	You have 3+ years of experience working in data science.Day to day, you will perform a mix of exploratory data analysis, statistical modeling, software…
145	Data Scientist	Denver, CO+1 location	AArete	Estimated $91K - $115K a year	Develop custom data models and algorithms to apply to data sets.Experience performing data quality assurance and manipulation and.
146	Data Science Strategy Lead, North America	Denver, CO+2 locations	Facebook App	$192,000 a year	Your background should be in a related quantitative or technical field, with experience working with large data sets and data-driven decision making at a…
147	Principal - Data Science - Data Science	Denver, CO	Credera	$200,000 - $288,000 a year	Our data capabilities help our clients gain competitive advantage by transforming raw data into insights that enable actionable decision making.
148	Senior Data Scientist/Machine Learning Engineer	Remote in Littleton, CO 80123+5 locations	Recruiting From Scratch	$140,000 - $200,000 a year	Work with cross-functional teams, including lawyers, data protection and security researchers.Gather training data, and train and evaluate state-of-the-art…
149	Sports Statistician - Basketball	Westminster, CO 80020	Life Time	Up to $13.56 an hour	Experience tracking full statistical data for league games (in the areas of basketball, soccer, volleyball, etc).Tracks all relevant statistics during games.
150	Manager of Research Informatics and Data Science	Aurora, CO	Children's Hospital Colorado	$54.20 - $81.30 an hour	The Manager of Research Informatics & Data Science provides operational leadership for the Research Informatics & Data Science in the Analytics Resource Center…
151	Senior Data Analyst	Denver, CO 80202 (Lodo area)	Code42	$85,000 - $100,000 a year	Leading the usage of data by championing best practices and data processes; define, assist, monitor, and refine the approach.At Code42 everyone is an owner.
152	Machine Learning Scientist	Denver, CO	Teladoc Health	$54,000 - $130,000 a year	This includes data transformation, feature engineering, unsupervised learning, supervised learning and time series modeling.
153	Principal - Data Science - Data Science	Denver, CO+2 locations	Credera	$200,000 - $288,000 a year	Our data capabilities help our clients gain competitive advantage by transforming raw data into insights that enable actionable decision making.
154	Product Analyst, Data and Machine Learning	Englewood, CO 80112	DISH	$108,000 a year	Demonstrated entrepreneurial or intrapreneurial experience collaborating with data scientists, engineers, and designers solving customer problems with a data…
155	Principal Applied Scientist	Denver, CO 80202 (Central Business District area)	Verizon	$107,000 - $198,000 a year	Skills with analyzing and deconstructing very large data sets.Use your experience and skill set (along with your imagination) to manipulate and analyze complex…
156	Lead Data Science and Analytics Solutions Architect	Englewood, CO	BOEING	$106,000 - $197,000 a year	Experience analyzing data and making data-driven decisions.5+ years’ experience architecting/developing data & analytics/data science capabilities.
157	Architect - Data Engineering - Data Engineering	Denver, CO+2 locations	Credera	$130,000 - $160,000 a year	You have a deep understanding of data governance and data privacy best practices.Our data capabilities help our clients gain competitive advantage by…
158	Sr. Data Analyst- BI Developer IV	Denver, CO 80205 (Five Points area)	CRB	$99,000 - $150,000 a year	Develop new processes to extract, transform, and load data into our enterprise data infrastructure.7+ years of experience developing ETL processes with data…
159	Senior Decision Scientist, Fraud	Remote in Denver, CO 80202	Ibotta	$90,000 - $120,000 a year	Ability to build concise and compelling data visualizations with modern data visualization tools (Looker, Mode, Tableau, Imply, etc.).
160	Data Scientist	Denver, CO	Project Canary, PBC	$90,000 - $120,000 a year	3+ years' experience quantifying emissions data.The resulting independent data can inform the procurement of offsets in real-time using microtransactions,…
161	Principal - Data Engineering	Denver, CO	Credera Experienced Hiring Job Board	Estimated $138K - $175K a year	Minimum 10 years of hands on development experience with data engineering technologies and background in data architecture, data science, or data management.
162	Senior Decision Scientist, Data & Media Analytics	Remote in Denver, CO 80202	Ibotta	$90,000 - $120,000 a year	Strong SQL knowledge and established data wrangling skills.As a Senior Decision Scientist, you will be responsible for providing actionable and data-driven…
163	Manager, Data Science	Englewood, CO 80112	DISH Network	$100,100 - $143,000 a year	Experience with report/dashboard development, data/report automation, self-service capabilities, data design and integration, and data quality and governance.
164	Sr. Data Analyst - Credit	Denver, CO 80202 (Lodo area)	Freedom Financial Network	Estimated $90.4K - $114K a year	5+ years of experience in data science, quantitative business analysis, and/or statistical analysis; or relevant Master’s Degree / MBA with 2+ years of…
165	Principal - Data Science	Denver, CO	Credera Experienced Hiring Job Board	Estimated $154K - $195K a year	Our data capabilities help our clients gain competitive advantage by transforming raw data into insights that enable actionable decision making.
166	Architect - Data Engineering	Denver, CO 80202 (Central Business District area)	Slalom Consulting	$110,000 - $140,000 a year	Data Engineering consisting of streaming / real-time data solutions, modern data platforms and data systems within products (i.e., database systems, graph…
167	Machine Learning Focused Software Developer	Aurora, CO 80011 (Norfolk Glen area)	DeNOVO Solutions	Estimated $108K - $136K a year	DeNOVO is looking for individuals interested in developing a machine learning (ML)-based data classification system.Intermediate to advanced Java experience.
168	Senior Data Analyst - Engineering Analytics	Lone Tree, CO 80124	Verizon	$70,000 - $129,000 a year	Using data visualization and other data-gathering methods to either provide internal strategic direction or guide decisions for other teams.
169	Machine Learning Engineer	Aurora, CO 80011 (Norfolk Glen area)+1 location	DeNOVO Solutions	$80,000 - $100,000 a year	UI experience and data presentation/visualization techniques.Decompose systems into applications or components including defining data flows, interface…
170	SDE-T, Machine Learning Platform Team	Louisville, CO+2 locations	Amazon.com Services LLC	$166,600 - $198,400 a year	Experience with machine learning techniques such as pre-processing data, training and evaluation of classification and regression models, and statistical…
171	Senior Machine Learning Platform Engineer, ML Ops	Boulder, CO	SoundHound Inc.	$136,000 - $166,000 a year	Expand and manage the GPU-based Machine Learning platform.Develop tools to scale ML training and inference.You graduated with a Bachelor's degree in Computer…
172	Director of Machine Learning and Engineering, Natural Langua...	Boulder, CO+1 location	SoundHound Inc.	$195,000 a year	Own and evolve various NLP related tools that are used internally to manually curate text data.You will have an opportunity to combine your management…
173	Lead Data Scientist	Englewood, CO 80112+2 locations	DISH	$125,000 a year	Perform ad hoc requests with large data sets.Demonstrated ability to derive business value out of complex data/models to create significant change within an…
174	Data Scientist 4	Broomfield, CO 80021 (Interlocken area)	Oracle	$109,000 - $209,000 a year	Researches and analyzes user needs with respect to delivery of data that represents customer health.Researches and analyzes user needs with respect to delivery…
175	Staff Data Scientist, Platform - Slack	Denver, CO	Salesforce	$150,200 a year	Experience in building advanced data pipelines and designing data scheme and table infrastructure.Prototype foundational data pipelines and partner with the…
176	Decision Scientist, Retail	Remote in Denver, CO 80202	Ibotta	$80,000 - $100,000 a year	2+ years of experience in an analytics or data science role involving data extraction and statistical modeling.
177	IT Specialist (Data Scientist), ZP-2210-3 (DE/CR)	Temporarily Remote in Boulder, CO	US National Oceanic and Atmospheric Administration	$67,240 - $113,743 a year	Knowledge of emerging data management systems.Assisting with the design, implementation, and oversight of data management architectures, systems and software…
178	Sr. Data & ML Engineer	Denver, CO+2 locations	Amazon Web Services, Inc.	$122,300 - $160,000 a year	Hands on experience working on large-scale data science/data analytics projects.Hands on experience with building data or machine learning pipeline.
179	Sr. Data Analyst - Partner Analytics	Remote in Denver, CO 80202	Strive Health	$85,000 - $105,000 a year	Working knowledge of analyzing medical claim, lab data, EMR data and clinical data.4+ years’ experience in healthcare data analysis.
180	Senior Data Analyst	Denver, CO 80202 (Lodo area)	Code42	Estimated $106K - $134K a year	Working closely with product managers, engineers, and data scientists on the Incydr product to identifying important questions and answer them with data.
181	Data Architect	Remote in Denver, CO	CrossCountry Consulting	Estimated $144K - $183K a year	Design and implement complex data and analytics solutions to build next-generation data analytic platforms and solutions.
182	Senior Data Engineer - Data Engineering	Denver, CO+1 location	Credera	$105,000 - $142,000 a year	They are an experienced data pipeline developer who enjoys data wrangling, optimizing data flows, and building solutions for data collection and analysis.
183	Scalable, Accelerated Machine Learning and AI on Advanced Co...	Golden, CO 80401	National Renewable Energy Laboratory	$75,500 - $135,900 a year	Demonstrated experience developing workflows, including job scheduler integration, data management of big datasets, data movement, and data availability/sharing…
184	Architect - Data Engineering - Data Engineering	Denver, CO+1 location	Credera	$130,000 - $160,000 a year	You have a deep understanding of data governance and data privacy best practices.Our data capabilities help our clients gain competitive advantage by…
185	Senior Architect - Data Engineering	Denver, CO 80202 (Central Business District area)	Slalom Consulting	$130,000 - $160,000 a year	Data Engineering consisting of streaming / real-time data solutions, modern data platforms and data systems within products (i.e., database systems, graph…
186	Manager, Machine Learning Engineering	Boulder, CO 80301+1 location	Workday	$160,000 a year	Relevant experience shipping data products.Strong understanding of data and/or ML fundamentals.In this role, you will lead and partner with data scientists,…
187	Risk Architecture Analyst	Hybrid remote in Greenwood Village, CO 80111	CoBank	$85,000 - $110,000 a year	Proven ability to effectively use data analysis tools to filter and clean data for storage, modeling and reporting.
188	Senior Data Scientist - Ranking Team	Denver, CO	Indeed	$147,000 - $213,000 a year	Proactively research data and identify opportunities in the data to drive the product roadmap.Helps identify ways to improve data quality and analysis.
189	Principal Data Scientist - Match Recommendations	Denver, CO	Indeed	$223,000 - $324,000 a year	Mentor and grow other software engineers and data scientists across teams.Solid knowledge of data structures and algorithms.
190	Senior Data Scientist at Rent-to-Own Startup	Remote in Denver, CO 80123+2 locations	Recruiting From Scratch	$120,000 - $190,000 a year	You have 3+ years of experience working in data science.Day to day, you will perform a mix of exploratory data analysis, statistical modeling, software…
191	Data Science Manager - Search Ranking and Personalization	Remote in Denver, CO	Indeed	$149,000 - $217,000 a year	Ensure delivery of data science solutions, set expectations for what can be done and by when, and prioritize incoming projects.
192	Machine Learning Focused Software Developer	Aurora, CO 80011 (Norfolk Glen area)	DeNOVO Solutions	Estimated $103K - $130K a year	DeNOVO is looking for individuals interested in developing a machine learning (ML)-based data classification system.Intermediate to advanced Java experience.
193	NLP Engineer at Speech to Text Start Up	Remote in Littleton, CO 80123+2 locations	Recruiting From Scratch	Estimated $122K - $155K a year	Their AI-powered collaborative note-taking app works across Zoom, Google Meet, and Microsoft Teams to help teams record, transcribe, search and share meeting…
194	NLP Engineer	Denver, CO 80210 (University area)	Avodah	Estimated $88K - $111K a year	Bachelor’s degree in computer science, data science, IT or related field of study.Understanding of common NLP models & techniques for text representation,…
195	Software Engineer - Natural Language Processing	Denver, CO	Josh.ai	$60,000 - $100,000 a year	Experience with noise and unstructured textual data in a speech recognition setting.Experience with various Natural Language Processing problems like data…
196	Senior Data Science Engineer with ML	Denver, CO	Zodiac Solutions Inc.	Estimated $112K - $142K a year	Experience with building predictive models using historical 1st and 3rd party data.Enhance data collection procedures to include information that is relevant…
197	Director of Business Intelligence	Greenwood Village, CO 80111	Enquire Solutions	$120,000 - $135,000 a year	Develop custom data models and algorithms to apply to data sets.Maintain and support data analytics platforms.Collaborate with teams to integrate systems.
198	Big Data Engineer	Aurora, CO	24-7 Intouch	$70,000 - $80,000 a year	Load from disparate data sets by leveraging various big data technology e.g. Kafka.Design and implement data modeling.As Big Data Engineer, You Will….
199	Machine Learning Engineer	Aurora, CO 80011 (Norfolk Glen area)	DeNOVO Solutions	$80,000 - $100,000 a year	UI experience and data presentation/visualization techniques.Decompose systems into applications or components including defining data flows, interface…
200	Architect - Data Engineering	Denver, CO+1 location	Credera Experienced Hiring Job Board	Estimated $126K - $160K a year	You have a deep understanding of data governance and data privacy best practices.Our data capabilities help our clients gain competitive advantage by…
201	Senior Data Scientist	Remote in Denver, CO	Gtmhub	$130,000 - $160,000 a year	Maintain day-to-day data aggregation responsibilities and the integrity of the data;Familiarity with data management tools;What we’re looking for.
202	Lead Data Scientist	Remote in Denver, CO	Zoom Video Communications, Inc.	Estimated $86K - $109K a year	Past experience in mentorship of data scientists (or other data professionals).We know that Customer Happiness depends on the privacy and security of our users…
203	Senior Data Scientist	Remote in Denver, CO	Hotel Engine	$130,000 a year	Work with the VP, Data Science to build and coach a world-class team of data scientists, data engineers and machine learning engineers.Here's what you'll do:
