	Title	Location	Company	Salary	Synopsis
0	Lead Data Scientist	Denver, CO+2 locations	DISH	$94,000 a year	Leverage SQL development skills to perform full lifecycle data mining activities, including requirements analysis, data quality assessment, data profiling,…
1	Data Scientist (Junior)	Remote in Louisville, CO	BDSA	$90,000 - $110,000 a year	For example, combining public weather data with proprietary sales data to identify trends and build forecasts, or using ML/AI tools to parse large datasets and…
2	Data Scientist	Remote in Denver, CO 80238	CyberCoders	$100,000 - $110,000 a year	Translate data analysis to guide business decisions.Created data visualizations to help business leaders understand their business problems and the proposed…
3	Data Scientist	Denver, CO	AT&T	$75 - $85 an hour	Experience in data science libraries like TensorFlow, Data Visualization, Machine Learning, Salesforce.Skills: 3+ years in Data Science, Python, Scala, and SQL…
4	ETL Developer/Jr Data Scientist (Need Local to CO)	Greenwood Village, CO	ITGen Systems	$70 - $75 an hour	Leverage various data and technology resources to augment analysis.Experience in data validation, analysis, and debugging.ETL Developer: 3 years (Preferred).
5	Natural Language Processing Specialist	Evergreen, CO 80437	Ometrics	Estimated $63.6K - $80.6K a year	You see patterns when looking at data of user behavior and can see the user’s intention.No NLP experience is required.We will provide all the training needed.
6	Staff Data Scientist	Remote in Denver, CO 80202	Ibotta	$170,000 - $200,000 a year	Experience manipulating complex data to apply business rules for improved feature engineering within data lakes, distributed systems, and data streams.
7	Data Scientist - Ads Optimization	Remote in Denver, CO	Comcentric	$139,000 - $225,000 a year	Proactively research data and identify opportunities in the data to drive the product roadmap.Helps identify ways to improve data quality and analysis.
8	Data Scientist	Broomfield, CO 80021	Renewable Energy Systems	$76,500 - $100,000 a year	Develop optimization algorithms around time-series data.The Data Scientist will assist in building databases, data scraping, automating workflows, designing…
9	Data Scientist	Hybrid remote in Denver, CO	Business Intelli Solutions	Up to $60 an hour	Expertise in big data processing, familiarity with big data platforms.Identify data needs, gaps, sources, verify data quality, transform and clean data as…
10	Data Scientist	Remote in Denver, CO 80202	Switchfly	$110,000 - $130,000 a year	Identifies data patterns and trends.Extract and transform data from multiple sources in preparation for exploratory data analysis, feature engineering,…
11	Staff Data Scientist, Metrics Intelligence	Denver, CO 80202 (Union Station area)+1 location	Slack	$150,200 a year	You will work with data scientists and business analysts (from various business groups) to understand, synthesize, and communicate evolving trends in product…
12	Data Scientist II/III, Client Analytics	Denver, CO+2 locations	Teladoc Health	$95,000 - $110,000 a year	Collaborate closely with other analysts, data scientists, engineers, PMs and clinical researchers on product builds, analytical tools, data quality, metric…
13	Data Scientist - Utility Reliability (Jr - Sr) - REMOTE	Hybrid remote in Denver, CO	E Source	$75,000 - $100,000 a year	Proficiency and demonstrated experience in all phases of the data science life cycle working with real-world data—data compilation, data exploration,…
14	Data Scientist	Denver, CO	The University Of Denver	$65,000 - $80,000 a year	Four years of professional experience in data science, data management or analytics position.Work collaboratively on data science projects.
15	Senior Data Scientist	Remote in Denver, CO	Gtmhub	$130,000 - $160,000 a year	Maintain day-to-day data aggregation responsibilities and the integrity of the data;Familiarity with data management tools;Access to a 401(k)/Roth 401(k).
16	Data Scientist	Remote in Boulder, CO 80302	Techstars	$125,000 - $175,000 a year	Proficiency in programming languages for data and statistical analysis (R, Python), databases (SQL, APIs), infrastructure (AWS), and data visualization (Tableau…
17	Lead Data Scientist	Remote in Denver, CO	Zoom Video Communications, Inc.	Estimated $86K - $109K a year	Past experience in mentorship of data scientists (or other data professionals).Passionate about data science, analytics, and solving complex, and sometimes…
18	Data Scientist	Englewood, CO	NomiSo	$100,000 - $150,000 a year	Familiarity with Data Engineering techniques to gather, prepare, cleanse and transform data for analysis and AI automation, including data pipelines.
19	Data Scientist (3-5 years experience)	Broomfield, CO	DataLab USA	$75,000 - $100,000 a year	Review corporate data transformation QC.Regular SQL use for querying data.Experience with Tableau (or other data visualization platform).
20	Sr. Data Scientist	Denver, CO 80202 (Central Business District area)	Nexthealth	Estimated $116K - $147K a year	Detailed knowledge of computer science including data structures, data modeling, distributed systems, and software design methods.
21	Senior Data Scientist	Denver, CO 80202 (Lodo area)	Code42	Estimated $126K - $159K a year	Working closely with product managers, engineers, and data analysts on the Incydr product to identify customer needs and design data-driven solutions.
22	Data Scientist (100% Remote)	Remote in Denver, CO 80238	Frontdoor	Estimated $120K - $153K a year	Solid foundation in data structures and algorithms.Process massive amounts of structured and unstructured data.Run A/B test experiments and analyze results.
23	Senior Data Scientist	Remote in Denver, CO	Hotel Engine	$130,000 a year	Work with the VP, Data Science to build and coach a world-class team of data scientists, data engineers and machine learning engineers.
24	Data Scientist Senior	Hybrid remote in Aurora, CO+1 location	Children's Hospital Colorado	$50.42 - $75.62 an hour	This senior data scientist position is responsible for advanced data science work harnessing vast amounts of data to optimize business and clinical outcomes.
25	Data Assimilation / Machine Learning Scientist	Remote in Boulder, CO+1 location	Tomorrow.io	$100,000 - $160,000 a year	The tomorrow.io space numerical weather prediction (NWP) and data assimilation (DA) R&D department is a group of scientists, mathematicians, and engineers.
26	Data Scientist IV Advanced Analytics	Denver, CO	Kaiser Permanente	$61.30 - $72.07 an hour	Prepares data for analytic efforts by integrating and consolidating data; ensuring data quality and accuracy; profiling data inaccuracies and recommending…
27	Data Scientist	Remote in Denver, CO	MERGE	$60,000 - $80,000 a year	Experience in data cleanse and ETL.Extensive experience in data wrangling and feature engineering.You will work effectively with cross-functional teams to…
28	Principal Data Scientist	Remote in Denver, CO	Hotel Engine	$150,000 a year	Work with the VP, Data Science to build and coach a world-class team of data scientists, data engineers and machine learning engineers.
29	Predictive Data Analyst - (Remote) - SimioCloud	Remote in Westminster, CO 80021	Simio Cloud	Estimated $68.1K - $86.3K a year	Experience with data tools like Alteryx.Experience with data visualization tools, such as PowerBI.Executing and adding to data products that support our…
30	Senior Data Analyst	Denver, CO 80211 (Sunnyside area)	Artifact Uprising	$100,000 - $115,000 a year	Cultivate a data-driven culture by ensuring data integrity and accessibility.Perform advanced data mining and analysis, leading into concise and digestible…
31	Senior Data Scientist, Credit	Remote in Denver, CO	Caribou	$125,000 - $145,000 a year	Experience working consumer data (especially consumer finance), including data from credit bureaus.Demonstrated ability to explain and visualize complex data…
32	Sr. Data Scientist (Computer Vision)	Remote in Denver, CO	Veritone	$152,000 a year	Gathering & analyzing data, devising data science solutions for high-performance real-time models.Experience creating preprocessors and exploratory data…
33	[Senior and Staff] Data Scientist, Virtual HQ	Hybrid remote in Denver, CO 80202	Slack	$128,600 a year	Experience working with data technologies that allow effective storage and analysis of large amounts of data (e.g. Spark, Presto, Hive, etc).
34	Staff Data Scientist, Metrics Intelligence - Slack	Denver, CO+1 location	Salesforce	$150,200 a year	You will work with data scientists and business analysts (from various business groups) to understand, synthesize, and communicate evolving trends in product…
35	Data Scientist	Denver, CO+2 locations	sharethrough	Estimated $99K - $125K a year	Present findings to data scientists and product managers to influence product roadmaps.Work with our data engineering team to make the data needed for your…
36	Data Scientist Jr. - Sr.	Denver, CO	Criterion Systems, Inc.	$89,000 - $169,000 a year	Experience in statistics and data mining techniques.Experience GPUs GPUs to speed data Model Training.Criterion Systems is seeking a mission-focused Data…
37	Data Scientist	Remote in Denver, CO	Kadiak, LLC	$65,000 - $76,000 a year	Knowledge of data stores, data analytics and data warehousing concepts, methods, and technologies sufficient to participate in the design of data analytic and…
38	Quality Data Analyst Sr	Denver, CO 80218 (Central East Denver area)	Saint Joseph Hospital	$24.49 - $52.39 an hour	Understands data models and data structures.Two to three years in data analytics.Background and experience in data management and automation.
39	[Senior and Staff] Data Scientist, Virtual HQ - Slack	Hybrid remote in Denver, CO	Salesforce	$128,600 a year	Experience working with data technologies that allow effective storage and analysis of large amounts of data (e.g. Spark, Presto, Hive, etc).
40	Data Scientist	Denver, CO	AArete	Estimated $91K - $115K a year	Develop custom data models and algorithms to apply to data sets.Experience performing data quality assurance and manipulation and.
41	Senior Credit Strategy Analyst - Data Scientist	Denver, CO 80202 (Central Business District area)	Funding Circle US	$105,000 - $130,000 a year	Highly analytical and love to analyze data to generate information.Have a background in quantitative analysis with degree in statistics, economics or other…
42	Data Scientist	Denver, CO	Gate Insight Inc	$60,000 - $80,000 a year	Experience in data science libraries like TensorFlow, Data Visualization, Machine Learning, Salesforce.Looking for a Data Scientist for Advanced Analytics.
43	Senior Data Scientist Lead	Englewood, CO 80112	DISH	$108,000 a year	Ability to validate data and verify data marts built adhere to business needs.Experience in analyzing data and providing recommendations.
44	Researcher II/III - Applied Data Scientist for Commercial Ve...	Golden, CO 80401	National Renewable Energy Laboratory	$69,400 - $114,500 a year	Position focused on data collection, data processing pipeline, advanced data analytics, and developing data products and research to identify, inform, and…
45	Senior Data Scientist	Remote in Denver, CO	AArete	Estimated $117K - $149K a year	Develop custom data models and algorithms to apply to data sets.Experience with Healthcare data analytics is necessary.
46	Data Science Strategy Lead, North America	Denver, CO+1 location	Facebook App	$192,000 a year	Your background should be in a related quantitative or technical field, with experience working with large data sets and data-driven decision making at a…
47	Senior Data Analyst, Strategic Segments	Denver, CO	Melio	$106,000 - $125,000 a year	Ctly with the Unit's management to provide data insights and BI solutions.Support our high-scale conversion optimization and testing efforts through…
48	Head of Data Science and Analytics	Denver, CO 80202 (Central Business District area)	Nexthealth	Estimated $179K - $227K a year	Detailed knowledge of computer science and software engineering, including data structures, data modeling, distributed systems, and software design methods.
49	Data Scientist, Distill	Boulder, CO 80302 (Whittier area)	TIFIN	Estimated $98.8K - $125K a year	Responsible for following consistent practices to ensure data integrity and deal with imperfections in data.Strong familiarity with unstructured data.
50	Senior Data Scientist/Machine Learning Engineer	Remote in Littleton, CO 80123+17 locations	Recruiting From Scratch	$140,000 - $200,000 a year	Work with cross-functional teams, including lawyers, data protection and security researchers.Gather training data, and train and evaluate state-of-the-art…
51	DevOps Engineer - Machine Learning	Denver, CO	Logic20/20 Inc.	From $120,000 a year	As a DevOps Engineer on this project, you’ll build infrastructure to support wildfire mitigation as well as increase customer safety.
52	SVP, Data Foundation, Strategy & Analytics	Boulder, CO	Zayo Group	$230,000 - $275,000 a year	This role oversees a range of data-related functions that may include data management, ensuring data quality and creating data strategy.
53	Senior Data Analyst	Remote in Denver, CO	Hotel Engine	None	Partner with data engineers to establish data assets and feature stores for process automation, advanced analytics, and machine learning model.
54	Machine Learning Engineer	Boulder, CO 80303 (Southeast Boulder area)	Earable, Inc.	From $100,000 a year	Work with data scientists, software engineers and firmware engineers to efficiently deploy machine learning algorithms for Earable’s neuro-wearables.
55	Sales Development Representative (ML/AI/Data Science)	Remote in Denver, CO 80205	Pachyderm	None	Pachyderm helps customers get their ML and AI projects to market faster, lower data processing and storage costs, and supports strict data governance…
56	Data Analyst 2 – Strategic Analytics	Denver, CO	Nordstrom	Up to $112,700 a year	A day in the life… Partner with key stakeholders on data analysis problems.2+ years of corporate experience analyzing complex data, drawing conclusions, and…
57	Machine Learning Engineer, Fraud	Remote in Denver, CO 80202+2 locations	Ibotta	$100,000 - $130,000 a year	Ability to translate ambiguous business questions into structured data problems.Curiosity and the commitment to continually ask questions of our data and…
58	Staff Data Analyst	Denver, CO 80202 (Lodo area)	Freedom Financial Network	Estimated $80.3K - $102K a year	You have a strong understanding on how data should be captured within products and services and are able to collaborate & guide the business and data…
59	SDE- Measurement & Data Science- 2021	Boulder, CO	Amazon.com Services LLC	$122,200 - $160,000 a year	Experience in databases, analytics, big data systems or business intelligence products.Amazon is applying the latest machine learning and big data technologies…
60	Data Engineer (Data Science & Innovation Team)	Remote in Denver, CO 80209+1 location	Businessolver	$98,000 - $137,000 a year	Partner with software engineers, BI team members and data scientists to architect and build data-driven solutions.
61	Sr. Applied Scientist, Autonomous Mobility	Louisville, CO	Amazon.com Services LLC	$123,300 - $160,000 a year	5+ years’ experience working with a team of scientists and engineers.Experience mentoring junior scientists, developers, and/or machine learning engineers.
62	Data Scientist	Denver, CO	ICR	Estimated $102K - $129K a year	Knowledge of common data visualization technologies, such as matplotlib, bokeh, d3, or matlab.Proficient in Python, R, Matlab, Lua, or other data science…
63	Senior Data Analyst	Glendale, CO 80246 (Southeastern Denver area)	Contexture	$77,500 a year	Lead and support external and internal customers in data acquisition activities, this includes data validation and in-depth analysis of source data used for…
64	Senior Data Analyst	Centennial, CO 80112	Axos Clearing LLC	$70,000 - $80,000 a year	Maintain inventory of data definitions and process maps to ensure data integrity.Continuously support business units with enhancement requests, technical…
65	Senior Statistician & Data Visualization Developer	Denver, CO	The University Of Denver	$70,000 - $80,000 a year	Knowledge of data visualization and dashboard development.Ability to automate data extraction, cleaning and analytical processes.Work type: Staff Full-Time.
66	Front End Engineer, MADS- Measurement and Data Science	Boulder, CO	Amazon.com Services LLC	$93,800 a year	Professional non-internship experience with front end, web or mobile software development using JavaScript, HTML and CSS.
67	Senior Data Analyst, Procurement	Denver, CO	Gates Corporation	$107,300 - $131,100 a year	Excellent data management and data entry capability.Manage procurement systems and processes to improve data integrity.
68	Senior Data Analyst	Remote in Denver, CO 80110	Trupanion	Estimated $89.3K - $113K a year	Extract and reconcile data from our robust data warehouse or identify and strategize new data to be collected through third party partnerships, surveys and more…
69	Senior Cybersecurity Data Analyst	Highlands Ranch, CO	Visa	$103,300 a year	Experience using analytics tools or scripting to extract and normalize data is a plus.Data analysis, Build data models and KPIs, Track, Measure, and regular…
70	Analyst - Assessment & Research	Jefferson County, CO	Jeffco Public Schools	$95,540 - $111,370 a year	Ensure security of data, integrity of data, and the ability to recover data.Be comfortable with coding automated processes (especially for data pulls and data…
71	Data Plane Engineer	Remote in Denver, CO 80123+2 locations	Recruiting From Scratch	$140,000 - $200,000 a year	Troubleshooting and optimizing data path.Architect the next generation 5G base station on a chip’s data path.Strong programming experience in c/c++.
72	Jr. Artificial Intelligence/Machine Learning Engineer	Centennial, CO 80112+1 location	Rincon Research Corp	Estimated $127K - $160K a year	5 or more years of experience with exploratory data analysis of satellite imagery, Radio Frequency (RF), or other large time-varying scientific datasets.
73	Data Architect	Denver, CO	CrossCountry Consulting	Estimated $139K - $176K a year	Design and implement complex data and analytics solutions to build next-generation data analytic platforms and solutions.
74	Senior Data Analyst	Englewood, CO 80112+1 location	DISH	$65,800 a year	Maintain process and system improvement success measurement metrics and analyze data to evaluate performance, and make incremental improvements, post…
75	Performance Engineer	Englewood, CO	Travelport	$100,000 - $130,400 a year	Build tools to extract metrics from running workloads and perform data analysis to identify areas of improvement.
76	Senior Research Engineer, Machine Learning (ASR)	Boulder, CO	SoundHound Inc.	$136,500 - $169,500 a year	You are humble and data-driven when making decisions.Lead high-impact machine learning projects.Focus on production-driven research that requires ground…
77	Architect - Data Engineering	Denver, CO 80202 (Central Business District area)+1 location	Slalom Consulting	$110,000 - $140,000 a year	Data Engineering consisting of streaming / real-time data solutions, modern data platforms and data systems within products (i.e., database systems, graph…
78	Data Center Engineering Manager	Denver, CO	Crusoe	Estimated $143K - $181K a year	Demonstrated knowledge of data center facilities design.Proven knowledge of mechanical, electrical and control systems design, including familiarity with data…
79	Machine Learning/A.I. Engineer	Denver, CO	Josh.ai	$100,000 - $160,000 a year	This role will focus on learning capabilities, applying machine learning and pattern recognition software to help make Josh.ai smarter.
80	Director of Machine Learning and Engineering, Natural Langua...	Boulder, CO	SoundHound Inc.	$195,000 a year	Own and evolve various NLP related tools that are used internally to manually curate text data.You will have an opportunity to combine your management…
81	Senior Data Scientist, Growth Analytics	Hybrid remote in Denver, CO	Teladoc Health	$132,000 - $152,000 a year	Ability to partner with other data scientists and deliver practical and effective solutions in challenging situations, mentor junior data scientists on projects…
82	Data Scientist- Health Informatics Specialist	Remote in Denver, CO	Wolters Kluwer	$73,500 - $105,000 a year	Minimum 3 years of experience in creating data models, database design development, data mining and/or data segmentation techniques.
83	NLP Engineer	Denver, CO 80210 (University area)	Avodah	Estimated $86.6K - $110K a year	Bachelor’s degree in computer science, data science, IT or related field of study.Understanding of common NLP models & techniques for text representation,…
84	ML Engineer (Reinforcement Learning)	Aurora, CO 80011 (Norfolk Glen area)	The Stratagem Group, Inc	$115,000 - $200,000 a year	Analyzing large multi-domain datasets such as images, text, and/or graph data to identify statistically relevant features to build models.
85	Sr. Product Manager, Machine Learning	Boulder, CO 80301	Workday	$130,600 a year	Proficient with analytics query languages and data analysis tools.Work backwards from feature adoption metrics to identify functional gaps, user experience…
86	Senior Data Science Manager	Broomfield, CO 80020	Sierra Space	$178,005 - $244,756 a year	3+ years leading and maintaining high performance data science or data engineering teams.Typically 7-10 years of commercial experience in a data science or…
87	Senior Machine Learning Architect - Data Science	Denver, CO+1 location	Credera	$155,000 - $222,000 a year	Our data capabilities help our clients gain competitive advantage by transforming raw data into insights that enable actionable decision making.
88	Machine Learning Engineer, Platform	Remote in Denver, CO 80123+2 locations	Recruiting From Scratch	$150,000 - $190,000 a year	Orchestrate large scale machine learning data pipelines (experience with Prefect, Airlflow, Luigi, or similar framework will be helpful).
89	Sr Machine Learning Engineer	Boulder, CO 80301+2 locations	Workday	$160,000 a year	Design and develop a product in a development environment where decisions are based on data.Experience with JSON, Avro, and other data structures and…
90	Sr. Data Analyst	Hybrid remote in Boulder, CO	CE Broker	$80,000 - $115,000 a year	5+ years experience mining data and teeing insights as a data analyst or business analyst.Develop and maintain databases by acquiring data from primary and…
91	Principal Machine Learning Engineer	Remote in Denver, CO 80202	Twilio	Estimated $146K - $184K a year	Track record of defining new data science techniques and best practices that improve the ML model performance.Flexible Spending and Health Savings Accounts.
92	AI Engineer	Boulder, CO 80301	QSC, LLC	$90,000 - $112,000 a year	The AI engineer will focus on computer vision, deep learning, and audio problems.Source, evaluate, and tune AI models for video and audio.
93	Senior Machine Learning Architect	Denver, CO+1 location	Credera Experienced Hiring Job Board	Estimated $168K - $213K a year	Our data capabilities help our clients gain competitive advantage by transforming raw data into insights that enable actionable decision making.
94	Senior Software Engineer, Machine Learning Platform	Boulder, CO	SoundHound Inc.	$136,000 - $166,000 a year	Expand and manage the GPU-based Machine Learning platform.Develop tools to scale ML training and inference.You graduated with a Bachelor's degree in Computer…
95	Principal - Data Engineering - Data Engineering	Denver, CO	Credera	$190,000 - $276,000 a year	Minimum 10 years of hands on development experience with data engineering technologies and ground in data architecture, data science, or data management.
96	Postdoctoral Researcher – Mathematical Optimization for Ener...	Golden, CO 80401	National Renewable Energy Laboratory	$69,400 - $114,500 a year	Department of Energy (DOE) safety protocols and mitigation efforts directed at the COVID-19 pandemic.Upon hire, new employees must submit a request for…
97	AI Engineer	Denver, CO 80202 (Lodo area)	VORTO	$120,000 - $190,000 a year	This role is roughly 80% software engineering and 20% data science.This position is highly entrepreneurial in nature, hence it requires candidates who can…
98	Manager, Pricing & Revenue Management Development and Decisi...	Denver, CO 80239 (Gateway - Green Valley Ranch area)	Frontier Airlines, Inc	Estimated $98.9K - $125K a year	Ability to structure data-driven analytical approaches across a range of quantitative techniques to solve business problems in an efficient, timely manner.
99	Manager, Marketing Analytics - Industry, Marketing Decision...	Denver, CO	Salesforce	$104,000 - $117,000 a year	We are looking for a storyteller who can build a compelling and clear presentation grounded in data.Very strong SQL skills are a core requirement for this role…
100	Big Data Engineer - PySpark	Denver, CO	Logic20/20 Inc.	From $75,000 a year	5+ years of data engineering experience.Experience with streaming data in Spark.Experience building data and computational systems that support machine…
101	Sr. Staff Analyst (Enterprise)	Denver, CO 80202 (Lodo area)	Freedom Financial Network	Estimated $90K - $114K a year	Leverage a variety of datasets including internal CRM data, credit data, as well as other 3rd party complimentary data in order to derive unique insights and…
102	Director of Sales & Business Development - AI, Data Science	Remote in Denver, CO	Xen.ai	None	Xen.AI is looking for Director of Sales & Business Development - AI & Machine Learning solutions, who can bring in AI, Machine Learning, Deep Learning and Data…
