	Title	Location	Company	Salary	Synopsis
204	Natural Language Processing Specialist	Evergreen, CO 80437	Ometrics	Estimated $62.4K - $79K a year	You see patterns when looking at data of user behavior and can see the user’s intention.No NLP experience is required.We will provide all the training needed.
205	Senior Credit Strategy Analyst - Data Scientist	Denver, CO 80202 (Central Business District area)	Funding Circle US	$105,000 - $130,000 a year	Who are we? We want to help small businesses win. That’s why we’re here. We connect small business owners to investors – to create jobs, support local…
206	Senior Data Scientist Lead	Englewood, CO 80112	DISH	$108,000 a year	Department Summary Part art. Part science. All passion. Our marketing and advertising teams bring a unique blend of skills to tell the DISH story and drive…
207	Researcher II/III - Applied Data Scientist for Commercial Ve...	Golden, CO 80401	National Renewable Energy Laboratory	$69,400 - $114,500 a year	Posting Title Researcher II/III - Applied Data Scientist for Commercial Vehicle Decarbonization . Location CO - Golden . Position Type Regular .…
208	Predictive Data Analyst - (Remote) - SimioCloud	Remote in Westminster, CO 80021	Simio Cloud	Estimated $68.1K - $86.3K a year	About Us SimioCloud, a Moore Company, helps non-profits organizations fulfill their missions by delivering best-in-class data and software solutions. We are…
209	[Senior and Staff] Data Scientist, Virtual HQ - Slack	Hybrid remote in Denver, CO	Salesforce	$128,600 a year	To get the best candidate experience, please consider applying for a maximum of 3 roles within 12 months to ensure you are not duplicating efforts. Job…
210	Data Science Strategist, Connectivity Analytics	Denver, CO+2 locations	Facebook App	$136,000 a year	Meta Connectivity's mission is to connect the world to the Metaverse. Together, with hundreds of partners across dozens of countries, Meta is working to help…
211	Data Scientist - Data Exploitation	Littleton, CO 80120+11 locations	DISH	$99,360 a year	At DISH Wireless, we reimagine connectivity through new platforms, new business models and new ways of thinking. Today, we are building America’s first cloud…
212	Senior Data Scientist	Remote in Denver, CO	AArete	Estimated $117K - $149K a year	*Senior Data Scientist* *AArete** is one of a kind when it comes to consulting firm culture**.* AArete is looking for a Senior Data Scientist who will support…
213	Sports Statistician - Basketball	Westminster, CO 80020	Life Time	Up to $13.56 an hour	. Position Summary The Sports Statistician assists in the execution of LT Sport leagues by tracking full statistics for league games. LT Sport leagues may…
214	Senior Data Analyst	Remote in Denver, CO	Hotel Engine	None	Hotel Engine is the world's largest Lodging Performance Network, established to create a richer, more rewarding business travel experience by connecting a…
215	Data Scientist	Denver, CO+2 locations	sharethrough	Estimated $99.4K - $126K a year	Sharethrough is disrupting the legacy digital advertising supply chain as the first ad exchange to auto-enhance every standard impression by rendering a higher…
216	Machine Learning Scientist	Denver, CO+1 location	Teladoc Health	$54,000 - $130,000 a year	The Opportunity The machine learning effort is part of the Data Science team at Teladoc Health. In your role as a Machine Learning Scientist, you will work…
217	Product Analyst, Data and Machine Learning	Englewood, CO 80112	DISH	$108,000 a year	Department Summary DISH is a Fortune 200 company with more than $15 billion in annual revenue that continues to redefine the communications industry. Our…
218	Sr. Data Analyst - Partner Analytics	Remote in Denver, CO 80202	Strive Health	$85,000 - $105,000 a year	Overview: Strive Health Strive Health is built for purpose- to transform a broken kidney care system. We are fundamentally changing the lives of kidney…
219	Machine Learning Engineer, Fraud	Remote in Denver, CO 80202+2 locations	Ibotta	$100,000 - $130,000 a year	Job Description: botta is seeking a Machine Learning Engineer to join our Fraud prevention team and contribute to our mission to Make Every Purchase Rewarding…
220	Data Science Strategist, Connectivity Analytics	Denver, CO+2 locations	Facebook App	$136,000 a year	4+ years of experience in data mining & analytics, understanding of statistical analysis, and fluency in SQL or other data programming languages.
221	Machine Learning Operations Engineer	Denver, CO	sharethrough	Estimated $94.8K - $120K a year	Write Airflow ETLs to prepare data for consumption by ML models.Work with the data science team to facilitate model development and deployment.
222	Data Engineer (Data Science & Innovation Team)	Remote in Denver, CO 80209+1 location	Businessolver	$98,000 - $137,000 a year	Since 1998, Businessolver has delivered market-changing benefits technology and services supported by an intrinsic responsiveness to client needs. The company…
223	Senior Decision Scientist, Fraud	Remote in Denver, CO 80202	Ibotta	$90,000 - $120,000 a year	Job Description: Ibotta is seeking a Senior Decision Scientist to join our Fraud Analytics team and contribute to our mission to Make Every Purchase Rewarding…
224	Senior Data Analyst, Procurement	Denver, CO	Gates Corporation	$107,300 - $131,100 a year	Are you inspired by challenging the status quo? Do you thrive in collaborative environments that drive results? If so, Gates could be for you. Gates is a…
225	Senior Cybersecurity Data Analyst	Highlands Ranch, CO	Visa	$103,300 a year	Company Description Visa is a world leader in digital payments, facilitating more than 215 billion payments transactions between consumers, merchants,…
226	Analyst - Assessment & Research	Jefferson County, CO	Jeffco Public Schools	$95,540 - $111,370 a year	ABOUT THE DISTRICT Jeffco Public Schools, Colorado's largest K-12 school district, with 85,000 students and approximately 14,000 employees, has provided…
227	Data Center Engineering Manager	Denver, CO	Crusoe	Estimated $143K - $181K a year	Crusoe Energy is on a mission to unlock value in stranded energy resources through the power of computation. Take a look at what we do! - https://www.youtube…
228	Senior Data Analyst - Engineering Analytics	Lone Tree, CO 80124	Verizon	$70,000 - $129,000 a year	When you join Verizon Verizon is one of the world's leading providers of technology and communications services, transforming the way we connect across the…
229	Data Scientist- Health Informatics Specialist	Remote in Denver, CO	Wolters Kluwer	$73,500 - $105,000 a year	Basic Function: Health Language is seeking a highly qualified Health Informatics Specialist. This role will bring a consultative approach to identifying and…
230	SDE- Measurement & Data Science- 2021	Boulder, CO+2 locations	Amazon.com Services LLC	$122,200 - $160,000 a year	· 2+ years of non-internship professional software development experience · Programming experience with at least one modern language such as Java, C++, or C#…
231	Senior Decision Scientist, Data & Media Analytics	Remote in Denver, CO 80202	Ibotta	$90,000 - $120,000 a year	Job Description: Ibotta is looking for a Senior Decision Scientist to join our innovative team and contribute to our mission to Make Every Purchase Rewarding…
232	Data Architect	Remote in Denver, CO	CrossCountry Consulting	Estimated $144K - $183K a year	CrossCountry Consulting is a trusted business advisory firm, specializing in Accounting Advisory, Business Transformation, Risk & Compliance, Cybersecurity,…
233	Senior Machine Learning Engineer	Denver, CO (Union Station area)	DISH	$143,000 a year	Are you working in an enterprise class, big data environment? Are you continually pushing yourself and those around you to get better every day? Are you a…
234	Sr. Product Manager, Machine Learning	Boulder, CO 80301	Workday	$130,600 a year	Do what you love. Love what you do. At Workday, we help the world’s largest organizations adapt to what’s next by bringing finance, HR, and planning into a…
235	SDE-T, Machine Learning Platform Team	Louisville, CO+2 locations	Amazon.com Services LLC	$166,600 - $198,400 a year	· 2+ years of non-internship professional software development experience · Programming experience with at least one modern language such as Java, C++, or C#…
236	Architect - Data Engineering	Denver, CO 80202 (Central Business District area)+1 location	Slalom Consulting	$110,000 - $140,000 a year	Denver - 5/5/2022 JO-1906-5325 Apply Who You’ll Work With At Slalom Build we co-create custom software, data and cloud products with clients who are ready…
237	Performance Engineer	Englewood, CO	Travelport	$100,000 - $130,400 a year	Build tools to extract metrics from running workloads and perform data analysis to identify areas of improvement.Travelport is a place of opportunity.
238	Senior Data Science Manager	Broomfield, CO 80020	Sierra Space	$178,005 - $244,756 a year	3+ years leading and maintaining high performance data science or data engineering teams.As a Sr Data Science Manager, you will lead a team of data scientists…
239	Postdoctoral Researcher – Mathematical Optimization for Ener...	Golden, CO 80401	National Renewable Energy Laboratory	$69,400 - $114,500 a year	Postdoctoral Researcher – Mathematical Optimization for Energy Systems.Mandatory COVID-19 Vaccination Protocols.Experience with Pyomo and/or JuMP.
240	AI Engineer	Boulder, CO 80301	QSC, LLC	$90,000 - $112,000 a year	The AI Engineer will work with an experienced team of software and firmware engineers to further develop our Q-SYS platform.Perform other duties as assigned.
241	Solutions Architect (AI) - REMOTE	Remote in Greenwood Village, CO	MiTek Inc.	$120,000 - $150,000 a year	MiTek is a platform innovator and enabler that exists to transform the building industry with better building solutions.Experienced in building AI models.
242	Data Scientist	Denver, CO	AT&T	$75 - $85 an hour	Experience in data science libraries like TensorFlow, Data Visualization, Machine Learning, Salesforce.Location: Onsite in Denver, CO*.
243	Staff Data Scientist	Remote in Denver, CO	DispatchHealth	$180,000 - $210,000 a year	Adept at managing large quantities of data from disparate data sources and creating usable, repeatable features.Skills You'll Need to Bring:
244	Data Scientist	Remote in Denver, CO	GutCheck	$90,000 - $110,000 a year	Support cross-functional efforts to develop databases and data feeds consistent with our product and data strategy.This position can be remote based.
245	Data Scientist - Utility Reliability (Jr - Sr) - REMOTE	Hybrid remote in Denver, CO	E Source	$75,000 - $100,000 a year	Are you a data scientist looking to join an industry-leading team?Proficiency and demonstrated experience in all phases of the data science life cycle working…
246	Data Scientist Advanced Analytics	Denver, CO	Intellibee Inc	Estimated $121K - $154K a year	Experience in data science libraries like Tensor Flow, Data Visualization, Machine Learning, Salesforce.Job Title: Data Scientist Advanced Analytics *.
