	Title	Location	Company	Salary	Synopsis
0	Machine Learning Engineer	Newport News, VA	CTR Group	$91,274 - $218,935 a year	Analyzes machine process data sets using deep learning techniques to discover potential algorithms.Develops real time and post processing algorithms and…
1	Jr. Data Scientist	Fort Eustis, VA 23604	Yorktown Systems Group	Estimated $97.8K - $124K a year	Develop custom data models and algorithms to apply to data sets.Assess the effectiveness and accuracy of new data sources and data gathering techniques.
2	INTERDISCIPLINARY (GENERAL ENGINEER/OPS RESEARCH ANALYST/MAT...	Naval Base, VA	US Immediate Office of the Chief of Naval...	$55,188 - $123,717 a year	Help This job is open to The public U.S. Citizens, Nationals or those who owe allegiance to the U.S. Clarification from the agency U.S.…
3	Machine Learning Engineer	Newport News, VA	Cameron Craig Group	$73,000 - $118,000 a year	Ability to analyze machine process data sets using deep learning techniques to discover potential algorithms.Responsible for requirement management process and…
4	Junior Data Scientist	Hampton, VA	BTAS	Estimated $80.5K - $102K a year	Apply data to develop and provide analytical support to all levels of management.Create, develop, and/or apply existing tools and techniques to conduct data…
5	Data Scientist, TRADOC G-2	Fort Eustis, VA 23604+2 locations	Yorktown Systems Group	Estimated $116K - $147K a year	Training for data stewards, citizen data scientists and novice users of OE data.Experience with a working with and processing data from data streaming source…
6	Data Scientist	Norfolk, VA	Systems Planning and Analysis, Inc.	Estimated $86.7K - $110K a year	Experience with all steps of the data science lifecycle to include delivering data products to customers.Experience with data science and data science best…
7	Data Scientist	Hampton, VA 23665 (Langley Air Force Base area)	TestPros	Estimated $116K - $148K a year	Develop custom data models and algorithms to apply to data sets.Assess the effectiveness and accuracy of new data sources and data gathering techniques.
8	Senior Data Analyst	Norfolk, VA	Cydecor, Inc.	Estimated $92.8K - $118K a year	Five years experience in data analysis for complex projects.Identify, develop, and implement formal processes for data/metric collection, analysis, and…
9	Machine Learning Engineer	Newport News, VA	Computer Enterprises, Inc. (CEI)	From $73,000 a year	Analyzes machine process data sets using deep learning techniques to discover potential algorithms.Develops real time and post processing algorithms and…
10	Senior Data Analyst	Norfolk, VA	Ironclad Technnology Services	Estimated $88.5K - $112K a year	Five years experience in data analysis for complex projects.Identify, develop, and implement formal processes for data/metric collection, analysis, and…
11	SGA Technical - Big Data & Artificial Intelligence	Virginia Beach, VA 23462 (Pembroke area)	PEMCCO	Estimated $84.4K - $107K a year	Build data ingest and data transformation infrastructure.This position help build our Big Data and AI development and production infrastructure and set our…
12	Machine Learning Engineer	Newport News, VA	Oculus Search Partners LLC	$73,000 - $118,000 a year	Ability to analyze machine process data sets using deep learning techniques to discover potential algorithms.Responsible for requirement management process and…
13	Lead Data Scientist	Norfolk, VA 23513 (Foxhall area)	Huntington Ingalls Industries	$93,341 - $145,000 a year	At least 3 years of experience as a data scientist.Experience querying data from SQL databases.Experience rapidly scaling data storage and processing.
14	ACC/A2 - Intelligence Data Management Analyst	Langley AFB, VA 23665 (Langley Air Force Base area)	Apogee Engineering, LLC	Estimated $109K - $138K a year	Demonstrated “data wrangling” skills, such as data integration, preparation, and reshaping.Assist staff in formulating and articulating AF-level positions to…
15	Machine Learning Engineer	Newport News, VA 23607	Liebherr Mining Equipment Newport News Co.	Estimated $80.4K - $102K a year	Analyzes machine process data sets using deep learning techniques to discover potential algorithms.Develops real time and post processing algorithms and…
16	Kubernetes and Docker Cloud Developer	Remote in Norfolk, VA+1 location	Frontier Technology Inc.	Estimated $105K - $133K a year	Experience working with data stores/databases.FTI is seeking an associate level Kubernetes and Docker Cloud Developer to support various military and DoD…
17	Machine Learning Engineer	Newport News, VA	Food Management Search	$73,000 - $118,000 a year	Ability to analyze machine process data sets using deep learning techniques to discover potential algorithms.Responsible for requirement management process and…
18	Data Engineer, TRADOC G-2	Fort Eustis, VA 23604	Yorktown Systems Group	Estimated $89K - $113K a year	Hands-on experience with enterprise level data ingestion, data discovery & analysis, data cleansing, data transformation, data modelling, and data visualization…
19	Machine Learning Engineer	Newport News, VA 23607	Electronic Systems, Inc.	Estimated $82.6K - $105K a year	Analyzes machine process data sets using deep learning techniques to discover potential algorithms.Develops real time and post processing algorithms and…
20	Data Science Project Manager	Hampton Roads, VA	University Technical Services	Estimated $117K - $148K a year	Leverage operational experience and data science background to identify and translate data needs in support of the Intelligence, Surveillance Reconnaissance…
21	Data Scientist - Entry to Expert Level Virtual Hiring Event	United States	National Security Agency (NSA)	$74,682 - $176,300 a year	Passing this examination is a requirement in order to be considered for selection into a data scientist position.
22	Senior Data Scientist	United States	Good Parents Inc.	From $110,000 a year	REST APIs, data pipelines and annotation tools.Experience or familiarity with data exploration, analysis and visualization tools.
23	Senior Data Scientist - International	United States	Indeed	$123,000 - $179,000 a year	Passion to answer Product/Engineering questions with data.Can train and deploy deep learning models for natural language data.
24	Director, Data Science- SMB Labs	Remote in United States	Indeed	$214,000 - $310,000 a year	In this role, you will lead teams of machine learning engineers, scientists, and statisticians who exhibit high energy, deep technical skills, and a drive to…
25	Senior Data Engineer	Remote in United States	SAIC	$125,001 - $150,000 a year	The data engineer also implements data tests for quality and also focuses on improving inefficient tooling and adopting new transformative technologies while…
26	Engineering Staff Scientist	Newport News, VA 23606	Jefferson Lab	$83,300 - $131,700 a year	Ability to analyze and interpret complex data and develop models.Generally, such programs/activities include any foreign-state-sponsored attempt to acquire U.S…
27	Lab Systems Facilitator	Chesapeake, VA 23320 (Greenbrier West area)+2 locations	Childrens Hospital of The Kings Daughters	Estimated $45.8K - $58K a year	Must demonstrate skills necessary to effectively communicate clinical data to physicians and other health care providers.
28	Medical Technologist	Chesapeake, VA 23320 (Greenbrier West area)+2 locations	Chesapeake Regional Healthcare	Estimated $57.6K - $73K a year	Correlate clinical data/diagnoses with test results for reasonableness and accuracy.Offer/suggest alternative and/or repeat testing based on clinical data and…
29	Lead Data Architect	Remote in Newport News, VA	T-Rex Solutions	Estimated $126K - $160K a year	Strong working knowledge on data fabric architectures, data analytics, big data platforms, and data visualization.Ability to obtain DoD Secret Clearance.
30	Senior SRF Accelerator Scientist	Newport News, VA 23606	Jefferson Lab	$126,400 - $199,800 a year	Ability to analyze and interpret complex data and develop models.C) Ability to analyze and interpret complex data and develop models.
31	Accelerator Operator	Newport News, VA 23606	Jefferson Lab	$52,500 - $71,500 a year	Generally, such programs/activities include any foreign-state-sponsored attempt to acquire U.S.-funded scientific research through programs run or funded by the…
32	Communications Manager	Virginia Beach, VA 23452 (Princess Anne Plaza area)	Hazen and Sawyer	Estimated $76.3K - $96.5K a year	Working with graphic designers to visualize information, including data, processes, and physical structures.If you’re skilled at using words and images to make…
33	POST-DOCTORAL RESEARCH SCHOLAR DATA-DRIVEN TURBULENCE	Remote in Hampton, VA 23666	National Institute of Aerospace	Estimated $52.1K - $65.9K a year	The position provides a unique opportunity to contribute to basic data-driven CFD research within the US, as well as to publish in the archival literature.
34	Geomatics Equipment Operator	Virginia Beach, VA 23462 (Thalia area)	VHB	Estimated $29.5K - $37.3K a year	Documents all phases of survey work through clear field notes and data collection.Candidates must have a valid driver’s license and a good driving record.
35	Environmental Technician	Chesapeake, VA 23320 (Greenbrier East area)	Froehling & Robertson, Inc.	Estimated $43.1K - $54.5K a year	Performs basic calculations and computer data entry.Reviews and analyzes historical sources and data to generate reports.0-2 years of related experience.
36	Senior Software Developer	Remote in Virginia Beach, VA 23464	Vectrona, LLC	Estimated $116K - $147K a year	Experience leading multidisciplinary teams in hybrid remote/onsite settings (artists, instructional designers, engineers, data scientists).
37	MIS Reporting Analyst	Newport News, VA 23606	Jefferson Lab	$83,300 - $131,700 a year	Solid database/SQL knowledge with experience developing data structures to support report writing.Use advanced Excel skills to manage and analyze data and…
38	Traffic Analyst	Hybrid remote in Virginia Beach, VA 23462	VHB	Estimated $61.2K - $77.6K a year	Perform traffic data collection, reduction, and analysis.Research and interpret transportation data, community statistics, and demographics.
39	Cryogenic Mechanical Engineer	Newport News, VA 23606	Jefferson Lab	$83,300 - $131,700 a year	Ability to analyze and interpret complex data and systems and develop models.Generally, such programs/activities include any foreign-state-sponsored attempt to…
40	Research Associate	Hampton, VA	Hampton University	Estimated $46.9K - $59.3K a year	Presenting data in lab meetings and at conferences.Research at HUSCRI is focused on defining the mechanisms underlying dermatological disorders, particularly…
41	Chief Data Scientist	Hampton, VA 23665 (Langley Air Force Base area)	TestPros	Estimated $124K - $157K a year	Demonstrate knowledge and ability to deal with challenging data problems such as data mining, feature definition and ML-based data cleaning.
42	Senior Machine Learning Operations Engineer	Remote in Virginia Beach, VA	Harnham	$160,000 - $180,000 a year	Manage all ML engineers, data scientists, and analysts in the Global ML department.Work closely with product teams to ensure the quality of all product data.
43	Machine Learning Engineer	Newport News, VA	Volomagis	$73,000 - $118,000 a year	Ability to analyze machine process data sets using deep learning techniques to discover potential algorithms.Responsible for requirement management process and…
44	DIRECTOR, ADVANCED ANALYTIC DELIVERY - DATA SCIENCE	Virginia Beach, VA	Sentara Healthcare	$47.85 - $66.00 an hour	Automates and hardens complex data processes to remove manual steps and improve efficiency.Analytic Data Engineering & Automation: partners with IT to build…
45	Senior Data Scientist - Delivery Insights	Remote in United States	Indeed	$139,000 - $201,000 a year	Passion to answer Product/Engineering questions with data.Can train and deploy deep learning models for natural language data.
46	Director, Data Science	Remote in United States	Indeed	$253,000 - $367,000 a year	Can fish for data with SQL and Pandas.Can do small data work with Python or R.Can do big data work with Hadoop or Spark.
47	Data Science Manager - Search Ranking and Personalization	Remote in United States	Indeed	$149,000 - $217,000 a year	Ensure delivery of data science solutions, set expectations for what can be done and by when, and prioritize incoming projects.
48	SGA Technical - Big Data & Artificial Intelligence	Virginia Beach, VA 23462 (Pembroke area)	PEMCCO	Estimated $84.4K - $107K a year	Build data ingest and data transformation infrastructure.We are seeking someone experienced with Big Data and Artificial Intelligence (AI) including critical…
49	Machine Learning Engineer	Newport News, VA	Food Management Search	$73,000 - $118,000 a year	Ability to analyze machine process data sets using deep learning techniques to discover potential algorithms.Summary of the Machine Learning Engineer:
50	Kubernetes and Docker Cloud Developer	Remote in Norfolk, VA+1 location	Frontier Technology Inc.	Estimated $105K - $133K a year	Experience working with data stores/databases.Candidates must be able to work both independently and together with scientists and other software engineers in…
51	Data Scientist - Entry to Expert Level Virtual Hiring Event	United States	National Security Agency (NSA)	$74,682 - $176,300 a year	Direct hire data scientists are hired into positions directly supporting a technical mission office.Passing this examination is a requirement in order to be…
52	Director, Data Science	Remote in United States	Indeed	$253,000 - $367,000 a year	You will build and lead teams of data scientists, statisticians, data engineers, and machine learning engineers.Can fish for data with SQL and Pandas.
53	Data Science Manager - Search Ranking and Personalization	Remote in United States	Indeed	$149,000 - $217,000 a year	Currently, the team has one dedicated Scientist - we anticipate that by the end of the year, the team will have nearly ten scientists from new graduates to…
54	Medical Laboratory Manager	Newport News, VA 23606	Tidewater Physicians Multispecialty Group P C	Estimated $52.9K - $66.9K a year	Ensures out-sourced labs receive correct patient billing data.Ability to evaluate utilization statistics and other data and make department recommendations.
55	Quality Assurance Manager	Newport News, VA 23606	Jefferson Lab	$83,000 - $131,700 a year	Ability to analyze and interpret complex data and systems and develop models.Generally, such programs/activities include any foreign-state-sponsored attempt to…
56	EIC Staff Engineer I	Newport News, VA 23606+1 location	Jefferson Lab	$66,300 - $104,900 a year	Works with data acquisition systems such as VME64x, PCI and VXS.Ability to analyze and interpret complex data and systems and develop models.
57	Space Planner	Hampton, VA+1 location	Cherokee Federal	Estimated $54.2K - $68.6K a year	Collaborates with engineers, scientists, and other expert personnel at higher headquarters, installation organizations, municipal planning offices, sister…
58	Cryogenics Deputy Department Head	Newport News, VA 23606	Jefferson Lab	$126,400 - $199,800 a year	Ability to analyze and interpret complex data and systems and develop models.Generally, such programs/activities include any foreign-state-sponsored attempt to…
59	STARS Accountant	Remote in Newport News, VA 23606	Jefferson Lab	$53,300 - $79,900 a year	This will include reconciling account costing information, and analyzing and interpreting accounting data to advise and make recommendations that may pertain to…
60	Fire Detection Technician	Newport News, VA 23606	Jefferson Lab	$56,700 - $77,100 a year	Utilize Jefferson Lab work planning tools to schedule and coordinate planned inspections and tests and record completed inspections and test data using computer…
61	Survey Technician	Norfolk, VA 23513 (Foxhall area)	Colliers Engineering & Design	Estimated $42K - $53.2K a year	Reduce field notes from field collected data into survey/civil grade base maps.Responsible for performing selected drafting assignments, quickly and accurately…
62	Splunk Engineer/Architect-Norfolk, VA	Remote in Norfolk, VA+2 locations	iSenpai	None	This role requires the ability to design, architect and implement Splunk solutions in support of cybersecurity and IT operations analysts and data scientists.
63	Electrical Engineering Manager - RF Group Leader	Newport News, VA 23606	Jefferson Lab	$126,400 - $199,800 a year	Ability to analyze and interpret complex data and systems and develop models.Generally, such programs/activities include any foreign-state-sponsored attempt to…
64	Postdoctoral Fellow	Newport News, VA 23606	Jefferson Lab	$59,500 - $89,300 a year	Conduct, analyze, and present data.Ability to analyze and interpret complex data and develop models.Collaborate with scientists, engineers, and technicians to…
65	Postdoctoral Fellow	Hampton, VA	Hampton University	Estimated $50.9K - $64.5K a year	Presenting data in lab meetings and at international conferences.Research at HUSCRI is focused on defining the mechanisms underlying dermatological disorders,…
66	Staff Mechanical Engineer III	Newport News, VA 23606	Jefferson Lab	$107,400 - $169,600 a year	Ability to analyze and interpret complex data and systems and develop models.Generally, such programs/activities include any foreign-state-sponsored attempt to…
67	Principal Software Engineer ERP	Remote in Virginia Beach, VA 23450	Cell Signaling Technology	Estimated $121K - $153K a year	Experience mapping data structures and ability to troubleshoot data flow processes.Will be part of an international team whose contributions will have a major…
68	Junior Data Science Engineer	United States	Enhance IT	From $32 an hour	Experience with command-line scripting, data structures and algorithms and ability to work in a Linux environment, processing large amounts of data in a cloud…
