	Title	Location	Company	Salary	Synopsis
0	Senior Data Scientist, Customer Engagement Analytics	Irvine, CA	Zillow	$127,100 - $203,000 a year	Extensive experience querying multi-terabyte-sized noisy data sets such as clickstream data.Serve as a mentor and resource to other data scientists on the team…
1	Data Scientist (JO-2204-159264)	Remote in Irvine, CA 92618	Ledgent Technology	$150,000 - $185,000 a year	Data Science Mathematical background- solving algorithms/solutions.Must not afraid to fail and work on their own.Nice to have - working in Cloud environments.
2	Staff Data Scientist	Remote in Irvine, CA 92612	CyberCoders	$180,000 - $225,000 a year	Work closely with data engineers to implement data systems in production.8+ years data Science experience.Large data sets / distributed applications.
3	Senior Data Scientist	Hybrid remote in Irvine, CA	Harnham	$170,000 - $200,000 a year	COMPANY: A growing start up that is working with healthcare data and financial data to create new medical products.Tackle R&D and new innovation problems.
4	Senior Data Analyst	Remote in California	Hire With Jarvis	$120,000 - $170,000 a year	Expertise in SQL and data visualization.Experience working with relational data models and statistical principles.This is a fully remote permanent position.
5	Data Scientist	Cerritos, CA 90703	REVOLVE	Estimated $127K - $161K a year	Conduct complex analysis and build models to uncover key learning form data, leading to appropriate strategy recommendations.PhD in a quantitative field.
6	FUN SENIOR DATA ANALYST WANTED	Newport Beach, CA 92663	Victory Advisory Firm	$100,000 - $120,000 a year	Coding knowledge and experience querying data sources using statistical computer languages both from internal data and 3rd party providers.
7	Data Scientist	Orange, CA+1 location	Gustaine	Estimated $107K - $135K a year	You will lead and drive programs in areas such as statistical algorithms for processing massive time series data, statistical risk modeling and development of…
8	Sr. Data Scientist	Santa Ana, CA	omega solutions inc	Estimated $122K - $154K a year	Field Team Modernization/Intelligent Decision Management - build and support of new predictive data models 2) Coding Transformation - build and support of new…
9	Associate Data Scientist	Irvine, CA 92618+2 locations	Blizzard Entertainment	Estimated $94.3K - $119K a year	Blizzard data scientists design and deploy data-powered products and services that scale to the terabytes of data that Blizzard games generate every day.
10	Data Scientist (Remote)	Remote in Los Angeles, CA 90001	Steel Point Solutions L	Estimated $130K - $165K a year	Develop custom data models and algorithms to apply to data sets.Assess the effectiveness and accuracy of new data sources and data gathering techniques.
11	Data Scientist	Irvine, CA 92614 (San Joaquin Marsh area)	Exsilio	Estimated $86.7K - $110K a year	Perform data mining on large sets of data for various industries.Analyzing potential data patterns to help create effective solutions.
12	Senior Data Scientist	Irvine, CA	MobilityWare	Estimated $133K - $169K a year	Work with the data engineering team on data definition, ETL, data ingestion, data merge, data cleaning and troubleshoot issues for very large datasets.
13	Data Scientist Associate-CXI	Long Beach, CA 90806	SCAN Health Plan	Estimated $74K - $93.6K a year	Data sources including operational data, prospect data, call center data, core admin data, provider data, VOC data, clinical data, and external data.
14	Digital Manufacturing Data Scientist	Irvine, CA 92602 (Lower Peters Canyon area)	Caltrol Inc	$73,067 - $162,608 a year	Develop data solutions for the business needs of our manufacturing clients using data dashboarding, data structuring, data analytics and/or machine learning.
15	Data Scientist	Orange, CA	Gustaine	Estimated $107K - $135K a year	You will lead and drive programs in areas such as statistical algorithms for processing massive time series data, statistical risk modeling and development of…
16	Data Science Associate	Newport Beach, CA	Pacific Investment Management Company LLC	Estimated $98.5K - $125K a year	Your experience extends to implementing and tuning algorithms working on large data.Troubleshoot and assess impact of erroneous data, suggest solutions to…
17	Digital Marketing - Data Analyst	Costa Mesa, CA 92626	Mantek Solutions	$38 an hour	Partner with IT, BI and Operations team to help identify and mend data gaps, source issues, and data inaccuracies.No Corp to Corp and No Sponsorship.
18	Data Scientist - Ads Optimization	Remote in Long Beach, CA	Comcentric	$139,000 - $225,000 a year	Proactively research data and identify opportunities in the data to drive the product roadmap.Helps identify ways to improve data quality and analysis.
19	Data Scientist	Irvine, CA 92618 (Irvine Health and Science Complex area)	Exponent	None	Providing expertise to multi-disciplinary engineering teams in foundational data science domains, including data management, programming, statistics, and data…
20	Data Scientist	Newport Beach, CA	Elevate Technical Consulting	$90,000 - $160,000 a year	Experience with selecting and implementing data warehousing technology.Conduct Data Analysis and Reporting.Perform Data Warehousing and ETL.
21	Sr. Data Scientist, Cloud	Irvine, CA+1 location	Rivian Automotive	Estimated $125K - $158K a year	Work with battery scientists to improve state of health estimation for batteries based on field data models.Build a scalable battery fault identification using…
22	Principal Data Scientist	Newport Beach, CA 92660	Obsidian Security	Estimated $148K - $188K a year	Experience with large volumes of data, algorithms and prototyping.7+ years of experience applying statistical/ML algorithms and techniques to real world data.
23	Data Analyst, Data Products	Remote in Costa Mesa, CA	Veritone	$80,000 a year	Experience with cloud data warehouse / data lake.Experience with ETL and data cleansing.Prioritize actionable analytics and impeccable data integrity.
24	Senior Data Scientist (Remote)	Irvine, CA 92614 (San Joaquin Marsh area)	Sureprep LLC	Estimated $104K - $132K a year	The candidate’s time will be focused on research while also helping to drive required data pipelining and ML-engineering efforts.
25	Senior Data Scientist, Computer Vision	Irvine, CA 92618	Blizzard Entertainment	Estimated $147K - $186K a year	How you think data science can support game development and business.Hands-on applied or research experience developing machine learning models on large image…
26	Senior Information Technology Data Analyst	Hybrid remote in Tustin, CA 92780	The Management Trust	$80,000 - $90,000 a year	Supervise the team of data and software analysts.Helping Employee-Owners resolve help desk issues related to the main ERP application data.
27	Data Scientist (TV Analytics)	Irvine, CA	Intone Networks	Estimated $105K - $133K a year	Roles & Responsibilities: · Develop scalable data models, machine learning algorithms to facilitate data-driven decision making · This role helps in executing…
28	Lead Data Scientist (Marketing Science)	Irvine, CA 92614+1 location	Transcend Digital	Estimated $119K - $151K a year	Experience with SQL, accessing and organizing data drawn from relational database.Build innovative data science products that integrate with real-time services…
29	Vice President of Data Science	Newport Beach, CA 92660	Vital Data Technology	Estimated $118K - $150K a year	Build, motivate and mentor a team of data scientists to grow their skills and careers.Lead a team of data scientists to explore and evaluate the landscape of…
30	Sr. Data Analyst	Remote in Santa Ana, CA 92701	FutureRecruit	$42 - $45 an hour	Partner with data stewards and data owners in developing data standards for critical data elements.Expertise in data modeling and data visualization tools.
31	Cloud CSM, Specialised in Alteryx Machine Learning, Digital...	Irvine, CA	Alteryx, Inc.	None	The Cloud CSM is responsible for ensuring the success of Alteryx's Cloud Products through creating a scalable and repeatable framework for our CSMs & customers…
32	Senior Data Analyst	Remote in Newport Beach, CA 92660	Obsidian Security	Estimated $109K - $138K a year	Work in tandem with data science and data engineering teams to deploy high quality production code.You will gain exposure and expertise in various data science…
33	Machine Learning Engineer	Irvine, CA 92606 (San Joaquin Marsh area)	Spireon	Estimated $121K - $153K a year	Collect data and analyze real world data.Research and develop statistical learning models for data analysis.As a Machine Learning Engineer, you will implement…
34	Senior Human Resources Data Analyst	Long Beach, CA	California State University	$4,500 - $11,566 a month	Minimum of four years' experience as a data or research analyst with demonstrated experience in statistical research methodology, data aggregation and analysis,…
35	Machine Learning Engineer Data Analytics	Commerce, CA 90040	Commerce Casino	Estimated $114K - $145K a year	Hands on experience writing data processing and data pipeline for model development including gathering and building datasets to collect intents, joining and…
36	Sr. Data Analyst	Remote in Irvine, CA 92614	CorVel Corporation	Estimated $73.3K - $92.9K a year	3+ years of data analysis.Develops and implements data collection and modeling systems, along with other strategies that optimize statistical efficiency and…
37	Statistician	La Mirada, CA 90638	SO CAL FCA BASEBALL	Estimated $40.3K - $51.1K a year	Relationship with Jesus and desire to grow as a disciple and servant.Passionate about baseball / previous baseball experience & knowledge.
38	Data Scientist - Bilingual in Mandarin Chinese	Irvine, CA 92618 (East Industrial Complex area)	DigiFinex LLC	Estimated $64.2K - $81.4K a year	Fluency in English & Mandarin Chinese.Currently working remotely due to the pandemic.
39	Manager, Business Intelligence & Data Science Enablement	Aliso Viejo, CA	PlayStation Global	Estimated $140K - $177K a year	7 to 10 years' experience in business intelligence, data analytics and data engineering and data science enablement.Experience with SQL and Big Data.
40	Conversational AI Developer	Anaheim, CA 92801 (West Anaheim area)	West Coast University	Estimated $100K - $127K a year	Bachelor's degree in computer science, information systems, data science, data analytics or a related field.Required: Minim 3 years of experience developing in…
41	Applied Computational Mathematician / Engineer	Orange, CA	Gustaine	Estimated $105K - $133K a year	The position requires collaboration within a multi-disciplinary research environment consisting of mathematicians, computational scientists, computer scientists…
42	NLP Research Scientist	Remote in Irvine, CA	Invitae	Estimated $126K - $159K a year	Formulate healthcare data structuring challenges into ML/NLP solvable problems.Innovate and ideate novel ML/NLP-driven solutions for structuring healthcare…
43	AI Embedded Engineer	Foothill Ranch, CA 92610+1 location	TAE Technologies, Inc.	Estimated $107K - $135K a year	Developing low latency AI algorithms and inference techniques that learn from a continuous stream of data and provide distilled information for plasma control.
44	Senior Business and Data Analyst (No Sponsorships or Recruit...	Irvine, CA	Trace3	Estimated $92.1K - $117K a year	Minimum of 5 years of experience in data analysis and/or analytics (turning data into reports/insights, mining data for insights).
45	Principal Statistical Programmer	Hybrid remote in Aliso Viejo, CA	Glaukos Corporation	Estimated $128K - $162K a year	The role will lead the project specific statistical programming team in generating standard SDTM and ADaM specifications and datasets, tables, listings and…
46	Sr. Machine Learning Engineer (Remote)	Remote in Long Beach, CA	NEXT Trucking	Estimated $134K - $169K a year	Experience creating ML and/or data pipelines.Work with large amounts of structured and unstructured data.The problem domains you will work on will be diverse…
47	SENIOR DATA MINING ENGINEER	Cypress, CA 90630	Trans Techno Infoway	Estimated $135K - $171K a year	Several areas are open including data transformations, data mining algorithms, reporting, and campaign management.
48	Senior Software Engineer, Gameplay/AI	Irvine, CA 92618	Blizzard Entertainment	None	The ideal candidate will have a deep understanding of the challenges involved with making AI experiences and be able to collaborate closely with other subject…
49	Machine Learning Engineer II/III	Rancho Santa Margarita, CA 92688	Applied Medical	Estimated $116K - $146K a year	Experience with data discovery, data aggregation and feature engineering with SQL query writing skills.Develop training and cross-validation data sets for…
50	Development Engineer Telematics - Artificial Intelligence Te...	Long Beach, CA	Mercedes-Benz Research & Development North...	Estimated $86.6K - $110K a year	MBRDNA is headquartered in Silicon Valley, California, with key areas of Autonomous Driving, Advanced Interaction Design, Digital User Experience, Machine…
51	Computer Learning / Machine Learning Engineer	Santa Ana, CA	Iteris, Inc	Estimated $88.5K - $112K a year	We collect, aggregate and analyze data on traffic, roads and driver behavior to generate precise informatics that lead to safer transportation and saving lives.
52	Sr. Manager, Big Data Systems Solution Architecture	Torrance, CA 90502	Herbalife Nutrition	Estimated $138K - $175K a year	Thereafter the platform will have capabilities to ensure data is curated to raise quality and to integrate it, data is cataloged for every business use Globally…
53	Senior Data Analyst - Mobile	Irvine, CA 92606 (San Joaquin Marsh area)	DISH	$75,670 a year	Ensure data accuracy with on-going QA, audits and data integrations across internal teams.Build and execute tagging test cases to ensure that the appropriate…
54	Artificial Intelligence Engineer	Gardena, CA 90248	Kyocera Document Solutions Development America...	Estimated $107K - $136K a year	Translate product specifications into usable design engineering data applicable to the particular assignment.As well as, developing Artificial Intelligence IP.
55	Machine Learning Engineer III	Irvine, CA 92612	Prismatik	Estimated $131K - $166K a year	Data discovery, data aggregation and feature engineering skills.Develops training and cross-validation data sets for machine learning algorithms.
56	Senior Data Analyst, Kroll Government Services	Diamond Bar, CA	Kroll	Estimated $89.4K - $113K a year	5+ years' work experience with data management, data analytics, data forensics, electronic discovery and/or technology focused role.
57	Mid-Level Product Designer- AI (Remote- US Based)	Remote in Los Angeles, CA 90001	New Relic	None	Experience working in SaaS or enterprise software, specially in the display and management of high volumes of data.Experience with Figma and Design Systems.
58	Data Scientist - Entry to Expert Level Virtual Hiring Event	United States	National Security Agency (NSA)	$74,682 - $176,300 a year	Passing this examination is a requirement in order to be considered for selection into a data scientist position.
59	Senior Data Scientist - International	United States	Indeed	$123,000 - $179,000 a year	Passion to answer Product/Engineering questions with data.Can train and deploy deep learning models for natural language data.
60	Senior Data Scientist	United States	Good Parents Inc.	From $110,000 a year	REST APIs, data pipelines and annotation tools.Experience or familiarity with data exploration, analysis and visualization tools.
61	Marketing Data Science Manager	United States	Indeed	$145,000 - $210,000 a year	Participate and help hire, onboard, and coach marketing data scientists.Working knowledge of algorithms and data structures.
62	Senior Statistical Programmer - Oncology	United States	Cytel, Inc (USA)	Estimated $110K - $140K a year	Strong SAS data manipulation, analysis and reporting skills- with strong output programming experience.You will report to the Associate Director, Statistical…
63	Junior Machine Learning Engineer	United States	Enhance IT	From $32 an hour	Experience with command-line scripting, data structures and algorithms and ability to work in a Linux environment, processing large amounts of data in a cloud…
64	Senior Consultant - AI/ML Engineer	United States	Harnham	$140,000 - $150,000 a year	You will also play a leadership role in modestly sized data teams.You will be responsible for delivering on client data science projects from end-to-end.
65	Senior Genomic Medicine Scientist - AI/Machine Learning	United States	Parexel - USA	Estimated $108K - $136K a year	Collaborate with computational scientists, pathologists and experimental scientists to design optimal experiments for model training and evaluation.
66	Senior Statistical Programmer	United States	AL2S3 LTD	Up to $150,000 a year	You will be working with some of the most advanced analytics.
67	Associate Director, Statistical Programming	United States	Syneos Health - USA	Estimated $127K - $161K a year	Develops department Standard Operating Procedures (SOPs) and guidelines, in collaboration with Statistical Programming and Biostatistics group, promoting…
68	Senior Supply Chain Data Analyst	United States	Logistics Plus Inc	$25 - $29 an hour	The Central Planning and Analytics (CPA) team provides analytical and project management.Services for DSPA Global and Regional Planning teams.
69	Principal Statistical Programmer	United States	Parexel - USA	Estimated $119K - $151K a year	Input into and negotiate statistical programming timelines.Ensure that timelines are adhered to coordinate and lead a statistical programming team to…
70	Senior Data Engineer	Remote in United States	SAIC	$125,001 - $150,000 a year	The data engineer also implements data tests for quality and also focuses on improving inefficient tooling and adopting new transformative technologies while…
71	Associate Data Scientist	Irvine, CA 92618+1 location	Blizzard Entertainment	Estimated $94.3K - $119K a year	Blizzard data scientists design and deploy data-powered products and services that scale to the terabytes of data that Blizzard games generate every day.
72	Data Scientist	Long Beach, CA	Relativity Space	Estimated $98.3K - $124K a year	Experience working with high frequency time series data.DSP, data manipulation and sanitization best practices such as outlier detection.
73	BEST SENIOR DATA ANALYST IN THE WORLD WANTED	Newport Beach, CA 92663	Victory Advisory Firm	$100,000 - $120,000 a year	Coding knowledge and experience querying data sources using statistical computer languages both from internal data and 3rd party providers.
74	Associate Data & Machine Learning Engineer	Irvine, CA	Amazon Web Services, Inc.	$82,600 a year	Hands on experience working on large-scale data science/data analytics projects.Hands on experience with building data or machine learning pipeline.
75	Statistician	Newport Beach, CA 92660	Wave Neuroscience	$85,000 - $105,000 a year	Will be expected to data mine output from clinical scales, scores, and time series biometric data to provide insight into relations within the data.
76	Sr. Data Analyst - Marketing/Advertising/Digital Media - Rem...	Remote in Brea, CA 92821+1 location	Mercury Insurance	Estimated $89.7K - $114K a year	Retrieves data from various sources and prepares data for analysis.Reviews data for accuracy and revises methods of data retrieval when necessary.
77	Sr. Quantitative Data Analyst - Systematic Trading	Newport Beach, CA	Pacific Investment Management Company LLC	None	Keen sense of finding data issues.Past experience working as research data analyst.This role will drive the requirements for the firm-wide investment data…
78	Data Scientist	Newport Beach, CA 92660	Obsidian Security	Estimated $131K - $167K a year	Obsidian is seeking a data scientist to tackle a variety of problems that impact the bleeding edge of machine learning and artificial intelligence, with a focus…
79	Sr. Audio Systems AI Engineer	Irvine, CA	Syntiant	Estimated $132K - $167K a year	Collaborate with a cross-disciplinary team to deliver state-of-the-art far field voice quality and speech recognition performance.
80	Senior Data Analyst	Remote in Huntington Beach, CA 92648	Innocean USA	Estimated $94.6K - $120K a year	Assist in defining and designing tech infrastructure and data pipelines for analytic modeling applications (ETL, data automation, data querying, etc.).
81	Senior ML Engineer	Remote in Costa Mesa, CA	Veritone	$100,000 a year	Extensive data modeling and data architecture skills.Discover, create and curate appropriate data sets.Study, transform, and convert data science prototypes…
82	Machine Learning Engineer II	Irvine, CA 92612	Glidewell Dental	Estimated $119K - $151K a year	Develops training and cross-validation data sets for machine learning algorithms.Data discovery, data aggregation and feature engineering with excellent SQL…
83	Data Analyst - Digital Marketing & Optimization : 22-02441	Costa Mesa, CA 92626	Akraya Inc.	Estimated $89.5K - $113K a year	Partner with IT, BI and Operations team to help identify and mend data gaps, source issues, and data inaccuracies.
84	Director, Data Science- SMB Labs	Remote in California	Indeed	$214,000 - $310,000 a year	In this role, you will lead teams of machine learning engineers, scientists, and statisticians who exhibit high energy, deep technical skills, and a drive to…
85	Data Scientist	Remote in Irvine, CA 92614	Avetta, LLC	Estimated $110K - $140K a year	Experience in SQL, exploratory data analytics and visualization.Perform exploratory research on internal and external data using in-depth analysis, machine…
86	Data Scientist – Python, R, NLP	Irvine, CA	Food People	Estimated $114K - $144K a year	Experience developing and shipping a data science product.Transform sales from being driven by intuition to driven by science and data.
87	Best in Class SENIOR DATA ANALYST Wanted	Newport Beach, CA 92663	Victory Advisory Firm	$100,000 - $120,000 a year	Coding knowledge and experience querying data sources using statistical computer languages both from internal data and 3rd party providers.
88	Software Engineer, Gameplay AI	Irvine, CA 92618	Blizzard Entertainment	None	Work with designers, artists and other engineers to bring AI characters to life.Develop simple AI solutions to challenging AI problems within the performance…
89	Sr. Data Scientist, Modeling	Cypress, CA 90630	Yamaha Motor	Estimated $122K - $154K a year	5+ years of experience in data capture and data queries using tools, such as SQL, SAS, etc. is required.5+ years of experience in data analytics, financial…
90	Medical Imaging Software Engineer Experienced in Artificial...	Torrance, CA 90502	HeartLung Corp	$100,000 - $150,000 a year	Job Types: Full-time, Part-time, Contract, Internship.
