	Title	Location	Company	Salary	Synopsis
102	Senior Data Engineer	Remote in United States	SAIC	$125,001 - $150,000 a year	The data engineer also implements data tests for quality and also focuses on improving inefficient tooling and adopting new transformative technologies while…
103	Senior/Principal Statistical Programmer	United States	Parexel - USA	Estimated $110K - $139K a year	As a Principal or Senior Programmer you will be recognized as a subject matter expert, providing technical support and expert advice to internal and external…
104	1008-56 FLSOCO Data Scientist Mid Level	Tampa, FL+3 locations	Global InfoTek, Inc.	Estimated $96.5K - $122K a year	Position Description: *A data scientist will have skills sets of both data analysts and data engineers.Manage and integrate data across dissimilar data sets.
105	1001-49 FLSOCO- Machine Learning Engineer	Tampa, FL+1 location	Global InfoTek, Inc.	Estimated $108K - $136K a year	Analyze appropriate ML algorithms to solve problems; explore and visualize data to understand and identify differences in data distribution that could affect…
106	Data Architect	Remote in Clearwater, FL 33764	GalaxE.Solutions	Estimated $115K - $145K a year	Develop data warehouse schemas and data marts derived from various internal and external data sources that support reporting requirements for business partners.
107	Machine Learning Engineer, Platform	Remote in Clearwater, FL 33759	Recruiting From Scratch	$150,000 - $190,000 a year	Orchestrate large scale machine learning data pipelines (experience with Prefect, Airlflow, Luigi, or similar framework will be helpful).
108	Big Data Engineer	Clearwater, FL 33764	24-7 Intouch	Estimated $96.1K - $122K a year	Load from disparate data sets by leveraging various big data technology e.g. Kafka.Design and implement data modeling.As Big Data Engineer, You Will….
109	Operations Research Analyst/ Data Scientist (OR/SA) Journeym...	Tampa, FL 33621 (MacDill AFB area)	Prescient Edge Federal	Estimated $73.6K - $93.2K a year	Verify and validate data for accuracy to ensure precise analysis results and apply a wide range of analytical data-mining techniques to produce accurate data…
110	Data Scientist	Remote in Tampa, FL	Circle	Estimated $106K - $135K a year	Identify data, metrics and analyses needs for business partners; Initiate, develop and maintain data pipelines and data models that powers dashboards and data…
111	Senior Data Analyst	Tampa, FL 33607	Slide	Estimated $80.3K - $102K a year	Slide is an insurtech bringing together top talent, cutting-edge technology, world-class data science, and a human-centric approach. We work and think…
112	Data Science Lead Analyst	Tampa, FL	Citi	$85,424 - $130,000 a year	At Citi, we are monitoring transactions across traditional and emerging platforms. The Global Data Intelligence & Analytics Team uncovers money laundering,…
113	Sr. Data Analyst	Tampa, FL 33607	sticky.IO, Inc.	Estimated $85.5K - $108K a year	Who We Are: sticky.io is an integrated ecommerce order management and recurring billing platform that plugs seamlessly into any front-end experience.…
114	Analytics Data science and IOT Lead	Tampa, FL	zettalogix.Inc	$50 - $60 an hour	*Analytics Data Science and IOT Lead * Competency Skills; Data Science - Python Work Location; Florida Location; Tampa *Primary Skills : ; * * At least 5…
115	Data Analytics - Practice Lead	Tampa, FL 33607	Whitman, Requardt & Associates, LLP	Estimated $118K - $150K a year	"At Whitman, Requardt & Associates, LLP, we are ""People Focused and Project Driven"". We have been in business for more than 100 years and we are known for our…"
116	Machine Learning Engineer	Tampa, FL	Dogwood Management Partners	$190,000 - $240,000 a year	Are you an experienced machine learning engineer with data pipelines experience and hands-on coding using Python and looking for a permanent, long-term role…
117	Data Architect	Remote in Clearwater, FL 33764	GalaxE.Solutions	Estimated $115K - $145K a year	What You Will Do: Participate in requirements gathering sessions to interpret business needs from conceptual models into logical and physical data models.…
118	Artificial Intelligence/Machine Learning Engineer III (Activ...	Macdill AFB, FL	Redhorse	Estimated $104K - $131K a year	About the Organization Now is a great time to join Redhorse Corporation. Redhorse specializes in developing and implementing creative strategies and solutions…
119	Principal ML & NLP Engineer	Remote in Clearwater, FL 33759	Recruiting From Scratch	$140,000 - $200,000 a year	Who is Recruiting from Scratch: Recruiting from Scratch is a premier talent firm that focuses on placing the best product managers, software, and hardware…
120	Big Data Engineer	Clearwater, FL 33764	24-7 Intouch	Estimated $96.1K - $122K a year	About 24-7 Intouch 24-7 Intouch is a global customer care and technology company that provides value-driven, future-forward solutions. For over 20 years, we…
121	1019-68 FLSOCO Data Scientist Mid Level	Tampa, FL+3 locations	Global InfoTek, Inc.	Estimated $92.7K - $117K a year	Position Description: A data scientist will have skills sets of both data analysts and data engineers.Manage and integrate data across dissimilar data sets.
122	Data Scientist I	Tampa, FL 33621 (MacDill AFB area)	Knowesis, Inc.	Estimated $62K - $78.6K a year	Enter and analyze data within government systems.Experience with data visualization applications is preferred.Location: Client site at MacDill AFB, FL.
123	Senior Data Scientist	Oldsmar, FL	Humanity	Estimated $118K - $149K a year	Take analytical objectives and define data requirements.Our approach marries proprietary NielsenIQ data with other data sources to help clients around the…
124	Statistical Data Analyst	Tampa, FL 33620 (Terrace Park area)	University of South Florida	$52,000 - $55,000 a year	Manages datasets and ensures data quality (data cleaning); combines, organized and cleans data collected from the field.Job Title: Statistical Data Analyst.
125	Lighting Data Scientist	Tampa, FL 33619	Teco Energy	Estimated $68.7K - $87.1K a year	Create, conceptualize, design and maintain data processes, data reliability, data efficiency, data quality, data storage, data models, data performance, and…
126	Practice Leader – Analytics, BI, Data Science and Data Engin...	Remote in Saint Petersburg, FL	iSOCRATES	Estimated $118K - $150K a year	Should be strong in data storytelling.Proficiency in data analysis including pivot tables and advanced functions.Reports to: Chief Executive Officer.
127	Computer Vision and Machine Learning Scientist	Tampa, FL 33602 (Downtown area)	Dewberry	Estimated $50.6K - $64K a year	As a data scientist, you can turn these complex data sets into useful information to help deliver on national-level challenges.
128	Statistical Ops Analyst (US Remote)	Remote in Tampa, FL	Humanity	Estimated $70.8K - $89.6K a year	Experience handling, manipulating and analyzing data.Take lead role in recommending and implementing new and improved ways to effectively process data and…
129	Senior Engineer Machine Learning	Tampa, FL	Humanity	Estimated $111K - $140K a year	3+ years of experience with relational data (Oracle, Postgres, Snowflake) and SQL.These systems enable our users to interact with machine learning and data…
130	Senior Data Scientist/Machine Learning Engineer	Remote in Clearwater, FL 33759+4 locations	Recruiting From Scratch	$140,000 - $200,000 a year	Work with cross-functional teams, including lawyers, data protection and security researchers.Gather training data, and train and evaluate state-of-the-art…
