	Title	Location	Company	Salary	Synopsis
0	Data Scientist Associate	Tulsa, OK 74171+1 location	Oral Roberts University	Estimated $68.8K - $87.2K a year	The Associate will employ techniques such as data mining, statistical analysis, data modeling, machine learning, data analytics, forecasting, and integration of…
1	ADAS Software Engineer, Machine Learning	Remote in Tulsa, OK	Canoo Technologies Inc.	Estimated $100K - $127K a year	The engineer develops software for data collection, data compression, data uploading/downloading using cloud and on-prem servers.
2	Director, ADAS Algorithms and R&D	Remote in Tulsa, OK	Canoo Technologies Inc.	Estimated $98.8K - $125K a year	The Director will develop ADAS future strategies, roadmaps, and execution plans for Canoo.Lead and mentor the following teams: algorithm development team,…
3	Kubernetes and Docker Cloud Developer	Remote in Tulsa, OK	Frontier Technology Inc.	Estimated $103K - $130K a year	Experience working with data stores/databases.FTI is seeking an associate level Kubernetes and Docker Cloud Developer to support various military and DoD…
4	Data Scientist - Entry to Expert Level Virtual Hiring Event	United States	National Security Agency (NSA)	$74,682 - $176,300 a year	Passing this examination is a requirement in order to be considered for selection into a data scientist position.
5	Senior Data Scientist - International	United States	Indeed	$123,000 - $179,000 a year	Passion to answer Product/Engineering questions with data.Can train and deploy deep learning models for natural language data.
6	Senior Data Scientist	United States	Good Parents Inc.	From $110,000 a year	REST APIs, data pipelines and annotation tools.Experience or familiarity with data exploration, analysis and visualization tools.
7	Senior Data Engineer	Remote in United States	SAIC	$125,001 - $150,000 a year	The data engineer also implements data tests for quality and also focuses on improving inefficient tooling and adopting new transformative technologies while…
8	Junior Data Science Engineer	United States	Enhance IT	From $32 an hour	Experience with command-line scripting, data structures and algorithms and ability to work in a Linux environment, processing large amounts of data in a cloud…
