	Title	price	species	age	gender	description	seller_name	seller_location	seller_type	listing_type	pet_type
90	Beautiful vivarium and female corn snake 	£100	Snake	3 years	Female	I adopted Suki 2 years ago and I guess her age to be around 3 - 4 years old. She's very placid and I used to handle her a lot but she's been left alone for about a year now so is a little timid and ne	Si S.	Manchester	Individual	sale	reptiles
91	Corn snake 	£100	Corn Snake	4 years	Male	4 year old friendly corn snake , handles well . Good eater . Full set up including tank / heat Matt/ all accessories £100 ovno 	jimmy y.	Manchester	Individual	sale	reptiles
92	Axolotl + Full setup and many accessories	£170	Axolotl	2 years	Male	"I have for sale a much loved axolotl, this ""Dirty Lucy"" with full tank and setup ready to go to a new home, unfortunately I just don't have the space or time as I am not going more and more into the o"	Daniel T.	Northwich	Individual	sale	reptiles
93	Hermann tortoise for sale	£120	Hermann Tortoise	2 years	Female	"Hermann 10 month old
Tortoise, incubated
at 30 - 32 degrees so from experience they will be females, but I cant garuntee this.
Hand reared for first few weeks and
Fed only
on a weed / flower only diet"	andy h.	Whitchurch	Individual	sale	reptiles
94	Albino Pied Royal Python	£500	Python Snake	8 months	Male	"I have a male Albino Pied Royal Python for sale.

He is eating well.

Collection is from Stoke-On-Trent, or delivery can be arranged for extra cost."	chris S.	Stoke-on-Trent	Breeder	sale	reptiles
95	Banana Enchi Pastel 50% het Clown	£200	Python Snake	10 months	Male	"I have a male Banana Enchi Pastel 50% het Clown Royal Python for sale.

He is eating well.

Collection is from Stoke-on-Trent, or delivery can be arranged for an extra cost."	chris S.	Stoke-on-Trent	Breeder	sale	reptiles
96	Banana Enchi 50% het Clown Royal Python	£175	Python Snake	10 months	Male	"I have a male Banana Enchi 50% het Clown Royal Python for sale.

He is eating well.

Collection is from Stoke-on-Trent, or delivery can be arranged for an extra cost."	chris S.	Stoke-on-Trent	Breeder	sale	reptiles
97	Banana Enchi Royal Python	£200	Python Snake	2 years	Male	"I have a CB19 male Banana Enchi Royal Python.

He eats well.

Collection is from Stoke-on-Trent, or delivery can be arranged for an extra cost."	chris S.	Stoke-on-Trent	Breeder	sale	reptiles
98	Banana Enchi 100% het Clown	£225	Python Snake	4 years	Male	"I have a CB17 male Banana Enchi 100% het Clown for sale, proven breeder.

He is eating well.

Collection is from Stoke-on-Trent, or delivery can be arranged for an extra cost."	chris S.	Stoke-on-Trent	Breeder	sale	reptiles
99	Male Pink Tongue Skink	£200	Skink	8 years	Male	"Proven male, has sired 5 litters. 

Reason for rehoming is because he no longer tolerates other males and needs a permanent tank of his own.

I will also be selling various equipment including several"	Luxio Bengals	Northwich	Breeder	sale	reptiles
